Artist,Song,Lyrics
Aram MP3,Heros Tgherq,"
[Արամե]

Երբ գիշերն է իջնում սահմանին

Մոտենում է հանկարծ թշնամին

Դու ես աչքերիս առա իմ մայր


[Միհրան Ծառուկյան]

Աղոթքի ձայնն է քո իմ մտքում

Ամեն մի փամփուշտից ինձ փրկում

Լուռ ես.. հավատով սպասում որ կամ


[Արաբո իսպիրյան]

Թե ու ընկնեմ ես, տեղն իմ եղբայրը

Կբերի խաղաղ երկինք քեզ Մամ


[Արամե, Միհրան Ծառուկյան, Արաբո իսպիրյան]

Հերոս տղերքը մեր ելան բարձոինքն ի վեր

Զոհվել չհա տղերք կռվի ժամին

Սա հայրենիքն է մեր սուրբ հող ու հորովել

Պիտի ծնկի գա թշնամին


[Մկրտիչ Արզումանյան]

Ես մի ծիլն եմ ծնված այս հողից

Ժառանգած հաղթանակն իմ հորից

Հայրս որ կռվում հերոս դարձավ


[Aram MP3]

Հերոսից հերոսներ են ծնվում

Թե ընկնեմ հորս պես ես կռվում

Կյանքս, կիմանամ իմաստ կտա
"
Aram MP3,Not Alone,"
[Verse 1]

You're all alone, you're all alone

No shoulder wants you to lean on

You thought this world was too cold

And you've made up a whole new world

Don't cry, don't cry, little bird

Though you are scared and you're hurt

You're gonna wake up, it's only a dream

And why do dreams make people scream?


[Chorus]

You're not alone

You're not alone

You're not alone

You're not alone

You're not alone

You're not alone


[Verse 2]

What if it's all in one kiss?

That turns all seeds into trees, yeah

The strongest wind into a breeze

Enter all doors without keys, yeah

What if it's all in one kiss?

That turns all seeds into trees

The strongest wind into a breeze, yeah

What if it's all in one kiss?
"
Aram MP3,Kuzes,"
Տե՛ս, քո դիմաց կանգնած եմ ես

Մի տղա, ով պարզապես

Շատ սիրում է քեզ:

Իմ աչքերն ես դու

Քեզանով ես այս կյանքում

Զգացմունքներս եմ կարդում

Որ սեր ունեմ արթուն:


Կուզես աշխարհն առանց քարտեզ

Դու միայն ասա, ինչ-որ ուզես:


Կուզե՞ս, քեզ համար հորինեմ

Արևի փոխարեն մեծը ավելի:

Եթե դու կուզե՞ս, աստղերից հենց հիմա

Կշարեմ քո դիմաց անունը քո էլի:


Ամեն, ամեն ինչ, ինչ-որ կուզես


Ուր երկուսով նայենք մենք լուռ

Հենց այդ կետը ամենուր

Դառնալու է դուռ

Երազանք դեպի

Երկնքին հիմա կպիր

Կտեսնես ձեռքիդ ափին

Սեր է գրվելու...
"
Aram MP3,Kochari  (Քոչարի),"
Դարերի խորքից եկած մեզ

Պար են պարում մեր պապերը

Նենց են պարում որ շարժում են

Սարը, քար էս պարերը

Մեր պապերն ու մեր պարերը

Հիմք են ստեղծում որ ապրելը

Պինդ պահի անցյալի թելը

Էդ պարի մեջ կա քո գենը

Ուս ուսի առյուծի նման վեհ են շարժումները

Պինդ պահիր ուսերդ ու հողին ամուր

Խփիր ոտքերդ

Մեր պապերն ու մեր պարերը

Հիմք են ստեղծում որ ապրելը

Պինդ պահի անցյալի թելը

Էս պարի մեջ կա քո գենը

Ռեյխտագից մինչև Մուշ ու Վան մեր պապերը

Միացիր ամեն ինչ մոռացիր

Գոռա սրտիդ բառերը

Որ լինես ուժեղ ու միշտ խրոխտ

Ինչպես պարն ու պապերդ

Պինդ պահի անցյալի թելը

Էս պարի մեջ կա քո գենը


Տուր ինձ քո ձեռքը, հաղթողը մենք ենք

Հոգիս երգում է լեռների երգը

Տուր ինձ քո ձեռքը, գոռան տղերքը

Էս պարը զենք է, դե պարի քոչարի
"
Aram MP3,Heriq Eghav,"
Մենակ իմանա նա, լավա

Որ մենակ մնալը դժվարա

Թեկուզ անհնարա

Բայց լավա, շատ լավա։


Pre chorus

Թող գնա նա, գնա նա

Գնա նա, հեռանա

Գնա նա, տանը մնա նա

Հեռանա։


Chorus

Հերիք եղավ, բոլ եղավ

Անջատում եմ ես էսօր

Հերիք եղավ, բոլ եղավ

Ծախսելու եմ հավեսով։

Թվերա որ, թվերա որ

Հերիք եղավ, բոլ եղավ

Էսօր  ես մենակ եմ։


Հերիք եղավ, բոլ եղավ

Անջատվում եմ ես էսօր

Հերիք եղավ, բոլ եղավ

Ծախսելու եմ հավեսով։

Թվերա որ, թվերա որ

Հերիք եղավ, բոլ եղավ

Էսօրվանից մենակ եմ։
"
Aram MP3,Alabalanica,"
Բռնել ես դու բիթը, ցցել ես քո քիթը

Ու քեզ միևնույն եմ ես ու իմ վերջին հիթը

Քեզ միևնույն են գույները, մարդիկ ու անունները

Քեզ վարակել են 90-ականների ձայները


Չմո-չմոտենաս, չխանգարես

Թող ֆուլ վայելի ռետրո դենսը էս

Ռետրո ռետրո ռետրո ռետրո դենսը էս

Ռետրո ռետրո ռետրո ռետրո դենսը էս


Որ կանչում եմ մոտ արի

Հայելու դեմը մի պարի

Չվախենաս, չփախչես

Ես ուզում եմ...


Ալաբալանիցա, դուսկաբանիցա

Էս ձենը քո ներսիցա, բիթը կասետիցա

Ալաբալանիցա, էն թվերիցա

Էս ձենը քո ներսիցա, բիթը կասետիցա


Ալաբալանիցա...Ալաբալանիցա


Էս ձենը հեռվիցա, էն հին թվերիցա

Ուր Scooter-ն էր խոսում ձկից ու դոկան էր պիցցա

Էս ուր ես դու խորացել, բացել ես հին դռները

Քեզ վարակել են 90-ականների ձայները
"
Aram MP3,Dashterov,"
Մարմար մարմինդ դալար

Իմ յարի բոյը չինար

Թամամ աշխարհ ման եկա

Նախշուն ջան ես քեզ գտա:


Էրվում եմ, էրվում եմ իմ սրտի մեջ կարոտ:

Հեռվում եմ, հեռվում եմ, երբ եմ գալու քեզ մոտ:


Սիրտս քար է, անջիգյար

Ինձ թողել ես առանց յար

Ես տխուր ու դարդիման

Ուռենու բախտի նման:


Էրվում եմ, էրվում եմ, իմ սրտի մեջ կարոտ

Հեռվում ես, հեռվում ես, երբ ես գալու ինձ մոտ:


Օտար ու ամայի ճամփեքով

Քեզ հասնեմ արևոտ երկնքով։


Դաշտերով , լեռներով, ձորերով մոտդ եմ գալիս

Անհամբեր է սիրտս

Դաշտերով, լեռներով, ձորերով, որ գտնեմ յարիս

Տուն արի հոգիս։

Դաշտերով ,լեռներով, ձորերով մոտդ եմ գալիս

Դու ես ուշքն ու միտքս

Դաշտերով ,լեռներով, ձորերով, որ գտնեմ յարիս

Վերջ տուր տանջանքիս։
"
