Artist,Song,Lyrics,Translated_Lyrics
ՌՈՒԲԵՆ ՀԱԽՎԵՐԴՅԱՆ,ՀԻՆ ԸՆԿԵՐ,"
	Հեռացան մեզնից մեր հին օրերը

	Մոտենում են նոր ժամանակներ

	Ուր ես դու կորել իմ բարեկամս

	Ուր ես դու կորել իմ հին ընկեր

	 

	Հին ընկեր իմ անգին ընկեր 

	Արդյոք ուր ես դու կորել

	Հին ընկեր իմ անգին ընկեր 

	Չեմ կարող ես քեզ գտնել 

	 

	Ինչ կախարդ է քեզ կախարդել 

	Ինչ թակարդ ես դու ընկել

	Հին ընկեր իմ անգին ընկեր 

	Ես կարող եմ քեզ փրկել 

	 

	Հեռացան այն հին ու գորշ օրերը

	Մոտեցան պայծառ ժամանակներ

	Փոխվեցին կարծես թե հին տերերը

	Նրանց տեղ եկել են նոր տերեր

	 

	Նոր տերերի մոտ դեռ խրախճանք է

	Նոր տերերը դեռ չեն կշտացել

	Հին տերերի մոտ անհուն զարմանք է

	Թե նորերն ինչքան են հղփացել

	 

	Հին ընկեր իմ անգին ընկեր 

	Արդյոք նույնն ես մնացել

	Նիհարել ես դու թե լցվել 

	Ու հետույքդ հաստացրել

	 

	Հին ընկեր իմ անգին ընկեր 

	Քեզ պաշտոն դեռ չեն տվել

	Քեզ իմ լավ իմ անգին ընկեր 

	Նոր տերերը չեն գնել

	 

	Այս աշխարհը նույնն է բարեկամս

	Չփորձես հանկարծ նրան փոխել

	Փոխվեցին կարծես հին տերերը

	Նորերը խաղում են հին դերեր

	 

	Եվ մեր նորընծա ու խիստ տերերը

	Մեզ դարձյալ փորձում են վախեցնել

	Մենք ասում ենք դրանց տիրու մերը

	Մահը մեր վաղուց ենք մենք տեսել

	 

	Հին ընկեր իմ անգին ընկեր 

	Արդյոք նույնն ես մնացել

	Ում հետ ես արդյոք հաց կիսել

	Եվ ում հետ ընկերացել

	 

	Հին ընկեր իմ անգին ընկեր 

	Դու քո գույնը չես փոխել

	Քեզ իմ լավ իմ անգին ընկեր 

	Նոր տերերը չեն

	 

	Մեզ սեղմում են նոր ժամանակները

	Ինչպես երկաթե պնդօղակներ

	Մինչև վերջ ձգեք ձեր գոտիները

	Պետք է դիմանալ ու դիմադրել

	 

	Եվ մեր անտարբեր ու բութ դեմքերը

	Դարձել են արդեն մութ դիմակներ

	Մենք ընբռնումով տանում ենք բեռը

	Որը չենք կարող չհանդուրժել

	 

	Հին ընկեր իմ անգին ընկեր 

	Արդյոք նույնն ես մնացել

	Ում հետ ես արդյոք հաց կիսել 

	Եվ ում հետ ընկերացել 

	 

	Հին ընկեր իմ անգին ընկեր 

	Դու քո գույնը չես փոխել

	Քեզ իմ լավ իմ անգին ընկեր 

	Նոր տերերը չեն կերել
","We left our old days away

New times are approaching

Where are you lost my friend?

Where are you lost my old friend?



Old friend my priceless friend

Whero u got lost

Old friend my priceless friend

Can't find you



What witch is to enchant you?

What trap you fell

Old friend my priceless friend

I can save you



The old and gray days left

Approached bright times

Changed the old owners

They came to them new owners



The new owners are still a party

The new owners have not been satisfied yet

An inbetween the old owners is an impurly surprise

Or how much did the new ones have been linked?



Old friend my priceless friend

Did you stay the same?

I lose weight or filled

And have the backstop



Old friend my priceless friend

Position you have not been given yet

You my good my priceless friend

The new owners did not buy



This world is the same with my friend

Don't try to suddenly change him

Changed the old owners

New plays old roles



And our new and strict owners

We are trying to intimidate us again

We say their ownership

We have seen death for ourselves



Old friend my priceless friend

Did you stay the same?

Who did you share bread with?

And with whom became friends with



Old friend my priceless friend

You didn't change your color

You my good my priceless friend

The new owners are not



We are pressing new times

Like iron ribilities

Till the end Stretch your belts

Have to endure and resist



And our indifferent and thumb faces

Have become already dark masks

We are taking the load at

Which we cannot not tolerate



Old friend my priceless friend

Did you stay the same?

Who did you share bread with?

And with whom became friends with



Old friend my priceless friend

You didn't change your color

You my good my priceless friend

The new owners did not eat"
ՌՈՒԲԵՆ ՀԱԽՎԵՐԴՅԱՆ,ՆԱԽԱԳԱՀԱԿԱՆ ԸՆՏՐՈՒԹՅՈՒՆՆԵՐ,"
	Երկնքում ճախրող ոստիկաններ

	Ոստիկանատիպ մուրացկաններ

	Մուրացկանակերպ անգույն դեմքեր

	Ու կերածխմած ուրվականներ

	 

	Բացուխուփ անող շատ բերաններ

	Ասես ափ նետած անթիվ ձկներ

	Հերթերում պատերազմող ձեռքեր

	Ով է այս ամենը հնարել

	 

	Սա ինչ հանելուկ է սա շուտասելուկ է

	Չի լսվում ոչ ձայն ոչ պատասխան

	Սա ինչ հանելուկ է սա շուտասելուկ է 

	Ով է Տեր Աստվածն ով սատանան

	 

	Որովայնամիտ ու բութ դեմքեր

	Եվ անթիվ դատարկ որովայններ

	Բարքերի անկում անկման բարքեր

	Ու անկման եզրին կանգնած կարգեր

	 

	Կուսականորեն շիկնած լրբեր

	Կուշտուկուռ կերածխմած սրբեր

	Դզած ու փչած ու կեղծ կույսեր

	Կույսերից հիասթափված հույսեր

	 

	Սա մի կուսանոց է թե սա բոզանոց է

	Ասեք ձայնազուրկ իմաստուններ 

	Ուր է անգլուխը քաղաքագլուխը

	Որն ունի ոռի վրա ծալքեր

	 

	Անգթությունից կոտրած սրտեր

	Ու գթաբաժան առաքյալներ

	Խորհրդարանում խորհող այրեր

	Ու նմանատիպ դեպքի վայրեր

	 

	Մտավորական քրեականներ

	Կիսագողական ոստիկաններ

	Ղումարի նստած դասախոսներ

	Ու նստածելած շատախոսներ

	 

	Իսկ կարգին տղերքը ում ձեռքին է զենքը

	Մահվան հետ գիշեր են լուսացնում

	Իսկ ազգի տականքը մեր ազգի քերանքը

	Թալանում է ազգը ու պղծում

	 

	Նախագահական ընտրություններ

	Եվ անընտրելի նախագահներ

	Հալումաշ եղած անթիվ ստեր

	Ով է այս ամենը բեմադրել

	 

	Գեներալատիպ մեծ գրողներ

	Գրողի տարած գեներալներ

	Գեներալամիտ նախարարներ

	Ու նմանատիպ տարբեր բաներ

	 

	Ով է նստած վերը դրա տիրու մերը

	Չի լսվում ոչ ձայն ոչ պատասխան

	Որն է իրականը տերն ու տիրականը

	Էս անտերուդուրս անտերության
","Police in heaven

Police with beggars

BREAKFAST POLITICS

And ghosts of eating



Many mouths in advancing

As if countless fish thrown

Teits warring hands

Who invented all this?



This is what a puzzle this is quick

No vote no reply

This is what a puzzle this is quick

Who is the Lord God who the devil



Abdominal and thumb faces

And uncountable empty abdomins

Morald's decline in decline

And categories standing on the edge of the fall



Guilt

Certified Cederated Saints

Wasted and blown and false virgins

Disappointed hopes for virgins



This is a party or this is a boz

Say voiceless wisks

Where is the headland?

Which has folds on a step



Heartfolded heart

And the apostles of the Civil

Patent widows in the parliament

And sites like that



Intellectual criminals

Semi-stemakan police

Tsumar sitting lecturers

And LISTEN WORKS



And the order of the guys in whom the weapon is in

They brighten the night with death

And the scarf of the nation is our nation's gross

Loot the nation and defiling



Presidential elections

AND PRESIDENTIAL PRESIDENTS

Half-lying

Who has all this stage?



Generous large writers

Writer generals

Generous ministers

And different things like



Who is sitting above the owners of it?

No vote no reply

What is the real owner and the Lord?

This Anteruduction Antordies"
ՌՈՒԲԵՆ ՀԱԽՎԵՐԴՅԱՆ,ՓՈՔՐԻԿ ԻՇԽԱՆ,"
	Ձյան սպիտակ վերմակի տակ

	Հողը տաք է այնքան տաք

	Ինչպես շունչը իմ մանկան

	Քնի մեջ առավոտյան

	 

	Քնի մեջ առավոտյան

	Կա մի պահ հավերժության

	Փոքրիկիս իր երազում

	Հրեշտակներ են այցելում

	 

	Նա ժպտում է քնի մեջ

	Երբ երազն է օրորվում

	Բայց երազը ունի վերջ

	Երբ որ օրն է արթնանում

	 

	Երբ որ օրն է արթնանում

	Իր հետ ուր է մեզ տանում

	Թե երազ է դա մի նոր 

	Որ տեսնում ենք ամեն օր

	 

	Պղտոր գետը հոգսերի

	Մեզ տանում է դեպի վար

	Տուր ինձ ձեռքդ բարեկամ

	Մենք պետք է օգնենք իրար

	 

	Մութ է մութ է մեր ճամփան

	Չի երևում ոչ մի բան

	Խոսքերը մեկ են արել

	Տեր Աստվածն ու սատանան

	 

	Քեզ դեռ շատ կտրորեն

	Կծաղրեն ու կգնան

	Հետո կամ կփոշմանեն

	Կամ ուժեղ կհռհռան

	 

	Բայց որքան էլ տրորեն

	Տրորեն ու հռհռան

	Չես դառնա դու սրիկա

	Մանկության փոքրիկ իշխան

	 

	Հրաշքները չեն մեռնում

	Նրանք կան ու կմնան

	Թե հավատ կա քո սրտում

	Եվ կա սերը անանձնական

	 

	Հրաշքները կմնան

	Քանզի կա փոքրիկ իշխան

	Որ սիրում է տիեզերքն

	Ու աշխարհը այս դաժան

	 

	Մի լքիր ինձ հետ մնա

	Մանկության փոքրիկ իշխան

	Միասին պիտի անցնենք

	Ճանապարհը Փորձության

	 

	Մութ է մութ է մեր ճամփան

	Չի երևում ոչ մի բան

	Խոսքերը մեկ են արել

	Տեր Աստվածն ու սատանան

	 

	Ձյան սպիտակ վերմակի տակ

	Հողը տաք է այնքան տաք

	Ինչպես շունչը իմ մանկան

	Քնի մեջ առավոտյան

	 

	Քնի մեջ առավոտյան

	Երբ որ ցողը վաղորդյան

	Մարգարիտ է շաղ տալիս

	Վախենում եմ սիրելիս

	 

	Մութ է մութ է մեր ճամփան

	Չի երևում ոչ մի բան

	Խոսքերը մեկ են արել

	Տեր Աստվածն ու սատանան
","Snow White blanket

The soil is hot so hot

How to breathe my baby?

In sleep in the morning



In sleep in the morning

There is a moment of eternity

My little my dream

Angels are visiting



He smiles in sleep

When the dream is cradle

But the dream has an end

When which day wakes



When which day wakes

Where does it take us?

Is it a dream that a dream?

That we see every day



The muddy river worries

Takes us to down

Give me your hand friend

We have to help each other



Darkness is dark on our way

Nothing is visible

The words have done one

Lord God and Satan



You are still very cut

They will be frowned and will go

Then or will bump

Or will be strong



But no matter how much

Tribly and a ran

You won't be a scoundrel

Little Prince of Childhood



Miracles don't die

They are and will stay

Is there a faith in your heart

And there is love for the impersonal



Miracles will stay

For there is a little prince

That loves the universe

And the world of this cruel



Don't leave me to stay with me

Little Prince of Childhood

We have to go together

The way to test



Darkness is dark on our way

Nothing is visible

The words have done one

Lord God and Satan



Snow White blanket

The soil is hot so hot

How to breathe my baby?

In sleep in the morning



In sleep in the morning

Whenever the dew of the morning

Pearls sprinkle

I'm afraid my dear



Darkness is dark on our way

Nothing is visible

The words have done one

Lord God and Satan"
ՌՈՒԲԵՆ ՀԱԽՎԵՐԴՅԱՆ,ԹԵ ԻՆՉՈՒ ԵՆ ՊՈԵՏՆԵՐԸ ԵՎ ՇՆԵՐԸ ԸՆԿԵՐՆԵՐ,"
	Ես ու լուսինը միասին

	Մոտեցանք սառած ջրափոսին

	Եվ գիշերը ժամը երկուսին

	Երգեցինք այս երգը այն մասին

	 

	Թե ինչու են պոետները

	Եվ շները ընկերներ

	Որովհետև նրանք գիշերը

	Սիրում են լուսնոտ երգեր

	 

	Որ մեր կյանքն աղավաղում են 

	Ցերեկներն անիրական

	Գիշերները մենք գտնում ենք

	Մեր դեմքերը իսկական

	 

	Մութ ամպեր մի փակեք լուսնի դեմքը

	Թույլ տվեք զրույցը ավարտել 

	Ես լուսինն այն շունն ու ջրափոսը

	Շատ վաղուց իրար չենք հանդիպել

	 

	Շունը որ կանգնած էր իմ կողքին

	Դունչը մոտեցրեց ջրափոսին

	Նա այնտեղ տեսավ կլոր լուսնին

	Եվ ասաց դատարկ այդ ափսեին

	 

	Որ իր հայրը ցեղական էր

	Մայրն անհայտ ցեղի մի շուն

	Նրանց կապն օրինական չէր

	Ու ծնվեց մի որբ անտուն

	 

	Որ անվերջ այս գզվռտոցը

	Հանուն մի կտոր հացի

	Ապրելու միակ միջոցն է

	Որ կյանքից չուտես քացի

	 

	Կյանքը մեր կեղտոտ այս ջրափոսն է

	Ուր լուսնի դատարկ ափսեն է շողշողում

	Կան մարդիկ որոնք այնտեղ թքում են

	Իսկ ոմանք լուսին են որոնում

	 

	Եվ հանկարծ ջրափոսից սառած

	Դուրս լողաց լուսինը սփրթնած

	Նա մեզ մոտեցրեց իր դեմքը թաց

	Եվ ահա թե ինչ նա շշնջաց

	 

	Որ երգերը մեր ցավերն են

	Բոլորից թաքուն պահած

	Որ գիշերը մենք ոռնում ենք

	Աշխարհի դեմ դառնացած

	 

	Ու մի պահ մեր դեմ բացում է

	Դրախտի դռներն Աստված

	Շներին նա կերակրում է

	Ու փակում վերքերը բաց

	 

	Իսկ այնտեղ բոլոր շները կուշտ են

	Պոետներն ունեն գինի ու հաց

	Եվ երգերն այնտեղ ոչ թե ոռնում են

	Այլ երգվում են մինչև լուսաբաց

	 

	Ու պոկում են շղթաները

	Պոետները ու շները կատաղած

	Գիշերվա մեջ համբարձվում է

	Նրանց երգն աղոթք դարձած

	 

	Ու թռչում են պոետները

	Շների հետ խենթացած

	Այնտեղ ուր արդեն բացել է

	Դրախտի դռներն Աստված
","Me and Moon together

We approached the frozen water

And at two o'clock at night

We sang this song about



Why the poets are

And dogs friends

Because they at night

LOVE LIGHT SONGS



That our lives are distorting

Daytocks unreal

We find the nights

Our faces are real



Dark clouds Do not close the moon face

Allow the conversation to finish

I moon the dog and the puddle

We haven't met each other for a long time



The dog was standing by my side

The punch approached the pope

He saw the round moon there

And said empty of that plate



That his father was tribal

Mother of an unknown race dog

Their connection was not legal

And an orphaned homeless was born



That endlessly this fuck

For a piece of bread

Is the only way to live

Which life do you not eat of Kick?



Life is our dirty pope

Where the moon's empty plate shining

There are people who spit there

And some are looking for the moon



And suddenly frozen from the puddle

Out of the swimming moon sprawled

He approached us his face wet

And that's what he whispered



Which songs are our pain?

Secretly stored

Which night we are fro

Bitterly against the world



And a moment is open against us

Heaven's Doors God

Dogs she feeds

And closing wounds open



And there all dogs are full

Poets have wine and bread

And the songs there are not rubbing

Other sung up to dawn



And tear chains

Poets and dogs furious

Is ascending in the night

Their song prayer



And flies the poets

Crazy with dogs

Where it has already opened

Heaven's Doors God"
ՌՈՒԲԵՆ ՀԱԽՎԵՐԴՅԱՆ,ՆՈՐ ՏԱՐԻ,"
	Պստիկներ շուտ հավաքվեք

	Ու կլոր շրջան կազմեք

	Երգեք երգն այս ու պարեք

	Նոր տարին դիմավորեք

	 

	Նոր տարի Նոր տարի

	Գալդ թող լինի բարի

	 

	Պայծառ ժպիտով արի

	Դու բարի մեր Նոր տարի

	Բոլորիս երազանքները

	Այս տարի դու կատարիր

	 

	Բեր անուշ կարկանդակներ

	Եվ ուրախ ու նոր խաղեր

	Բեր նվեր հույսեր ու սեր

	Մեր բարի մեր լավ ընկեր

	 

	Նոր տարի Նոր տարի

	Գալդ թող լինի բարի

	 

	Իսկ հետո կեսգիշերին

	Հյուր կգա Ձմեռ պապին

	Ու կասի նա բոլորին

	 Շնորհավոր ձեր Նոր տարին

	 

	Նոր տարի Նոր տարի

	Գալդ թող լինի բարի
","Gather the pasts early

And make a round round

Sing the song this and dance

Greet the New Year



New Year New Year

Let your come be kind



Come on a bright smile

You are kind to our new year

The dreams of all of us

This year you do



Bring sweet pies

And happy and new games

Bring gift hopes and love

Our good our good friend



New Year New Year

Let your come be kind



And then at midnight

Guest will come to Santa Claus

And he will say to all

Happy New Year



New Year New Year

Let your come be kind"
ՌՈՒԲԵՆ ՀԱԽՎԵՐԴՅԱՆ,ԹԶՈՒԿԸ,"
	Ճերմակ մորուք կարմիր մեծ քիթ

	Բարի աչքեր

	Քայլում էր նա դեմքին ժպիտ

	Ձեռքին լապտեր

	Ու քթի տակ մրթմրթալով

	Ինչոր բառեր

	Քայլում էր նեղ արահետով

	Թզուկը ծեր

	 

	Երբ նա հասավ մեծ անտառի

	Մութ բացատին

	Հանեց ուսից պարկապզուկն

	Իր թանկագին

	Ու արթնացրեց ոգիներին

	Անտառային

	Երբ նվագեց կախարդական

	Այս մեղեդին

	 

	Իսկ հետո փոքրիկ թզուկը

	Թաքցրեց հոգու հուզմունքը

	Ու մաքրեց իր կարմիր քիթն աղմուկով

	Ու մաքրեց իր կարմիր քիթն աղմուկով

	 

	Ու երբ հնչեց կախարդական

	Այս մեղեդին

	Ծղրիդների մորեխների հետ միասին

	Հայտնվեցին կայծոռիկներ

	Ոսկեդեղին

	Ու փայլեցին մութ անտառում

	Կեսգիշերին

	 

	Մի մութ անտառ մի մեծ լուսին

	Մի կեսգիշեր

	Լուսնի լույսի տակ թևածող

	Թիթեռնիկներ

	Ու մի թզուկ որն արթնանում

	Կեսգիշերին

	Ու նվագում էր մոգական

	Այս մեղեդին

	 

	Մի մութ անտառ մի մեծ լուսին

	Մի կեսգիշեր

	Մի ծեր կաղնի որը գիտեր

	Շատ գաղտնիքներ

	Ու մի փչակ ուր ապրում էր

	Թզուկը ծեր

	Որը ուներ կարմիր մեծ քիթ

	Բարի աչքեր

	 

	Իսկ հետո փոքրիկ թզուկը

	Ցած դրեց պարկապզուկը

	Ու մաքրեց իր կարմիր քիթն աղմուկով

	Ու մաքրեց իր կարմիր քիթն աղմուկով
","White beard red big nose

Good eyes

Walked on his face smile

Lamp

And under the nose with a murmur

Words:

Walked with a narrow trail

The dwarf old



When he reached a large forest

Dark spaces

Took off the shoulder baggage

His precious

And awakened spirits

Forest

When played magical

To this melody



And then the little dwarf

Hid the excitement of the soul

And cleaned his red nose with noise

And cleaned his red nose with noise



And when it sounded magical

To this melody

Together with cricket locusts

Firelights appeared

Golden

And shone in the dark forest

At midnight



A dark forest to a big moon

A midnight

Moonlight

Butterflies

And a dwarf that wake up

At midnight

And played magical

To this melody



A dark forest to a big moon

A midnight

An old oak who knew

Many secrets

And a blower where he lived

The dwarf old

Which had a red big nose

Good eyes



And then the little dwarf

Put down the bagpipe

And cleaned his red nose with noise

And cleaned his red nose with noise"
ՌՈՒԲԵՆ ՀԱԽՎԵՐԴՅԱՆ,ԳԻՇԵՐՎԱ ԱՍՏՂԱԶԱՐԴ ՆԿԱՐՈՒՄ,"
	Գիշերվա աստղազարդ նկարում

	Արթնացան շշուկները անուշ

	Եվ լուսինը դեմքիդ վրայով

	Մեղմ սահեց ժպիտով իր քնքուշ

	 

	Նա փակեց քո աչքերը հոգնած

	Ու լցրեց քո հոգին պատրանքով

	Ականջիդ նոր հույսեր շշնջաց

	Որ դու արթնանաս ժպիտով

	 

	Մոտեցիր ու բաց արա

	Քո պատուհանը իմ փոքրիկ

	Երևաց կարմիր արևը

	Տես թռչում է նա երկինք

	 

	Արևի ոսկե շողերը

	Նկարել են քո պատին

	Այս փոքրիկ հրաշք նկարը

	Այս ծառերն ու այս այգին
","In the star-starred picture of the night

Wake up the whispersush

And the moon over your face

Gentle slipped with a smile her tender



He closed your eyes tired

And filled your soul with illusion

New hopes of your ear whispered

That you wake up with a smile



Approach and open

Your window my little

The red sun appeared

See Flying He Heaven



The golden glow of the sun

Painted on your wall

This little miracle picture

These trees and this garden"
ՌՈՒԲԵՆ ՀԱԽՎԵՐԴՅԱՆ,ԼՈՒՍԱԲԱՑԻ ԵՐԳԸ,"
	Տես երկինքն այսօր ինչքան կապույտ է

	Ամպերը ճերմակ առագաստներ են

	Տես լողում է նավը առագաստանավը

	Երկնքի կապույտ ծովում

	 

	Ու քամին քշում է առագաստանավը

	Երկնքի կապույտ ծովում

	Ու քամին տանում է առագաստանավը

	Ու կորչում հեռուհեռվում

	 

	Դու լսիր երգում են թռչունները

	Այդ քնած անտառն է արթնանում

	Լուսաբացի երգը լուսաբացի երգն է

	Անտառի կողմից լսվում

	 

	Եվ լուսաբացի փոքրիկ թռչունը

	Եվ ամպերը ոսկեթև

	Տես երգում են լուսաբացի երգը

	Լուսաբացի երգը մեր

	 

	Դու լսիր երգում են թռչունները

	Այդ քնած անտառն է արթնանում

	Լուսաբացի երգը լուսաբացի երգն է

	Անտառի կողմից լսվում
","See heaven today how blue

Clouds are white reefs

See Swimming Ship Sail

In the blue sea of sky



And the wind drives the sail

In the blue sea of sky

And the wind takes the sail

And get lost away



You hear the birds sing

That sleeping forest wakes up

The song of the dawn is the song

Heard by the forest



And the little bird of the luminous

And the clouds of golden

See Singing the Lusaboo song

The song of the dawn is our



You hear the birds sing

That sleeping forest wakes up

The song of the dawn is the song

Heard by the forest"
ՌՈՒԲԵՆ ՀԱԽՎԵՐԴՅԱՆ,ԶԱՏԻԿ,"
	Կլոր զատիկ

	Կարմիր հատիկ

	Դաշտի մեջ մոլորվեց

	Առվի եզրին տեսավ ծաղիկ

	Ծաղկի վրա քնեց

	 

	Դաշտում դեղին ծաղիկ

	Ծաղկի վրա զատիկ

	Կլորկարմիր հատիկ

	Սևսև ու պուտպուտիկ
","Round Easter

Red grain

Went down in the field

Seen a flower on the edge of the drive

Flowered fell asleep



Yellow flower in the field

Easter on the flower

Round grain

Saver and Putper"
ՌՈՒԲԵՆ ՀԱԽՎԵՐԴՅԱՆ,ԿԱՊԻԿ,"
	Պիկպիկիպիկ այ կապիկ

	Հագել ես ալ շապիկ

	Կապել ես շալ գոտիկ

	Կանգնել ես ոտի

	 

	Մին վերվեր կցատկես

	Մին էլ սուտ կսատկես

	Մին կելնես կուզեկուզ

	Դես պուպուզ դեն պուպուզ
","Pictpikic jone

Wearing a T-Shirt

Tied you shawl goth

Standing on the foot



Mini-elaps

Will you like a lie?

Mini Kelness Kuzekuz

Den Pupuz"
