Artist,Song,Lyrics,Translated_Lyrics
Silva Hakobyan,Սասնա Պար (Sasna Par),"Դը քելե հայ դը քելե
Դը քելե քելե քելե
Ափ զարկե ծափ զարկե
Թող թնդա պարը
Դը քելե հայ դը քելե
Դը քելե քելե քելե
Աջ զարկե ձախ զարկե
Թող թնդա պարը
 Արևն ելավ սարեն
Զուռնան փչեց քարեն
Դհոլ զարկեց ժայռեն
Բախ տա ռուպ տապ ռու պապ տա տուպ տա
Սասնա պարը հնչեց
Զուռնան անուշ կանչեց
Դհոլն ուժգին զարկեց
Բախ տա ռուպ տապ ռու պապ տա տուպ տա
 Հեյ հեյ հեյ սարեր ջան 
Ձեզ ղուրբան 
Ձեր ոգին մեր մեջ է
 ԿՐԿՆԵՐԳ
Դը քելե հայ դը քելե
Դը քելե քելե քելե
Ափ զարկե ծափ զարկե
Թող թնդա պարը
Դը քելե հայ դը քելե
Դը քելե քելե քելե
Աջ զարկե ձախ զարկե
Թող թնդա պարը
Գտեք նաև այլ երգերի բառեր ում
Մասիս սարի լանջին
Արագածի փեշին
Գյոնդ բռնենք միասին
Բախ տա ռուպ տապ ռու պապ տա տուպ տա
Մուշն ու Սասուն կանգնեք
Ու ուսուսի զարկենք
Դհոլզուռնա ածենք
Բախ տա ռուպ տապ ռու պապ տա տուպ տա
 Հեյ հեյ հեյ սարեր ջան 
Ձեզ ղուրբան 
Ձեր ոգին մեր մեջ է
 ԿՐԿՆԵՐԳ
Դը քելե հայ դը քելե
Դը քելե քելե քելե
Ափ զարկե ծափ զարկե
Թող թնդա պարը
Դը քելե հայ դը քելե
Դը քելե քելե քելե
Աջ զարկե ձախ զարկե
Թող թնդա պարը 
 ","De Kele Armenian de Kelle
De Kele Kele Kele
Shell pasted
Let the fucking dance
De Kele Armenian de Kelle
De Kele Kele Kele
Right pulse left hit
Let the fucking dance
 The sun went out to Saren
Zurna blew the stone
Dhol stripped rocken
Bach Ta Rupan Tap Ru Pope Ta Toup
Sasna dance sounded
Zurna called her sweet
Dhol of Strongly Pull
Bach Ta Rupan Tap Ru Pope Ta Toup
 Hey Hey Hey Mountains
You Ghurban
Your spirit is in us
 Chorus
De Kele Armenian de Kelle
De Kele Kele Kele
Shell pasted
Let the fucking dance
De Kele Armenian de Kelle
De Kele Kele Kele
Right pulse left hit
Let the fucking dance
Also find other songs of other songs
On the slope of Masis Mountain
Aragats's skirt
Gyten hold together
Bach Ta Rupan Tap Ru Pope Ta Toup
Mush and Sasun stand
And we will strike in toe
Dhol jet
Bach Ta Rupan Tap Ru Pope Ta Toup
 Hey Hey Hey Mountains
You Ghurban
Your spirit is in us
 Chorus
De Kele Armenian de Kelle
De Kele Kele Kele
Shell pasted
Let the fucking dance
De Kele Armenian de Kelle
De Kele Kele Kele
Right pulse left hit
Let the fucking dance"
Silva Hakobyan,Մռութիկ (Mrutik),"Առավոտ Սենյակում դեռ մութ հայտնվեց արևից էլ շուտ
Լուսավոր ու պայծառ մի շող ինձ արթնացնող
Գնդլիկ թաթիկով խփեց ու անմեղ հայացքով կանգնեց
Հասկացա օրս ինչպես միշտ քեզնով սկսվեց
 Քո պզտիկ գլխում այնքան հարց ու պատասխան
Ոնց պիտի տակից դուրս գամ բարդ է դա այնքան
 
Մռութիկը քո համովհոտով աչուկների քո փայլը
Քեզ անուշիկ քո հեքիթով կժպտա անգամ չար գայլը
Մռութիկը քո համովհոտով աչուկների քո փայլը
Ջերմ ու բարի քո ժպիտով կանես առաջին քո քայլը
 Իրիկուն Մի մուլտիկ սիրուն կնայես որ քնես իսկույն
Բայց դու խենթ պտտվող անիվ շատ ակտիվ
Մինչև դու չքնես հաստատ չենք կարող մենք շնչել ազատ
Մեկ հոգով հինգ հոգու աղմուկ քաղցր խենթուկ
 Քո պզտիկ գլխում այնքան հարց ու պատասխան
Ոնց պիտի տակից դուրս գամ բարդ է դա այնքան
 
Մռութիկը քո համովհոտով աչուկների քո փայլը
Քեզ անուշիկ քո հեքիթով կժպտա անգամ չար գայլը
Մռութիկը քո համովհոտով աչուկների քո փայլը
Ջերմ ու բարի քո ժպիտով կանես առաջին քո քայլը
 Քո պզտիկ գլխում այնքան հարց ու պատասխան
Ոնց պիտի տակից դուրս գամ բարդ է դա այնքան
 
Մռութիկը քո համովհոտով աչուկների քո փայլը
Քեզ անուշիկ քո հեքիթով կժպտա անգամ չար գայլը
Մռութիկը քո համովհոտով աչուկների քո փայլը
Ջերմ ու բարի քո ժպիտով կանես առաջին քո քայլը 
 ","Morning in the room still appeared darkly from the sun too early
A bright and bright glare to me awake
Scored a ball with a ball and stopped innocent
I understood the day as you always started with you
 In your puke's head so much questions and answers
How should I get out of the middle?
 
The snout with your shabbal eyes your shine
Even the evil wolf smacks you sweetie with your heck
The snout with your shabbal eyes your shine
Warm and good with your smile you do your first step
 Irika will look at a multiculous love that sleeps immediately
But you're crazy rotating wheel very active
Until you don't know for sure we can breathe freely
One person with five people noise sweet crazy
 In your puke's head so much questions and answers
How should I get out of the middle?
 
The snout with your shabbal eyes your shine
Even the evil wolf smacks you sweetie with your heck
The snout with your shabbal eyes your shine
Warm and good with your smile you do your first step
 In your puke's head so much questions and answers
How should I get out of the middle?
 
The snout with your shabbal eyes your shine
Even the evil wolf smacks you sweetie with your heck
The snout with your shabbal eyes your shine
Warm and good with your smile you do your first step"
Silva Hakobyan,Տնից Պախել Եմ (Tnits Paxhel Em),"Կանաչկարմիր շորերս հագել եմ
Խոնջաբոխչաս դրել եմ կապել եմ
Թաքուն թաքուն տնից պախել եմ
Եկել եմ ձեր տան դիմաց կանգնել եմ
 Գիշեր ու ցերեկ մի խաբար բերեք
Ինձանից յարիս մի բարև տարեք
Ասեք դուրս գա դուրս գա էն դրնից
Խոսք է տվել թող գա հարս տանի ինձ
 Երկար ծամերս հյուսել կապել եմ
Աչքերս էլ սուրնայով ներկել եմ
Քո խոսքերին հավատացել եմ
Եկել եմ ձեր տան դիմաց կանգնել եմ
 Գիշեր ու ցերեկ մի խաբար բերեք
Ինձանից յարիս մի բարև տարեք
Ասեք դուրս գա դուրս գա էն դրնից
Խոսք է տվել թող գա հարս տանի ինձ
 Բարձրակրունկ կոշիկս հագել եմ
Նախշուն ակերով գոտիս կապել եմ
Հազիվ հազիվ տնից փախել եմ
Եկել եմ ձեր տան դիմաց կանգնել եմ
 Գիշեր ու ցերեկ մի խաբար բերեք
Ինձանից յարիս մի բարև տարեք
Ասեք դուրս գա դուրս գա էն դրնից
Խոսք է տվել թող գա հարս տանի ինձ
 ","I wore the green clothes
I have literal to Honoraboccham
I have been hidden from secret home
I came to stand in front of your house
 Bring a day and day with a gallery
Take a hello from me to Yaris
Say to go out from the lodge
He promised let him come to the bride to take me
 I have tied my long chews
I also painted my eyes by Surtain
I have believed in your words
I came to stand in front of your house
 Bring a day and day with a gallery
Take a hello from me to Yaris
Say to go out from the lodge
He promised let him come to the bride to take me
 I wore a high heeled shoes
I have tied the pattern of the pattern
Barely barely escaped from home
I came to stand in front of your house
 Bring a day and day with a gallery
Take a hello from me to Yaris
Say to go out from the lodge
He promised let him come to the bride to take me"
Silva Hakobyan,Քարե Դարդ (Kari Dard),"Օր վայրկյան տարի
Ամիս ու դար
Խճճվել ընկճվել
Խառնվելիրար
Դար ամիս րոպե տարի և օր
Երբ եկան վերջացան
Ով է մեղավոր
 Զարգացել է քարե դարը
Մոռացել է իր անցյալը
Կատարյալ անցյալ
Խաղ է թվացյալ
Բացակա ներկան
Պայծառ ապագան
 
 Հուհու հեյհեյ
Հուհա կալա կալեյ
Սա ինչ թակարդ է
Ինչ քարե դարդ է
 Հուհու հեյհեյ
Հուհա կալա կալեյ
Վիճակը բարդ է
Սա քարե դարդ է
 Մութ անցյալը լուսավոր ներկան
Բախվեցին խաչվեցին և առանճնացան
Ժամը դար է դարը ակնթարթ
Երբ եկավ երբ անցավ
Այ քեզ հայի բախտ
 Զարգացել է քարե դարը
Զարմացել է ողջ աշխարհը
Կատարյալ անցյալ
Խաղ է թվացյալ
Բացակա ներկան
Պայծառ ապագան
 
 Հուհու հեյհեյ
Հուհա կալա կալեյ
Սա ինչ թակարդ է
Ինչ քարե դարդ է
 Հուհու հեյհեյ
Հուհա կալա կալեյ
Վիճակը բարդ է
Սա քարե դարդ է
 ","Day seconds
Months and century
Tangle
Mixed
Century months of minute and day
When they came to an end
Who is to blame?
 The Stone Age has developed
Forgot his past
Perfect past
Game is seemingly
Absent present
Bright future
 
 Hayhie Heehi
Huha Kala Kaley
This is what traps
What stone dare?
 Hayhie Heehi
Huha Kala Kaley
The condition is complicated
This is a stone dow
 Dark past the bright present
Were crucified and taken
The century is century
When it came when it passed
YOU ARE THE ARMENIAN LAW
 The Stone Age has developed
The whole world was surprised
Perfect past
Game is seemingly
Absent present
Bright future
 
 Hayhie Heehi
Huha Kala Kaley
This is what traps
What stone dare?
 Hayhie Heehi
Huha Kala Kaley
The condition is complicated
This is a stone dow"
Silva Hakobyan,Գիշեր (Gisher),"Գիշեր է
Իմ հոգին դատարկ է ու անսեր
Ես ուզում եմ երազել
Ես ուզում եմ քեզ սիրել
Ես ուզում եմ քեզ ներել
Բայց ուշ է
Իմ հոգում մշուշ է ու թախիծ
Հեռացել ես ինձանից
Թողնելով ինձ կես ճամփին
Մոռացել ես իմ մասին
Կոուրացել էր քո հոգին
 Ես չեմ ուզում քեզ մոռանալ
Իմ անցյալից լուռ հեռանալ
Այս խաբկանքին այս տանջանքին
Անհնար է դիմանալ
Ես չեմ կարող քեզ մոռանալ
 Սիրել եմ
Քո սիրուց արբած չեմ նկատել
Որ ուրիշն է քեզ գերել
Որ ուրիշն է քեզ տիրել
Ուրիշին ես դու սիրել
Լռել եմ
Հավատով սպասել եմ որ կգաս
Քո սխալը դու կզգաս
Եվ նորից ինձ սեր կտաս
Իմ կյանքին նոր շոունչ կտաս
Քո հոգով ինձ կյանք կտաս
 Ես չեմ ուզում քեզ մոռանալ
Իմ անցյալից լուռ հեռանալ
Այս խաբկանքին այս տանջանքին
Անհնար է դիմանալ
Ես չեմ կարող քեզ մոռանալ
 Ես չեմ ուզում քեզ մոռանալ
Իմ անցյալից լուռ հեռանալ
Այս խաբկանքին այս տանջանքին
Անհնար է դիմանալ
Ես չեմ կարող քեզ մոռանալ
 Ես չեմ ուզում քեզ մոռանալ
Իմ անցյալից լուռ հեռանալ
Այս խաբկանքին այս տանջանքին
Անհնար է դիմանալ
Ես չեմ կարող քեզ մոռանալ
 ","It's night
My soul is empty and hard
I want to dream
I want to love you
I want to forgive you
But it's too late
My soul is fog and sad
You have left me
Leaving me on a half way
You forgot about me
Was your soul coached
 I don't want to forget you
To leave my past silently
This deception of this torture
It is impossible to endure
I can't forget you
 I have loved
I have not noticed a drunk from your love
That someone else is captivated you
That someone else has ruled you
To Another You Love
I'm silent
I wait with faith that you will come
Your mistake you will feel
And again will you give me love
I will give my life a new shot
Will you give me life with your soul?
 I don't want to forget you
To leave my past silently
This deception of this torture
It is impossible to endure
I can't forget you
 I don't want to forget you
To leave my past silently
This deception of this torture
It is impossible to endure
I can't forget you
 I don't want to forget you
To leave my past silently
This deception of this torture
It is impossible to endure
I can't forget you"
Silva Hakobyan,Իմն Ես (Imn Es),"Քեզ տեսա ու հոգիս միանգամից փայլեց
Հասկացա որ իմ կյանքը սիրով լցվեց
Խելագար իմ հոգին լուռ սիրահարվեց
Ես զգացի ես գիտեմ որ սիրում եմ քեզ
 Էլ մի էլ մի ձևացրու
Էլ մի ուշացրու սերն իմ
Տուր ինձ տուր ինձ սերը քո
Դու իմն ես լինելու
 Ամեն օր ամեն ժամ կարոտում եմ քեզ
Քո բարի աչքերում ես որոնում եմ սերը
Կաղոթեմ կսպասեմ
Ու գիտեմ մի օր քո կողքինսիրելիս
ես կապրեմ կյանքը նոր
 Էլ մի էլ մի ձևացրու
Էլ մի ուշացրու սերն իմ
Տուր ինձ տուր ինձ սերը քո
Դու իմն ես լինելու
 ","I saw you and my soul shone at once
I realized that my life was filled with love
Mad my soul fell silently in love
I felt I know I love you
 Don't even pretend
Don't even delay my love
Give me give me the love of you
You will be mine
 Every day I miss you every hour
In your good eyes I look for love
I'll wait for me to wait
And I know one day my side of your side
I will live life new
 Don't even pretend
Don't even delay my love
Give me give me the love of you
You will be mine"
Silva Hakobyan,Նորահարսիկ (Noraharsik),"Հարսի շորով ճերմակ քողով
Աստծու օրհնությամբ
Դու հարսիկ դարձար ու ամուսնացար
 Անհոգ սիրով սրտի դողով
Երազանքիդ հասար դու վերջապես
Հարսանիքն է քո մեծ
 Դե արիարի ու պարիպարի
Մեր նորահարսիկ
Հեզիկ նազիկ
Անուշ ծաղիկ
Նաիրյան հարսիկ
Ուզում եմ որ դու լինես երջանիկ
Դե արիարի ու պարիպարի
Մեր նորահարսիկ
Հեզիկ նազիկ
Անուշ ծաղիկ
Նաիրյան հարսիկ
Ուզում եմ որ դու լինես երջանիկ
 Ճերմակ հագած հերի դարձած քո հայրական
Տանից դու հեռացար
Քո սիրուն հասար
Հարս ու փեսով սիրու հույսով
Ապրեք երկար ու լինեք անբաժան
Հետ արի և թե ժամ
Դե արիարի ու պարիպարի
Մեր նորահարսիկ
Հեզիկ նազիկ
Անուշ ծաղիկ
Նաիրյան հարսիկ
Ուզում եմ որ դու լինես երջանիկ
Դե արիարի ու պարիպարի
Մեր նորահարսիկ
Հեզիկ նազիկ
Անուշ ծաղիկ
Նաիրյան հարսիկ
Ուզում եմ որ դու լինես երջանիկ
Դե արիարի ու պարիպարի
Մեր նորահարսիկ
Հեզիկ նազիկ
Անուշ ծաղիկ
Նաիրյան հարսիկ
Ուզում եմ որ դու լինես երջանիկ
Դե արիարի ու պարիպարի
Մեր նորահարսիկ
Հեզիկ նազիկ
Անուշ ծաղիկ
Նաիրյան հարսիկ
Ուզում եմ որ դու լինես երջանիկ
 ","With a white cloth with a bride cloth
With God's blessing
You have kidded and got married
 Carefree love with heart tram
You reached your dream finally
The wedding is your big
 De Arari and Paripar
Our broves
Mezik Nazik
Sweet flower
Nairyan Bride
I want you to be happy
De Arari and Paripar
Our broves
Mezik Nazik
Sweet flower
Nairyan Bride
I want you to be happy
 Your father's fellow believer
From home you left
Your lovely
Hope with bride and fathers
Live long and be inseparable
Come back or hours
De Arari and Paripar
Our broves
Mezik Nazik
Sweet flower
Nairyan Bride
I want you to be happy
De Arari and Paripar
Our broves
Mezik Nazik
Sweet flower
Nairyan Bride
I want you to be happy
De Arari and Paripar
Our broves
Mezik Nazik
Sweet flower
Nairyan Bride
I want you to be happy
De Arari and Paripar
Our broves
Mezik Nazik
Sweet flower
Nairyan Bride
I want you to be happy"
Silva Hakobyan,Силва Акобян (Silva Akobyan),"Մի օր սիրտս քեզնից նեղացավ
Թողեց հեռացավ անհիմն
Մոտիկ մարդու սուտը ճիշտ դարձավ
Կյանքս դառնացավ անհիմն

Մեզ բաժանողի սրտում հիմա մի տոն է տես
Ավելին ասեմ նա քեզ համար դարձել է կյանքի կես

Ուշացել եմ ես արդեն
Իմ սխալը ոնց հարթեմ
Թե կուզես երդվեմ որ սիրում եմ միայն քեզ

Սիրել եմ կսիրեմ

Ամեն անգամ իրար տեսնելիս
Շփոթվում ենք միշտ անձայն
Թե իմ թե քո սիրուց խոսելիս
Համարում ենք այն անցյալ

Իմ հպարտությունն ինձ խանգարեց որ քեզ ներեմ
Իսկ հիմա շատ ուշ է չեմ կարող քեզ հետ բերել
 ","One day my heart was offended by you
Left away left unreasonable
The lying of a close person became right
My life became unfounded

See a holiday in the heart of us now
Let me say that he has become half of life for you

I'm late I already
How to smooth my mistake
Would you only love you love you only?

I love I will love

Every time you see each other
We are always confused
Whether speaking or talking out of your love
We consider it past

My pride hurt me that I would be forgiven
And now I can't bring you back to you"
Silva Hakobyan,Իմ հերոս (Im heros),"Դու իմ բարությունն էիր
Կյանքիս էությունն էիր
Ինչու ներկայից անցյալ դարձար
Դու իմ ջերմությունն էիր
Իմ երջանկությունն էիր
Արևիմ ԱՐԵՎՆ ինչու տարար
Հանուն հողի ու քո ազգի
Հանուն կամքի ու քո պատվի 
Գնացիր անվախ դեպի
Հավերժությունը կանչող
 
Ես հիմա պիտի ապրեմ
Իմ ու քո փոխարեն
Որ կիսատ թողածը քո
Ամեն գնով կատարեմ
Երկնային կյանքում
Քո սիրած վանքում
Կաղոթեմ անվերջ
Խոսելով քեզ հետ իմ Հերոս
 Հոգիս դատարկվել է
 Սիրտս կոտրվել է
Արցունքի ծովում խեղդվում եմ ես
Կարոտս ու սերս
Այնքան շատացել է
Ախ ոնց կգրկեի հիմա ես քեզ
Ուժ տուր Աստված որ դիմանամ
Մարմին դարձած հողում մնամ
Ու մարտի դաշտում ընկած իմ Զինվորով զորանամ
 
 ","You were my goodness
The essence of my life was
Why did you become past the present
You were my warmth
You were my happiness
Why did they contain?
For the sake of land and your nation
For the will and your honor
Went fearless to
Eternity caller
 
I have to live now
Me and you
That the half-left is your
I will do at all costs
In heavenly life
In your favorite monastery
I will pray endlessly
Talking to you my hero
 My soul has been emptied
 My heart has been broken
I'm drowning in the sea of tears
Misss and love
It's so increased
Ahkh I would have been to you now
Give God God to endure
I will stay in the land
And my soldier with my soldier in the battlefield"
Silva Hakobyan,Կիսատ եմ (Kisat em),"Տաք էի քո կողքին և քո գերին
Քո գրկում մոռանում էի ամենքին
Փակ էին իմ աչքերը
Չեմ զգացել քեզ կորցնելը
Հեռացար այն պահին երբ
Սերդ ինձ նոր էր կյանք տվել
 
Ես գտա ինձ կես
Բայց կիսատ եմ ես
Դու արև ես սառույցի մեջ
Ախր առանց քեզ
Միայնակ եմ ես
Ուրիշի մեջ ես փնտրում եմ քեզ
 Ցուրտ քամի ես մրսում եմ
Հուշերով ինձ գրկում եմ
Քո հոգին իմ կողքին է
Չի շոյում մեկ է զգում եմ քեզ
Թե նորից ընտրեի ես կընտրեի քեզ
Իմ միակ վերջինն ես ես սիրում եմ քեզ
 
 ","I was warm with you and your captive
I forgot to all in your arms
Were closed my eyes
Haven't felt losing you
Did you leave at the moment
My love had just gave me life
 
I found me half
But I'm half-hearted
You sunshine in the ice
After all of you
I am single
Am looking for you in another
 Cold wind I have a cold
I'm hugging me with memories
Your soul is by my side
DON'T DON'T SEE ONE FIRST
Or would I choose again I would choose you
My only last I love you"
Silva Hakobyan,Փոշմանել եմ (Poshmanel em),"Սև լիներ օրե էն որ քեզ տեսա
Բարև տվիր տեսքովդ հիացա
Ախ չլներ օրե էն որ քեզ տեսա
Թակ տղա էիր տեսքովդ հիացա
Ասի գնամ խոնջեսբողջես հավաքեմ
Քանի քեզ պես ուզող ունեմ փսակվեմ
Թե չէ տանը ինձ ասում էին որ սպասեմ
Մինչև որ իմ մեծ քրոջը փսակեն
 Ախ մարել են արևը արևը
Չլներ էդ օրվա քո ջերմ բարևը
Ախ մարել են արևը արևը
Էռնեկ չառնեի քո տված բարևը
 Քեզնից ինչ խերվեցի որ առա
Հոգսերի մեջ թաղվեցի բեզարա
Ողջ օրը քայլում ես շիվարած
Աշխատում ես աշխատես ավարած
Թամամ արի ունեցվացքիդ ու տեսքիդ
Ասի մի քիչ ես էլ ապրեմ քիթս ցից
Բայց արի տես աննպատակ քո դարդից
Դուրս չեմ գալիս մարդ չեմ տեսնում ամոթից
 Ախ մարել են արևը արևը
Չլներ էդ օրվա քո ջերմ բարևը
Ախ մարել են արևը արևը
Էռնեկ չառնեի քո տված բարևը
 ","Black were the day that I saw you
Hello gave you the appearance of your
Ohou would not be the day that I saw you
Did you masculate your son?
Say to go to the hungness
How many you like you I want to make a crown
Or not at home told me to wait
Until my big sister is to die
 Oh was extinguished the sun
Won't your warm salute on that day
Oh was extinguished the sun
Ernek didn't you give your greeting
 What truits did you make from you?
I was buried in Benzara
You walk all day round
You work to work to be avascular
Tamam Come to your side and look
Say a little I live in my nose
But come and see from your turbid
I don't see a person out of shame
 Oh was extinguished the sun
Won't your warm salute on that day
Oh was extinguished the sun
Ernek didn't you give your greeting"
Silva Hakobyan,Ինձ ներիր ներիր (Indz nerir nerir),"Ես ապրում էի սիրելով
Իսկ հիմա լոք հուշերով
Ետ բերել քեզ չեմ ուզում
Սիրտն է իմ այդպես հուշում
Երազել ես չեմ ուզում
Ես ապրումեի սիրելով
Անիմաստ զուր հույսերով
Ժամանակն իզուր վատնում
Քո կողքին ես չեմ գտնում
Քեզ սիրել ես չեմ ուզում
 Ինձ ներիր ներիր ինձ սիրելիս
Չեմ կարող սիրել նորից
Մոռանանք ես քեզ դու ինձ
Հավատա կորել է սերը ջինջ
Մեր միջև չկա ոչինչ
Մարել է սերը իմ
 Մոռացիր ինձ սիրելիս
Մի փորձիր անցնել նորից
Այն ճամփան որ ինձ ու քեզ
Բաժանել է իրարից
Չի հատվի երբեք նորից
Հավատա ինձ սիրելիս
Չեմ զղջում չեմ լալիս
Չի հուզում ինձ ոչ մի հարց
Չփորձես պարզել հանկարծ
Հեռացիր անվերադարձ
 Ինձ ներիր ներիր ինձ սիրելիս
Չեմ կարող սիրել նորից
Մոռանանք ես քեզ դու ինձ
Հավատա կորել է սերը ջինջ
Մեր միջև չկա ոչինչ
Մարել է սերը իմ
 ","I lived by loving
And now with lung memories
I don't want to bring back you
The heart is my tip
Dream I don't want
I would live by loving
With nonsense in vanity
Time is a waste of van
I don't find it next to you
I don't want to love you
 Me forgive me my dear
Cant love again
Forget me you are me
Believe is lost love
There is nothing between us
Faded the love of my
 Forget me my dear
Don't try to go over again
It's way to me and you
Divided
Will never cross again
Believe me my dear
I don't regret crying
Don't worry about me no questions
Don't try to find out suddenly
Remove irrevocably
 Me forgive me my dear
Cant love again
Forget me you are me
Believe is lost love
There is nothing between us
Faded the love of my"
