Artist,Song,Lyrics
Mi Qani Hogi,SMS,"
[Նախերգանք: Սեբու]

Deep into love I sink

Deep, deep, deep...

Deep into love I sink

Deep into love I sink

Deep, deep, deep...

Deep into love I sink


[Տուն 1: Միշո]

Դու, հասարակ մի դերանուն

Քո անունն իմ բերանում

Ինձ տարել ես ու տանում, դեպի ու՞ր

Առանց քեզ ծերանում, աշխարհից նեղանում

Ինձ տարեք դեղատուն, մեկէ ջուր

Ես քո հետ եմ, որ առողջ եմ

Դու, որ չկաս, ես էլ ոչ մի բան անող չեմ

Կարոտել եմ тебя очень

Մենք մի մարմին, ուրիշները իրար պոչ են

Քեզ գրում եմ մատերով

Հեռախոսը ատելով, SMS-ը պատելով կարոտով

Ալիքները կապելով, օդերով, ամպերով

Փոխանցում բառերը տպատառերով

Հլը չի սկսէ կինոն մեր

Հա, մինչև էս, մենակ իմը, կամէ քոնն էր

Էրևումա ակնհայտ

Ծերանանք, ասելու ենք՝ մերը բոմբ էր
"
Mi Qani Hogi,Tar Indz,"
[Verse 1: Felo]

Տար ինձ քո հետ, ասում եմ

Տար ինձ քո հետ, վազում եմ

Սարից քո հետ, դառել եմ քարից պոետ

Խնդրում եմ տար ինձ քո հետ-հետ

Կամ էլ առաջ տար

Պատկերացնում ես մի օր հետոն առաջ գար

Տար ինձ քո հետ, ասում եմ

Տար ինձ քո հետ, վազում եմ

Սարից քո հետ, դառել եմ քարից պոետ

Խնդրում եմ տար ինձ քո հետ-հետ

Կամ էլ առաջ տար

Պատկերացնում ես մի օր հետոն առաջ գար


[Verse 2: Misho]

Տար ինձ քո հետ տենամ քո գույները որն են

Հա հենց գույները, էտ ամենա կարևորն են

Խորն են տողերը, ոնց որ ծովն ու տիեզերքը

Կողմ են նրանք, որ բառերը համ էլ զենք են:

Պետք են առաջինը ինձ, հետո եսիմ

Կամ լռիվ ուրիշներին

Կամ է կարող ա իմ պեսին:

Անտեսի այնպիսի մարդկանց ով միշտ տխուր ա

Իրանց չես օգնի, հանկարծ խրում են թուրը

Հենց իրանք, իսկ կյանքը էնքան թանկ

Ունեմ լիքը մաղթանք, ինձ համարում եմ պարտք

Բայց դե ում դեմ տանք

Սենց գանք ու չգնանք

Ստէ թեմաների հանք

Բերանս է ցամաք, մի հատ ջուր բեր:

Տար ինձ քո հետ տենամ քո աշխարհը որն ա

Հա ինձ պոետ համարում եմ ամեն օրն էլ

Տար ինձ քո հետ, ստէ անգիր ա ամեն ինչ

Որ մնամ համոզված եմ, դառնալու եմ ավերիչ:

Նենց որ…
"
Misho,Hastat Apeh,"
Վոշմ սենց ապէ, լրջացանք մեկա ոչ էլ պակասեց ապէ

Համ օյաղ համ էլ մի տեսակ բացեց ապէ

Ասեք ջան, համ էլ ջանս մտավ ցեց ապէ


Քել ղժժանք, մարդ կա դրանից լացեց ապէ, Բնական առանց որևիցէ ցենզ ապէ

Տնական, պետականը չսազեց ապէ

Հայկական, դաժէ հերս որ մարսեց ապէ

Լսարան, էտա սաղ ապացուցեց ապէ

Մսաղաց մեջը ով էլ չդզեց ապէ

Լուսաբաց, օրրգանիզմս չքնեց ապէ

Կթվա բզբզում եմ, բայց բզեց ապէ

Քեզ եսիմ կարևորը մեզ դզեեեեց ապէ

Կթվա մեծամիտ ենք, բայց հուզեց ապէ

Էս մեկից չէ, դե որևիցէ ԻՑ ապէ

Հնդկական նվնվոցա Սերժոից ապէ, Էս ժառգոնն էլ վրից և ահա․․․․․․․․․․


Հա հա հա հա... Հա հա հա հա(հա ինչ ապե)... Հա հա հա հա...

Հաստատ ապէ(ասա)

Հա հա հա հա... (ասա)Հա հա հա հա... (ասա) հա հա հա...

Հաստատ ապէ

Հա հա հա...(ասա)Հա հա հա հա...(ասա)Հա հա հա հա...

(հաստատ)Հաստատ ապէ


Նոր դառա 30 ու գնալով էրևումա ովա ով իր ներսուում

Պլյուս մարմինա մերսում, երբ որ բիտը խբումա դոշիդ էլ դու սուուս

Մի հատ գլուխ երկու ուս, ով որ քիչա կարում աղոթումա

Հիսուուս Ինքս ինձ եմ ինքնուս, ինքս ինձ եմ ուղում, ինքս ինձ եմ իմպուլս

Վոշմ լավա, հա բա ինչ նվնվանք զահլես տարան ապէ

Ապեր սաղ թխոցիա ու հարամ ապէ

Ամեն դաշտ՝ մյուզիքից քաղաքական ապէ

Մեկին վատ չի թվում, մեկին թալան ապէ Ես իմ փայ, որտև անկուսակցական ապէ

Վոշմ սենց, վոշմ մարդու տարրական ապէ

Հլը նոր ենք բացվէ ինչ բավական ապէ

Բանական, արական, առռռա հա, դե բա հա․․․․
"
Halfcastromeo,OG,"
[Songtext zu „OG“ ft. Sin Davis]


[Intro: Halfcastromeo]

Bin mit Xaser und du nicht, yeah, yeah


[Hook: Halfcastromeo]

Maison Margiella die Kicks, sie ist überwältigt in all der League, ja

Hör' mal weil sie die kids will, du feierst dich selber, doch nigga dich nicht, nah

Diggi, ich bin ein OG, seit „Givenchy“ feiern mich all diese Kids, ja

Schick' mir ein Tropfen-Emoji und danach mach ich Party auf ihrem Kitzler

Maison Margiella die Kicks, sie ist überwältigt in all der League, ja

Hör' mal [?], du feierst dich selber, doch digge dich nicht, nah

Diggi, ich bin ein OG, seit „Givеnchy“ feiern mich all diesе Kids, ja

Schick' mir ein Tropfen-Emoji und danach mach ich Party auf ihrem Kitzler


[Part 1: Halfcastromeo]

Popp' ihre Benzos wie Smarties

Nigger, ich komm vorbei, wir machen Party , mh (Pah)

Ein bisschen retardet, aber nur Pussy im Kopf und das war's auch schon (So viel Puss)

Ich bin addicted und sie kratzt sich fest an mir, [?] (Kleine Bitch)

Headgame ist strong, Pussy ist [?] Saint Laurent (Häh)

Baby macht drei Kilo

Ich komm' später, zu viel Vino (Sauce)

Mh, Sex szenen wie im Kino

Du bist nasty ohne [?], mh (Nasty)

Du bist ein Magician

Dick verschwunden durch den Dickdarm, mh

Keine Competiton, Nameks Vision, ihre Mission, mh (Pah, pah)
"
Misho,Srtis Hyury,"
[Verse 1]

Բաց սիրտս՝ ան բանանալին

Ես հեռու եմ սրտիցս, ես չեմ կարա ինքս

Դեռ ունեմ էնքան անելու, մի օր կգամ

Հիմա ես ժամանակ չունեմ, ինքս սիրտս բանամ

Գրական ա, բարդ ու գրավում ա

Չէ՞ որ դրական ա մարդը, երբ խոսում ա

Առանց լացելու՜

Նոտաներով ասում եմ՝Դու լ-սի, դու լ-դո, դու լ-ռե՝ շեղվա



Թեկուզ նեղվա դեմից ու անհարմար ա

Համ ձմեռ ու ցուրտ ա մեջս, համ՝ ամառ ա

Իմ շունը համառ ա

Զգուշ, բայց առխային

Եթե մեջիցդ հոտ չէկավ՝ հանգիստ մտի

Բա մարդ որ չփթի

Ուրեմն հյուր ա մոտս միշտ

Ով չունի մեջը վիշտ

Չեմ ջնջում մեկընդմիշտ

Մի՜շ, կասե՞ս ինձ խի ես պատմում

Սաղ սրտիս մեջ կայնած ես

Ու չես էլ նկատում՝ ավա՜ղ:


[Chorus]

Լույս չկա մութ ա սրտումս

Տենց ողջունում եմ՝ բա հյուր ես

Իսկ շրջապատումդ ինչե՞ր են լողում

Բա ես չպատմեմ, դու սաղ բաց ես թողում կյանքս

Լույս չկա մութ ա սրտումս

Տենց ողջունում եմ՝ բա հյուր ես

Իսկ շրջապատումդ ինչե՞ր են լողում

Բա ես չպատմեմ, դու սաղ բաց ես թողում կյանքս
"
Mi Qani Hogi,Yeghanak,"
[Intro]Never, never dieNever, never... die




[Hook: Misho, 
A. Chilla
]

Եղանակը քո մեջից հանի ու դուրս բեր

Եղանակը քո քամին էր, ես էլ վառվող լույսն եմ

Եղանակը արև ա թե քամի ու հույսերԴուրս արի քո հետ են մի քանիսը, իրանք դուրսն են


[Verse 1: Misho]

Մտածելու տեղ, մնացել ա նեղ պատին

Երազելուս տեղ, չմնամ նստած վախից

Որոշել եմ ես, էսօր հեռանամ սաղից

Սովորել եմ քեզ, կարող ա վերանամ մահից

Ուղղությունը իմ, փոխվելու ա էս պահից

Լռությունը ինձ, մնացածը քեզ պահի

Ուրախ եմ թե տխուր, կպարզվի էս տարի

Ներս արի, կհանդիպի քեզ բարին, չես սառի

Մտածելու տեղ, չի մնացել նեղ պատին

Գնացել եմ ես, էլ չեմ էլ նստելու վախից

Երեկոյան ես, չեմ էլ լինելու այստեղ

Ցերեկը քո պես, մեկնելու եմ տիեզերք

Ով էր ինձ պահել, կմնամ հավերժ ջահել

Ծերանալը հեչ, կարևորը չեմ մարել

Չեմ է մարելու, հալելույա բարե լույս

Հալվելույա էսօր ձյունը, ես էլ գնամ դուս
"
Vnasakar,Sax Qcel Em Texe,"
[Verse: Kar]

Դու տենում ես կյանքը սեռի

Ես տենում եմ սեռի ծուխ

Իմ մոտ սաղ ձեռի հետա, անտարբերություն

Կանաչ տերևը գլխարկիդ ապե թե ջեբդ

Չես Ուզում բռնես ՉՊ

Պահել չափը

Կարևորը ծուխը սիրումա ռեպ

Էտե ապե նենցա քեզ չթվա թո

Որ ամեն չատո

Մտնի սայթով սկսեն շատով ղրգել խառը չատով

Վերջում մանթո որտև ոչ մի բան է դուս չեկավ

Ես քայլում եմ մայթով ապե պադյեզդից նոր դուս էկա

Գլորվումա կամաց մաշնեն շշից արի գլատոկ

Քուչեքը լիքը բոզ իշքան ասաֆալտին լադոկ

Ցածր պերեդոկ

Սպիտակ քյառթու Priora

Ճանաչումա ոնց ջոգում եմ

Ծխող էլա շոֆեռը


[Hook: Kar]

Ես սաղ քցել եմ տեղը տեղը տեղը տեղը տեղը տեղը

Ոչմեկ չգիդի որդեղ եմ (որդեղ եմ) որտև

Չեմ զգում ոտերս ինձ զգում եմ թեթև

Ես սաղ քցել եմ տեղը(հա) տեղը տեղը(հա) տեղը տեղը(հա) տեղը

Ոչմեկ չգիդի որդեղ եմ (որդեղ եմ) որտև

Չեմ զգում ոտերս ինձ զգում եմ թեթև

Ապե ես սաղ քցել եմ տեղը
"
Misho,Nax,"
[Intro]

Նախ արի հասկանանք ուր հասանք

Ինչա խոսում էսօր լուռ մասան

Գնացինք

Տենանք ինչ դառանք


Մնացին․․․ ով չուզեց խաղա

Չէ ես էլի խաղաղ, ուղղակի դեմս էնքան դաղալ

Նախատեսում եմ էսօր աղամ...


[Verse 1]

Նախ, գրածս դատելուց միքիչ զգույշ

Որ սկսել էինք էն վախտ կլսեի արդեն ուշա

Դառել եմ խուլ, լսում եմ էն ինչ կարամ

Ինձ հանի օդերով, ոչ թե հարավ


Ասատրյան Արամ կամ Խաչատրյան չեմ

Լրիվ իմ գետով հոսում եմ ու նման չեմ

Վափշե ռեպեռին սկի

Սիրում եմ «հա չէ՞» այ ոչ թե «եսիմ» միշտ

Փորձում եմ կանչեմ ով նույն իմ խելքին


Նախ ամեն անգամ ինչ որ բան կուտակվումա մեջս

Ու նորից սկսում եմ։ Եսիմ երբա վերջս

Նախ ապրել սովորենք թե չէ մյուսը հեշտա

Որ գարունը չգա մեկա լիքը էշ կա
"
Mi Qani Hogi,Axjik Chxjik,"
[Verse 1: Felo]

Քեզ տանեմ կինո, թե կարմիր վարդեր

Որ քաղել եմ արդեն ոտերիդ տակ շպռտեմ

Թե քեզ կորցնեմ ու չփնտրեմ, որն ընտրեմ

Սպիտակ, թե կարմիր շորն ընտրեմ գամ հետդ ընթրեմ

Թե կասես խնդրեմ ու կթողես, որ գնամ

Թարսի պես մթնեց ու չեմ էլ իմանա

Ուր է հիմա նա, գուցե չմնա

Եթե չիմանա, որ չի դիմանա

Ուր է, ուր է հիմա նա

Նրան փնտրումա քամին

Ու ցանկացած ժամին

Քեզ կպաշտպանի դաժը Վան Դամից

Եսիմ որ ջանդամից, բռնել են 2 ժանդառմ ինձ

Ես էլ կատաղած ատամիս ցավից

Տվի դրա ճակատին էն ուժեղ քացովից

Դու էլ երևի սպասում ես տանը աղ ու հացով ինձ

Էն գեղեցիկ տանը, որ էրևումա ձորից

Ու լցրել ես իմ սիրած հյութը կանաչ խնձորից

Որ սառն էր, կամաց-կամաց տաքացավ

Արևն էլ մգացավ, անցավ, վարդերն էլ չորացան

Ես էլ մնացի մենակ, ոնց որ ինչ-որ արձան

Քեզ նույն տեղում սպասող ծաղիկներով քարացած


[Hook: A.Chilla]

Աղջիկ, որ չղջիկ էր ցերեկները չկար

Գիշերներն էլ դժվար գտնես էտ աղջկան

Երևի քո արյան մեջ աղ չկա ու վախ չկա

Կամ բախտ չկա գտնել էտ աղջկան:

Ով որ չղջիկ էր ու ցերեկները չկար

Գիշերներն էլ դժվար գտնես էտ աղջկան

Երևի քո արյան մեջ աղ չկա ու վախ չկա

Կամ բախտ չկա գտնել էտ աղջկան:
"
Scimmie Del Deserto,Qui,"
[Testo di ""Qui""]


[Intro]

Check it out ahLet me tell you somethingAnd it goes a little some like this


[Strofa 1: Fetz]

Ho un accendino per accendere il vizio

Solo per sfizio alla tele Maurizio quando inizio

Altrove sugli schermi playstation

Le mani portano alla bocca le skills: Jamaica nation

Di nuovo con il fumo negli occhi, qui

Noi siamo comodi aspettando rintocchi o beats sbrocchi

La testa che ondeggiando ci porta

Fuori da questa porta nell'era sconvolta è tempo di raccolta

Seduti su una sedia che assorbe

Le forze, ma questa gioventù bruciata si è fatta più forte

Dietro le sbarre, un compromesso che stringe

Giustizia dalle mani sporche una guerra dipinge

Io non ci credo, non so

È un mondo che in fondo

Non lascia spazio che so per viverci a fondo

Estremi complici e gregari di colpi alle spalle

Che non si attraggono mai in un cielo di stelle

Lo stato è il primo che spara la scena è chiara

Un corpo steso sulla terra amara stordisce la sfera

Con gli occhi al cielo mi chiedo se davvero

Non sia il denaro che distrugge il sentiero
"
CKK,Hollywood is Dead,"
[Songtext zu „Hollywood is Dead“]


[Intro]

Yeah


[Part 1]

Zerstör' mich lieber selbst (Mich selbst), bevor du denkst, du fehlst (Du fehlst)

Alles bis nachts um vier (Bis nachts um vier), doch Traum manifestiert sich (Manifestiert sich)

Trotz Summer Nights frier' ich, leerer Blick, verlier' mich

Warum muss ich denn so sein?

Lass mich doch einfach allein


[Hook]

Ah, ich brauchte dich nie (Ich brauchte dich nie), mehr Zeit Therapie (Mehr Zeit Therapie)

Final Fantasy (Final Fantasy), ich frag' mich, bist du echt? (Ich frag' mich, bist du echt?)

Sprichst viel, aber nur Text, Hollywood is dead

I already saw the devil inside your eyes


[Part 2]

Zerstör' mich lieber selbst (Zerstör' mich selbst), bevor du denkst, du fehlst (Zerstör' mich selbst)

Text back to back um vier (Text back to back um vier), doch Angst manifestiert sich (Manifestiert sich)

Nicht ich, du verlierst mich, spielst du's, wird es wirklich, ah

Warum muss ich denn so sein?

Lass mich doch einfach allein


[Hook]

Ah, ich brauchte dich nie (Ich brauchte dich nie), mehr Zeit Therapie (Mehr Zeit Therapie)

Final Fantasy (Final Fantasy), ich frag' mich, bist du echt? (Ich frag' mich, bist du echt?)

Sprichst viel, aber nur Text, Hollywood is dead

I already saw the devil inside your eyes

Ah, ich brauchte dich nie (Ich brauchte dich nie), mehr Zeit Therapie (Mehr Zeit Therapie)

Final Fantasy (Final Fantasy), ich frag' mich, bist du echt? (Ich frag' mich, bist du echt?)

Sprichst viel, aber nur Text, Hollywood is dead

I already saw the devil inside your eyes"
Mi Qani Hogi,Hayuhi Geghecik,"
[Verse 1: Միշո, 
Ֆելո
]

Հայուհուն գեղեցիկ գեղացիք նեղացրին

Ցավալիա որ հենց իրա քուչի տեղացիք

Ցավալիա բայց ինչ անես ում դիմես ով քեզ կօգնիՀուսամ որ էս կյանքում դու փնտրելուց չես հոգնի

Թե չէ ծնվել ես մի տեղ ուր գեղեցիկը թանգա նստում

Որ ընդամենը որոշել էր ման գար դրսում

Որ շատ էլ շոգա բայց միայնակ սիրտնա մրսումԿարեվորնա պակասում էլ լույս չկա հոգու ներսում


[Hook: 
Ռոլանդ
, 
Ֆելո
, Միշո]

Քեզ ման էկող մարդիկ կորել են

Ինչ որ մի տեղ փոսը փորել են

Ափսոս քեզ չտեսա հասցրեցի շեղեցին

Մի լացի արդեն քո հետ եմ հայուհի իմ գեղեցիկ

Հայուհի գեղեցիկ քեզ նեղեցին տեղացի գեղացիքՀայուհի գեղեցիկ քեզ նեղեցին տեղացի գեղացիքՀայուհի գեղեցիկ քեզ նեղեցին տեղացի գեղացիքՀայուհի գեղեցիկ քեզ նեղեցին


[Verse 2: Միշո, 
Ֆելո
]

Էլ տեղ չկա փախնելու ամեն ինչնա վախ բերումԲառերն օդում կախվելու ու իրար են բախվելու

Քեզնից անկախ հեռու հեռու տեղերը քո նման

Գեղեցկուհուն ձեռների վրա տարել էին հիմա

Իսկ քո տանը քեզ չեն թողում շնչեսԿտան ռետին որ ինչն ավելորդա ջնջես

Դու դավաճան չես հոգուդ հանդեպ էրեվումա մեջիդ պատը դա չեք կարա քանդեք
"
CKK,Biohazard,"
[Songtext zu „Biohazard“]


[Hook]

Yeah

Anfang Monat fehlt das Cash

Renn', renn', komm, ich glaub', du fällst

Tick-tick, Uhr, sie hört, sie bellt

Vi-Vielleicht ja keiner echt, ja, ja, ja

Biohazard, Biohazard, Biohazard


[Part]

Jeder von euch macht auf hart, aber weißt du was

Es heißt wenn Mama weint, ihr fehlt die Zeit, wir sind allein, Shit

Du kennst nicht mein Leid, Bitch

Ihr seid alle Sidekicks, Mob-Shit, Shawty psychic

Why would tell you lies? Bitch (Yeah)

Hab' das alles schonmal so geseh'n (Alles schonmal so geseh'n)

In den Träumen, die mich immer wieder quäl'n (Immer quäl'n)

Komm, wach auf (Wach auf)

Es hört nicht so einfach auf


[Hook]

Yeah

Anfang Monat fehlt das Cash

Renn', renn', komm, ich glaub', du fällst

Tick-tick, Uhr, sie hört, sie bellt

Vi-vielleicht ja keiner echt, ja, ja, ja

Biohazard, Biohazard, Biohazard

Anfang Monat fehlt das Cash

Renn', renn', komm, ich glaub', du fällst

Tick-tick, Uhr, sie hört, sie bellt

Vi-vielleicht ja keiner echt, ja, ja, ja

Biohazard, Biohazard, Biohazard"
Mi Qani Hogi,Dzmer,"
[Verse 1: Felo]

Բառերիս մեջ ասեղներ կան,որ մատերս են ծակում

Ենթատեքստ ` ամեն մի վանկում

Եթե ենթադրես, որ անկում ես ապրում

Հավատա քո անունն էլ կա Մի Քանի Հոգու ցանկում :

Մոլորակը մոլորվելա ու թարսա պտտվում

Շրջապատը հա բթվումա, թթուն ել` թթվում :

Մեկ մեկ լավը անջատվումա ու վատնա մտնում

Լավը կորցնողը միշտ վատնա գտնում:

Մարդիկ հա վազում են փառքի հետևից

Մոմերն ավազում են հալվում են, գնում

Բայց փառքը կարա պառկի հետևից

Դունչը հասավ խաղողին ուրեմն դնչինեն դնում:

Պիտի մի լավ օճառվես, որ լավ վաճառվես

Քեզ ասումա «Մոտ արի» հացի հոտը Օտարի:

Ընկճված ես, մոլորվածես ու չգիտես ինչ անես

Օրերն ել փոխվում են, գնում ու էլի նոր տարի։

Ու էլի ստից ժպիտ, սառը համբույրներ

Տաք երկաթին մի կպի ` վառվումեն գույներ։

Ու էլի սառը գիշեր ու սառը ցերեկ

Մի բան պիտի ցրեք

Մի բան պիտի ցրենք։

Պոկված մտքեր կան պիտի իրար կպցնենք

Հավաքենք, տանենք հեռու։

Թող բաց մնա դուռը որ մեզ չհարցնեն

Ինչի՞ ենք տաքը սառացնում ու սառը վառում

Պոկված մտքեր կան պիտի իրար կպցնենք

Հավաքենք, տանենք հեռու։

Թող բաց մնա դուռը որ մեզ չհարցնեն

Ինչի՞ ենք տաքը սառացնում ու սառը վառում
"
Mi Qani Hogi,Nerqevic,"
[Verse 1: Միշո]

Նա մի քանի տարեկան էր

Խուլ քուչա

Այսինքն շունը բարեկամ էր...

Ամեն օրը նենց նման էր նախորդ օրվան

Ու մեկա նորը բավական էր

Երազում էր մեկը տաներ

Թեկուզ սևան, ասում են ցուրտա

Բայց դե, տաներ...

Տնեցիք հավքում են մանր

Որ գան-գնան

Ու սաղ հիվանդ են, էնքան ծանր

Հենց կողքինը խուլ ու համր

Բայց չեն գալիս ոչ իրա հերը, ոչ էլ մահը

Սաղ տարբեր են ու նման են

Ու սենց տեղերն ասում են հենց դրա համար են...

Աղմկոտ են ու համառ են

Անկապ խնդում, կամ էլ լացում են՝

Անդաթար են․․․

Ինքն էլ ծանր հաշմանդամ էր

Ով միշտ նստած պիտի մնա էտ մանկատանը


[Hook: Ռոլանդ]

Գոնե մեկը, երևի

Ինձ տեսներ վերևից...

Գոնե մեկը,երևի

Քեզ տեսներ վերևից...
"
Mi Qani Hogi,Ancoghika,"
[Hook]

Ամեն ինչ անցողիկ ա, անցողիկ ա, անցողի-կող

Մի քանի հոգի կա կմնա, մի քանի, մի քանի, մի քանի, մի քանի

Ամեն ինչ անցողիկ ա, անցողիկ ա, անցողի-կող

Մի քանի հոգի կա կմնա, մի քանի, մի քանի, մի քանի, մի քանի


[Verse 1: Ռոլանդ]

Կարևոր չի ամեն ինչին հասնես կյանքում էս

Կարևորը, կարևորը հասնես կյանքում՝ էս

Քեզնից հետո  կամ կսիրեն, կամ կհայհոյեն, ու կանցնեն հաջորդի վրով էլ

Նայի քայլելուց չսայթաքես, թանկ կնստի սրտիդ վրա էլ

Ու երկնքում ամեն ինչ գրվում է, պատասխաններին, որտեղ շատ մոտ ես:


[Verse 2: Միշո]

Թող սաղ անցած լինի

Իմ ու քո մեջ ամեն ինչ բաց լինի , բա ոնց

Մեր էությունը կայացած լինի, գլուխը բարձր, ոչ թե մեկ – մեկ ցածր լինի

Թե չէ հագցնու~մ ա դառնացած ուղղին էլ, հանում ու նստցնում ա չորացած ճյուղի~նն էլ

Էտ անցյալը, ընդհամենը կքաղենք միջից , իսկ ցավը, եթե պետք ա կհանձնենք գրիչին դարձյալ

Դրա համար թող սաղ անցած լինի

Հերթական մի օր գնաց էլի

Ու լիքը բան անվերադարձ կլինի, գիտե~մ ու որ էտքանը հասկացածներին մի տե, կուզեմ օգնած լինեմ

Թեկուզ աշխարհը դառնացած լինի իմ դեմ, պտի անցածը շպրտեն, մի օր նետեն

Ուր հավաքվում ա փչացածը , ու քցելու ենք էն ամենը, ինչը ստորև հնչեցրած ա:


[Hook]

Ամեն ինչ անցողիկ ա, անցողիկ ա, անցողի-կող

Մի քանի հոգի կա կմնա, մի քանի, մի քանի, մի քանի, մի քանի

Ամեն ինչ անցողիկ ա, անցողիկ ա, անցողի-կող

Մի քանի հոգի կա կմնա, մի քանի, մի քանի, մի քանի, մի քանի
"
