Artist,Song,Translated_Lyrics
Razmik Amyan,Առաջին սեր (Arajin ser),"First first love
  
Days come go go
My dreams take with them
They take away the everlasting remote
Sad is my life alone love
 
I'm already tired of being alone
My thoughts on this and that
It's okay to listen to my heart call
Go and find my love first
  
Oh first my first love
Oh your love was very sweet
First my first love
My good and bad day friend
  
I walk this way and I don't understand
Or where does life take me?
But wherever I go wherever I am
Love will come back and find you
 
  
 My good and bad day friend
My good and bad
My good and bad day friend"
Razmik Amyan,Շիրազի գովքը (Shirazi govqy),
Razmik Amyan,Ես կամ նա (Es kam na),"Awake
I am the morning in your Light Light
Like sunshine I'm with you
Understand
Life can make your luxurious
And make you admire
But I know you will come to the guest soon at night
And again until I have the light.
 
Who does your heart tell me?
Is it a big secret?
In your life or me or he
Should one go away
That the soul will understand your
Whose captivity is he now
 
Every day
I knock the heart of your heart with the new night
Dreams of dreams
My song new
First you have to be with me
At night this crazy
Mingle sounds with feeling
This night is mine and yours but there's a question"
Razmik Amyan,Պստիկ պապան (Pystik papan),"Pait Papa went to the army
Took him with a sharp knife
He sat under the tree
Was drawing a rabbit
This has nothing to do with the song
But we wrote that violent
 When he expired his year
He was silent brilled and early army
Whenever he wanted to be given this crazy life
It was too late and had to swear to his nation
He wanted to dream in a day a crazy patch
And became a Dad independent of his will
 Pait Papa went to the army
Took him with a sharp knife
He sat under the tree
Was drawing a rabbit
This has nothing to do with the song
But we wrote that violent
 It was a year since the army's life
And there is nothing left of our father
He has secretly cried secretly
Because he's left manto from this life
He wanted to dream that one day would do a crazy patch
And became a Dad independent of his will
 Pait Papa went to the army
Took him with a sharp knife
He sat under the tree
Was drawing a rabbit
This has nothing to do with the song
But we wrote that violent"
Razmik Amyan,Սիրեցի (Siretzi),"I seemed to fall into the trap of love
When I saw me suddenly
Lover my heart makes me
That my heart will open myself before you
 I loved I loved I you
Burned my soul you with your smile
Look at me look at you please
Hope to give me hope for me with your smile
 You are very good and you deserve me
You won't find a boy like me
And I will say the word of my heart again
That I told you a while ago
 I loved I loved I you
Burned my soul you with your smile
Look at me look at you please
Hope to give me hope for me with your smile"
Razmik Amyan,Ուր են (Ur en),"Where are the days?
Where are the words?
That had told me my dear
Where are your eyes?
Your silent views
That captivated my soul
See where you
Who have you dreamed that you didn't get
I haven't forgotten you
Come back again
 See dreams of my soul
That you are with me
Like crazy I love you
Love you have forgotten about me
We will not be together
Longing waiting for you
I love you
Neat
 Are silently silent my days
Are my memories silently
It's pointless life to me without you
Are in vain in vain
Are my emotions in vain
That live in my soul
See who is the only one of your heart
That you will accompany you
Your all life
 See dreams of my soul
That you are with me
Like crazy I love you
Love you have forgotten about me
We will not be together
Longing waiting for you
I love you
Neat"
Razmik Amyan,Սերն արդեն անցել է (Sern arden antzel e),"Silent autumn a cat
My soul is so clean
Wanted to capture one and to love him endlessly
But alas at the same moment
I saw just the one
I'm having an endless regret for
I ask you to beg
I don't want to leave too
I have loved to cry
I have suffered endlessly for you
I am already tired of you
I have already worn out from your love
Eventually I Fell In Love Another
 Love has already passed and the Spirit has stifled my
And memories have long been forgotten with you
Love has already passed everything else forgotten
All the places of the past have long been closed
Love has already passed and the Spirit has stifled my
And memories have long been forgotten with you
Love has already passed everything else forgotten
 If I knew that you
You don't get poked from me
Or I Kaned Your Hugs
I am captivated by DarNalo
I would run away from the farmer
I will look for my love
I'm having an endless regret for
I ask you to beg
I don't want to leave too
I have loved to cry
I have suffered endlessly for you
I am already tired of you
I have already worn out from your love
Eventually I Fell In Love Another
Love has already passed and the Spirit has stifled my
And memories have long been forgotten with you
Love has already passed everything else forgotten
All the places of the past have long been closed
Love has already passed and the Spirit has stifled my
And memories have long been forgotten with you
Love has already passed everything else forgotten"
Razmik Amyan,Դու Կաս (Du Kas),
Razmik Amyan,Իմ սրտի այգին է կանաչել (Im Srti Aygin e Kanachel),
Harout Pamboukjian,Տարիներ (Tariner),"Irrevocable
Like a road like you passed
Do not leave a crash in my heart
I waited for you too long
 And this life
Ways to the ways
Hope to meet you again
But alas I stayed alone
 Years passed
Our love and tears became a memorial
My dreams come
Like the last shift of sunset
 Years passed
Our love and tears became a memorial
My dreams come
Like the last shift of sunset
 There was days
I didn't forget I my dear
And the love and longing in order
I didn't forget your warm kiss
 And this life
Handsome in the ways
Hope to meet you again
But alas I stayed alone
 Years passed
Our love and tears became a memorial
My dreams come
Like the last shift of sunset"
Harout Pamboukjian,"Հայ Ֆեդայի, Ձան Ֆեդայի (Hay Fedayi, Jan Fedayi)","Mush and Sasun's Armenian boasting stood up
At the cost of countless victims, the nation saved
Immortal life to the nation
Brave Andranik Gevorg Chaush always ahead
 Armenian Fid's Jan Fidda
We die to you
You are the Savior of our Armenian nation
We live in your hope
 Our holy monastery is besieged with many troops
Are in him with Fid's four-wheeled troops
Andranik ordered us to give you the Ghurban
Let's kill the unrighteous enemy from us trembling
 Brave Fidah Together Together
Dogs Dog Ascles with Ottoman
At midnight, the chain was torn from the monastery
Brave Andranik Gevorg Chaush Your Spirit Gurban"
Harout Pamboukjian,Հայ Քաջեր (Hay Qajer),"Sasna's braves took weapons
Deathed in Eyes
Virgo girls of the Armenian nation
Assyrians Klin took
 Armenian Brave Armenian Brave Hours Our Correspondent
Let's campaign Armenia with a group of Armenian volunteers
 It was the courtyard with braves
Taron World mountains
Mush field until Sasun
Brave Arabonic Ku Htsker
 Armenian Brave Armenian Brave Hours Our Correspondent
Let's go to Armenia with Arabo's gravity
 FIDAY PARTICIPATION Gevorg Chavush
Unsteady with Braves
With the feats made
Scribbled the mountains aslan
 Armenian Brave Armenian Brave Hours Our Correspondent
Let's release Armenia under our tricolor flag
 Serob Source Nemrut mountain
Children's brave
For the Fatherland For
Or death or freedom
 Armenian Brave Armenian Brave Hours Our Correspondent
Let's release Armenia under our tricolor flag"
Harout Pamboukjian,Zokanch,
Harout Pamboukjian,Դու Ուզեցիր (Du Uzetsir),
Harout Pamboukjian,Թե Աչերես ՔԵզ Որոնեն (Te Achers Qez Voronen),"Both of my eyes seek you
I will close with dark eyelids
In which world don't see you
In which world don't see you
 When the crazy teese give a name
I will be blending with teeth
Which name and not toch?
Which name and not toch?
 But when my heart wants my heart
Take you in my hands
What will I close my heart?
The word of my heart
How will I close the language of my heart?
 When the crazy teese give a name
I will be blending with teeth
Which name and not toch?
Which name and not toch?
 Both of my eyes seek you
I will close with dark eyelids
In which world don't see you
Don't see you
In which world don't see you
 Oh
But when my heart wants my heart
Take you in my hands
What will I close my heart?
The word of my heart
How will I close the language of my heart?
How will I close the language of my heart?"
Harout Pamboukjian,"Արա, Վայ, Վայ (Ara Vay, Vay)","Love is my lovely
Flowering spring you are
Wherever you are my dear
You're in my heart
 See not Krkhares
I'm crying. I
Or leave you from me
I will be very deep
 Ara Woe Woe
Oops Woe Wai
Ara Woe Woe
Oops Woe Wai
 Your love is sweet
My young heart in the heart
Love you my praiseworthy
You don't believe
 See not Krkhares
I'm crying. I
Or leave you from what
I will be very deep
 Ara Woe Woe
Oops Woe Wai
Ara Woe Woe
Oops Woe Wai
 I have to sing
About your love
Oh why are you tormenting me?
Be together
 Lip Honey Yar
Boyd Chinari Yar
MARAL MARAL IS
Maral love you
 Ara Woe Woe
Oops Woe Wai
Ara Woe Woe
Oops Woe Wai"
Harout Pamboukjian,Սիրում եմ քեզ (Sirum em qez),"I love you
You forgot
I waited my life on your journey
My dreams went to my love left
 I love you
You forgot
You burned me with your eyes with your eyes
I loved you left my soul
 I love you
 Go go to someone else you believe
I will not forget you too
It's a pity my life went to my love left
I love you
 I remember you
It is time
You burned me with your eyes with your eyes
I loved you left my soul
 I love you"
Harout Pamboukjian,Ես առանց քեզ (Es aṙancʻ kʻez),"I have given love that I will make love from you
But you're already far away from me
Looking for in your eyes I'm sad.
I am looking for my sun into the clouds
 
I will live without you without the sun
I'll be alone without you perhaps
I without you like a flower without water
I will live without you without the sun
I'll be alone without you perhaps
I without you like a bird without the arm
 I have come again to tell you my dear
That my soul is still saddened and crying
I'm walking a sad alone
I am looking for my sun into the clouds
 Now I have come to tell you my dear
That my soul is still saddened and crying
I'm walking a sad alone
I am looking for my sun into the clouds
 
I will live without you without the sun
I'll be alone without you perhaps
I without you like a flower without water
I will live without you without the sun
I'll be alone without you perhaps
I without you like a bird without the arm
 I will live without you without the sun
I'll be alone without you perhaps
I without you like a flower without water
 I Without You You Without You Without You
Like a flower without water
I Without You You Without You Without You
Like a flower without water"
Harout Pamboukjian,"Տարիներ կըսահեն (Tariner, tariner ksahen)","My peaceful evening is now
Middle and sad and sweet
Will never forget my heart
My clean first my dream
 Years will say for years
Will Mooned Dreams All
I will be sorized your image
Days unsteady and astess
 And torment and breakthrough and sadness
Black days I'll still
Do your names let the beacon be me
Against false life and bitter death"
Harout Pamboukjian,Մշո դաշտեր (Msho dashter),"Msho fields shine to cover
Water heater in fields
Ernek cranes come back
Good news to bring our
 Sasno mountains went to canyons
Fighting Handsome
Brave dro weapon was broken
Pstik Shield Cream Calls
 We went to the Sasun to enter Van
Mush Alashkert Ardahan
Nation's heroic dares
Homeland salvation
 There is no hour of guys
Dog turket tap four sides
Gevorg also did not end
Turks a thousand votes
 Removed poured into sharp bullets
Next to it fell to the oh pulled
Mountains will valley
Gevorg Chaush would prove
 We went to the Sasun to enter Van
Mush Alashkert Ardahan
Nation's heroic dares
Homeland salvation
 Pulled lightning darkened heaven
The dog covered the Turks crying
WATER SAREN WITH A group
Run down to downward
 Demit from Deminet is down
YSMUNYWORD WITHOUT
Big guys die to you
The Turk will end one day
 We went to the Sasun to enter Van
Mush Alashkert Ardahan
Nation's heroic dares
Homeland salvation
 We went to the Sasun to enter Van
Mush Alashkert Ardahan
Nation's heroic dares
Homeland salvation
 We went to the Sasun to enter Van
Mush Alashkert Ardahan
Nation's heroic dares
Homeland salvation"
Harout Pamboukjian,Հայի աչքեր (Hayi ačʻkʻer),
Harout Pamboukjian,Իմ Երևան (Im Yerevan),"When the actuals open
On my light on the city
And it awakens Yerevan
Deeply sleeping night
  You Good Morning Day Good
My Yerevan Hire is Armenian
 Is beautiful in Yerevan
ENTERNET WITH INTERNATIONAL
Is very lovely my city
With thousands of lights
  You Good Morning Day Good
My Yerevan Hire is Armenian"
Harout Pamboukjian,Լեռան Լանջին (Leran Lanjin),"FIDATES FOR END HAVE BEEN DISAPPOINTED BY THE LANGUAGE
Feel free to sleep always love children
Let's go to Armenian girls to reach Mount Sim
Nation's defender fidayans for urine victim
 We reach out to the Holy Semicorn of the Holy Semicorn of Tears
We have lost our support for our homeland
We arrived Armenian girls songs soft together
Let's dump her tears on the sacred tomb martyr
 Weave Wreath on their head Rose violet
DON'T HAVE THE TERRITORY OF THEIR MEMORY
For urine, a victim of Tatul's loud braves
That sleeping fighters on the slope of the mountain
 For urine, a victim went as great courage like Simon
That sleeping fighters on the slope of the mountain
 For urine, a victim went to the loud courage like Vigen
That sleeping fighters on the slope of the mountain
 The supreme brave of the Armenian nation was victimized for us
That sleeping fighters on the slope of the mountain"
Harout Pamboukjian,Մշո Աղջիկ (Msho Aghchik),"What a lovely picture you have
What a lovely picture you have
Armenian gold enemy Anahit
What good are you a Mush girl?
Armenian gold enemy Anahit
Mush girl
Mush girl
What good are you a Mush girl?
 I have left you at your
I have left you at your
I taste and smell
What good are you a Mush girl?
I taste and smell
Mush girl
Mush girl
What good are you a Mush girl?"
Harout Pamboukjian,Սառը ջուր (Sary jur),"I'm selling water from morning to the evening
Cold water
Buy water cold water
This tiny pulplers
 I sell water to cold water
This tiny pulplers
 My mother at home murmurship
I will wait for the eye of water
I sell water to cold water
That I will take a tiny bread
 I sell water to cold water
This tiny pulplers
 My sister at home my tiny
I will wait for the eye of water
My sister at home my tiny
Weeping Eye Water
 I sell water to cold water
This tiny pulplers
 I sell water to cold water
That I will take a tiny bread"
Harout Pamboukjian,Ալ այլուղս( Ay Ayloughs) (Al ayluġs),"Al-Davard
 Girl
Layer is lost on your door
The murmur will not come out
Lucky threw me on your door Yaro Jan
Beautiful boy give a foreigner
 Boy
There is no altrid to me
I swear to you my soul witness
Whoever found let him bring the yaro honey
A lovely girl your freely
 Girl
My traitor was to share Yaris
Al Abreshum was cast out
My picture was pulled by Yaro Jan
Beautiful boy give a foreigner
 Boy
Black girl white Hit
To the altogether, tie my wound
Siroud capture don't torment me to Yaro Jan
Erdded girl to a clearer"
Harout Pamboukjian,"Օ, քամի, քամի (O, qami, qami)",
Harout Pamboukjian,Կյանքի կարուսել (Kyanqi karusel),
Harout Pamboukjian,Քսան տարեկան (Kʻsan tarekan),
Harout Pamboukjian,"Հ՛եյ ջան, ղափամա (H՛ey ǰan, ġapʻama)","Hey Ghapama
Flavored flock of Ghapama
Hey Ghapama
Flavored flock of Ghapama
 Bakhchen Ripe Pumpkin
We gave us a cut
We filled with sugar
Hanged in tonri
They came and the hoof
They came to us and Morke
Came to Uncle Kernek
Introduce and Tequeri
They came to Sanik Sanah
Harsnakur and Holidayer
Came closely remote
Mother-in-law in Cushear and godfather
JAIN
Hey Jan Hey Hee Jan Hey Jan Hay
JAIN
Hey Jan Hey Hee Jan Hey Jan Hay
 
Hey Ghapama
Flavored flock of Ghapama
Hey Ghapama
Flavored flock of Ghapama
 Spoon came home
A hundred people in vague
What should I do what to do?
One pumpkin one hundred
They came and the hoof
They came to us and Morke
Came to Uncle Kernek
Introduce and Tequeri
They came to Sanik Sanah
Harsnakur and Holidayer
Came closely remote
Mother-in-law in Cushear and godfather
JAIN
Hey Jan Hey Hee Jan Hey Jan Hay
JAIN
Hey Jan Hey Hee Jan Hey Jan Hay
 
Hey Ghapama
Flavored flock of Ghapama
Hey Ghapama
Flavored flock of Ghapama
 Hey Ghapama
Flavored flock of Ghapama
Hey"
Harout Pamboukjian,Գարուն չկա (Garun čʻga),"Mush Fields My lovely
Newly opened in bright spring
There is no spring for us
Should we fight?
We have no quiet and pause
 Sipa mountain grass
SNASH WAS WAS MADE
Bride and girl grabbed
Kids massacred
Hey Fear Hey Fear Sasun
 Maruta High Mountain
Fidaas swore
Freedom of our fair
Should we fight?
Should we fight?
 Aghbyur Serob Hasan
The Armenian braves entered a position
Andranik was helped
The enemy slaughtered
They released Mush Sasun
 Let the enemies know
Fida are real
We will break right and left
We don't have a voluntary death
 Gevorg Chavush Our Brave
Was screaming forward
God is assistant
Let's go into the trough
Let's save Country Armenia
 Foursome in groups
We reach Taron and Sasun
Let's enter Taron and Sasun
 God is assistant
Let's go into the trough
Let's save Country Armenia
 Foursome in groups
Let's enter Taron and Sasun
Give the brave to Sasun"
Harout Pamboukjian,Երեքնուկ (Yereqnuk),"Oh I knew you loved
Now I know you definitely
We are running in the seasons
Wet and wet in the grass
 Then sit happy and happy
We reap the clover bush
And with that familiar clover
Siremony in endless play
 
Wouldn't you love me?
Or isn't it complicated?
To find in three names
My name at least once
 Three people in the names
And you are always always and I always or
I am your name I always snatch
But you have never been mine
 How many times do I have to ship?
Sad thoughts away from me
And I'm afraid to think about
That you never love me
 
Wouldn't you love me?
Or isn't it complicated?
To find in three names
My name at least once
 Wouldn't you love me?
Or isn't it complicated?
To find in three names
My name at least once"
Harout Pamboukjian,Մոգական լապտերիկ (Mogakan lapterik),
Harout Pamboukjian,Ազատ ոգին Հայաստանի (Azat vogin Hayastani),"The free spirit of Armenia grabbed the throat
Horrified hurried ran out of the brink of wolves
The righteous forces entered Shushi with his native crazy struggle
The Turkish question was a savage question
 We are our unbelievable children
From Turkish dogs we will release our Nakhichevan
My eye on the way to Mush Alashkert Kars Ani Van
Sea Masis stand proud and steadfast
Remember the sea of old Armenia from the sea
We will end the dog of the enemy fraud
 The strength is boiling in the veins of our Mountain Our Artsakh
Will the will to nail in the Armenian land and the fields of Karabakh?
Let the detachments take strength into our Armenian fiday
That backbell the holy lands of our paternal
 We are our unbelievable children
From Turkish dogs we will release our Nakhichevan
My eye on the way to Mush Alashkert Kars Ani Van
Sea Masis stand proud and steadfast
Remember the sea of old Armenia from the sea
We will end the dog of the enemy fraud"
Harout Pamboukjian,"Հիշիր, սիրելիս (Hišir, sirelis)","We have already gone on the way to our love
Forgotten sad and dossier trail dark
We don't like each other like crazy
Smile lightly generously lovers
 
Remember my love past
How many dreams and gold memories?
Evaporated
 Now when you don't come to embrace me love
It's cold and idle without you my love
The world has created
 And the rain longing like a cloud
Gently went with my heart
Passed and went to
 Trembled his trail in my heart
And made you miss you again
And it went on
 
Remember my love past
How many dreams and gold memories?
Evaporated
 Now when you don't come to embrace me love
It's cold and idle without you my love
The world has created
 
Remember my love past
How many dreams and gold memories?
Evaporated
 Now when you don't come to embrace me love
It's cold and idle without you my love
The world has created"
Harout Pamboukjian,Նրանք ընկան (Nranq ynkan),"They fell into suffering and powerless
Orphaned homeless deported piles
Unfortunately dropped offended and wounded
Tortured beings tortured with piss
 They fell from the forgotten all
Miserable abandoned unauthorized and unused
Avagog fell out of the forgotten world
And the dead are dead to die ruthlessly
 When Spring was a vassel of a loving jewelry
Before the native land removed
Holy creatures of mankind everywhere
Little and tortured hate all
 They fell powerless irreversible
And there was no humanity there was no conscience and God
Dangerous and Amorated Miserable
Mormares faded in my chest silently
 Fallen rrevisions in an unfinished
Song wounds When spring was fragrant
When they had love song and faith
But alas were buried silently and a leisuit
 They fell orphaned wounded
An innocent people when it had land native
While the Mormum is still my heart HEG Lonely
Their BUDCO
 But we how we had a phoenix
Faithful Holy Fire loves loves
When the nation of Hayk and Ara are the Armenian
And we have a homeland Ararat and Diaspora
 They fell but not silent forgotten
They live in eternity full of holy faith
And with this Armenian words our Mashtotsyan"
Harout Pamboukjian,Թող վերջին անգամ (Togh verjin angam),
Harout Pamboukjian,Գնդակ որոտաց (Gndak orotacʻ),"Bull thundered November
We are besieged to love my Sose
Weapons Reboot Courage
Your Favorite Serob's covenant day is this
 SOSEN SEROB SERGE I AM
I will wait for an armed sound
Every day every hour to die next to you
Sosen is ready to die with you
 Give the first vital friend
Where are you laying on this time?
I poured curls of mats your hair
You hugged Mosye with a victorious arm
 Let's attack the rifle nearby
Let Sulan Eldiz Palace
Let's find out the flags of the Major Dashnaktsutyun
Long live Christopher Rostom Zavaryan
 Well reach the help soon
Serob will die in love of nationality"
Harout Pamboukjian,Ջուլիետա (Julieta),"I loved that your eyes
Black eyes you Julieta
I loved that your eye
Your hairs you are my Juliet
 I danny love you
I will take your pain
You are my Juliet
 There was not forgetting you days
I became crazy about your warm love
But know you will always love you
And I won't forget you to my Juliet
 I danny love you
I will take your pain
You are my Juliet"
Harout Pamboukjian,Ետ Արի Թառլանս (Yet Ari Tarlans),"YARS GAVET HAS BEEN RESPONSIBLE
Horse riding on the road
The last time will not be back
WILL NOT GIVE UP WITH GOD
I'm afraid of Paruem
Will not make a kiss from his lips
 Come back Tarlans Don't go to Jayran
I'm sorry for myself, I will be lost in me Maral Har
 YOU ARE ALSO AGAINST IGIT
I have a Saz I speak
Night day to Yaris Place
I have a lip with my lips
I will cure the Werner with a poop
Multiply my heart I have
 Come back Tarlans Don't go to Jayran
I'm sorry for myself, I will be lost in me Maral Har"
Harout Pamboukjian,Կանցնեն Օրեր (Kancnen Orer),"Life temporary
Even if you are king
The end of us all the same
Tell your soul what color a
Let me see who you own
 We choose from birth
To parents from our long ago
Semi-headed case
We have to end up
To hand over the Spirit to the light
 I have turned so much
I have already lost the account
And remember faces
There have been many cases
WITHOUT YOU WILL NOT BE LIVE
 Everyone wants to be holy
That sins act hidely
This question is very delicate
Come give you current
Which world will we save?
 Will go for years
And I'll get handed again
Write songs for you
And I will love you again
 Will go for years
And I'll get handed again
Write songs for you
And I will love you again
 The past trials
I appreciate a lot
Bumping ahead with it
And I didn't be amazed
Both people don't like ki
 There are values for me
More expensive than gold
And I write songs
That I will get to heaven
 What do you need in this life?
A luxury house and a lovely dog
That tomorrow will be a guest
There is a chance to surprise
 Please give you a question
What do we do in life?
Whatever we have to do
How do we reach that?
 Will go for years
And I'll get handed again
Write songs for you
And I will love you again
 Will go for years
And I'll get handed again
Write songs for you
And I will love you again"
Harout Pamboukjian,Այգեպան աղջիկ (Aygepan aghjik),"I have reaped apples
Taken with sieve
I will take it to Yaris
Thousand Nazes
  
You do a game in the park
Do you do a dagh with my heart?
Gardener girl what a nazz
 Every morning
Bright dawn
Waiting for Yar Jan
On your way
  
 Hey lovely girl
You dard don't
I miss your journey
Come early"
