Artist,Song,Translated_Lyrics
 Lav Eli,Քո աչքերը/ Qo achqere (Qo achqere),"Your eyes have made me mad
Your lips are a winery for me
 When I walk with you
You tender smile tell me
I'm dreaming
I fly to heaven at all your sight
And I don't go down a long country
 Your eyes have made me mad
Your lips are a winery for me
Your eyes have made me mad
Your lips are a winery for me
 I feel a row
Like the bear in honey and you
Everyone will tell
That I know seven songs due to life
And all seven about you
 Your eyes have made me mad
Your lips are a winery for me
Your eyes have made me mad
Your lips are a winery for me
 Many always tell me
Bad this guy
But your wonderful eyes
I'm going to last
The dream of this heaven is stretched for me too long
very long
 Your eyes have made me mad
Your lips are a winery for me
Your eyes have made me mad
Your lips are a winery for me"
 Lav Eli,"Արևին, Արևին (Arevin, Arevin)","I sang the sunshine
Night's bottomless darkening
An incertal longing desperate
Gold heavenly and lazim
 
 You sang the sunshine
Rightsome Moon's arms
Idddly dreamed of a dream
The milkyle is my white and pure
 
 You cried in front of me
You asked me a song from me
I gave you your songs while you
You sang someone else in my lap
 
 Oh is lost confused my soul
The body and the spirit are notified
I eaveed to me here
You didn't come and there was no
There was no noncomplage
There was no noncomplage
I eaveed to me here
You didn't come and there was no
There was no way out for me
 
 I sang the sunshine
Night's bottomless darkening
Loud salvation in the sky
I called
Falling Hashaki in Mistush
 
 You sang the sunshine
But you came to the moon's arms
Finding in the summer and consolation and
restful
In my lap to fade in sleep
 
 You came to fade in sleep
You came to me forever
Did I know that my light was?
It was day to be just going to be you
 
 Oh is lost confused my soul
The body and the spirit are notified
I eaveed to me here
You didn't come and there was no
There was no noncomplage
There was no noncomplage
I eaveed to me here
You didn't come and there was no
I'll find a way out for me"
 Lav Eli,Աշուն (Ashun),"Marmhakek that clown autumn
Drives his united bike
You do with me
Autumn rogue autumn
 I was born as a leaf yellow
Light days living in the last days of autumn
A late-law tree breathtaking at the expense of his memories
Hopelessly under the burden of that tree
 In the leaves of old and oldest
The old and religious passions are tired of Kenov
Poisoning present injecting the past
Painting the present with an unreal wound
 And hairstyles These alien and movements are foreign
And views that make it blank
And heads blanks from these views
Spines curved and wood listener
 And structures this gray lifeless gain
And the trade this brute and absurd
Wasn't there left in a book?
Where can be thrown into
 Where where is my teeny light?
My Girl Huri Has Where Are You Corner
If you still you can still hear me
Tear me out of that autumn of the ruthless hug
 These flames lie to lie ur warmth
And the delight of the diggery is an animal
This request false and saluters Sin
Is there nothing already?
 Located girls wax and boys in this blunt
Should marches be borne by the horns of the calf
Should throat breath a bone's handsome
Suitable for place to choke piet
 Chorus
Where where is my teeny light?
My Girl's Fairy Whether Corner
If you still you can still hear me
Tear me out of that autumn of the ruthless hug
 Where is this unknown wheel roll?
One mother and bureau
 This land is sung by painted blood
The pounded land of these bodies
Waiting when Kochi's last
Disturbed crowd blunt
 I know it should be happy to sing songs
You have to rejoice and praise the present
That we are alive still in this edge of miserable
That there is still bread and drinking to eat
 Marmhakek that clown autumn
Drives his united bike
You do with me
Autumn rogue autumn"
 Lav Eli,Սկիզբը (Skizby),"When the beginning began
When the sky was proud
How good was it with you
Touch to delight
Steps were flying
What we could keep us
 Heaven blood faith Fire and passion
Sincere proud happy and a little crazy
Was good at the beginning
 The beginning was the key to all door
And that was true
Pity that only
We understood very late we
There were doors that didn't need to open
 Heaven blood faith Fire and passion
Sincere proud happy and a little crazy
Was good at the beginning
 What happened to us? Which scbes were we so good
It was wrong to recognize each other so close
How much pain we have sowed by our hands
Sprinkle and have gone through we have tried to try
Extinguish our beginning"
 Lav Eli,Անձրևաշուն (Andzrevashun),"I went on a road
I went to this world
Restless and four
darkest corners"
 Lav Eli,Աղջիկները չունեն (Aghjiknery chunen),"Girls don't have a mind
It's been to me for a long time
Their my charm always
It is very difficult to arrive
But you will not escape my hand
 Maybe I'm miserable too much
Or does not cover my strength
I have no place on your breast
And I have to go home
 I am a stone I'm in one's kidneys
I'm pressured and waiting for when I'm going out
 
Even though you become a tree
Or something alive
I have no ban
I will not stop in front
I didn't make me touching
What is your mind?
If you don't love me
I'll eat your grandmother
 When I sleep in a dream
I see bad things
Or I'll tell you my dream
I will definitely cause me
Even you will bump me in Sevan
 I don't have any money but need a lot
There are many things to do
Before God we have joined
I will keep you and a pig
 I'm a stone in someone's kidneys
I'm pressured and waiting for when I'm going out"
 Lav Eli,Ես ձեզ պես չեմ (Es Dzez Pes Chem),"I'm not like you
I am another
You are different
How many times have you wanted to throw it on your face
How much torment and pain has filled my soul with pain
 That I am not like you
You are not like me
That I am not like you
You are not like me
 How grateful to God I am not like you
How wonderful it sounds like I'm not like you
I have so many nice worlds
Where there is no room where I am only
I am alone there
I'm so alone
 How can I forgive God?
To believe him and his righteousness
Handed care of one's own loneliness
To believe him and his righteousness
Handed care of one's own loneliness
 I'm not like you
I am another
You are different
How many times have you wanted to throw it on your face
How much torment and pain has filled my soul with pain
 That I am not like you
You are not like me
That you are not like us
We are not like you"
 Lav Eli,Փողը (Poghy),"The cement of family walls is money
Anchor throw in my head
Alarm clock has become a tense of timeless hours
Love nice addition money
It tells the story of profound ads
And I have always been a fairy-tale supporter
 I have no freedom that is money
The world I have seen is the money
My Family Disputes is Money
The girls I don't have the money
 My unjust humiliation is the money
My unsolicited education is the money
My dear enemy is the money
My hateful friend is the money
Theorifier
 The congregation sings vanity that money is vain
But I can't throw away what I don't have
How much I will go to my Femel spring
Dear Heraclite Must True Money
 My unsure work is the money
My unpaid gifts is the money
My missing hands is the money
My inferior assistance is the money
Theorifier"
 Lav Eli,Դե Գնա (De Gna),"Do you know?
That I
Don't try to interrupt
Is it even that
Didn't feel it
Wrap unlucky
 Don't you remember this smile?
Warm gaze in my eyes
Don't you remember you crazy evening
When you and you
 Well go well
Don't want to be in your hands a toy
Well go well
Will you remember after the smile your gaze?
 There was a time when I lived with you
There was a time when I was looking for you
There was a time when my dream looks like
Was becoming a fire and flushing life
 Well go well
Will you remember after the smile your gaze?
Well go well
I won't have your favorite baby from me
 You still feel too much
The arm is tight
You love you
You still have a lot of stuff
Breath hot
Your Wordwave
 Don't you remember this smile?
Warm gaze in my eyes
Don't you remember you crazy evening
When you and you
 Well go well
Don't want to be in your hands a toy
Well go well
Will you remember after the smile your gaze?
 Well go well
Don't want to be in your hands a toy
Well go well
Will you remember after the smile your gaze?"
Silva Hakobyan,Ուշածելեմ Եմ (Ushatsel Em),"One day my heart was offended by you
Left away left unreasonable
The lying of a close person became right
My life became unfounded
 See a holiday in the heart of us now
Let me say that he has become half of life for you
 I'm late I already
How to smooth my mistake
Would you only love you love you only?
I'm late I already
How to smooth my mistake
How my heart deceive that I love you only
 I love I will love
I love I will love
 Every time you see each other
We are always confused
Whether speaking or talking out of your love
We consider it past
 My pride hurt me that I would be forgiven
And now I can't get you back too late
 I'm late I already
How to smooth my mistake
Would you only love you love you only?
I'm late I already
Do you like you?
How my heart deceive that I love you only
 I'm late I
I'm late I
 I love I will love
I have loved"
Silva Hakobyan,Սասնա Պար (Sasna Par),"De Kele Armenian de Kelle
De Kele Kele Kele
Shell pasted
Let the fucking dance
De Kele Armenian de Kelle
De Kele Kele Kele
Right pulse left hit
Let the fucking dance
 The sun went out to Saren
Zurna blew the stone
Dhol stripped rocken
Bach Ta Rupan Tap Ru Pope Ta Toup
Sasna dance sounded
Zurna called her sweet
Dhol of Strongly Pull
Bach Ta Rupan Tap Ru Pope Ta Toup
 Hey Hey Hey Mountains
You Ghurban
Your spirit is in us
 Chorus
De Kele Armenian de Kelle
De Kele Kele Kele
Shell pasted
Let the fucking dance
De Kele Armenian de Kelle
De Kele Kele Kele
Right pulse left hit
Let the fucking dance
Also find other songs of other songs
On the slope of Masis Mountain
Aragats's skirt
Gyten hold together
Bach Ta Rupan Tap Ru Pope Ta Toup
Mush and Sasun stand
And we will strike in toe
Dhol jet
Bach Ta Rupan Tap Ru Pope Ta Toup
 Hey Hey Hey Mountains
You Ghurban
Your spirit is in us
 Chorus
De Kele Armenian de Kelle
De Kele Kele Kele
Shell pasted
Let the fucking dance
De Kele Armenian de Kelle
De Kele Kele Kele
Right pulse left hit
Let the fucking dance"
Silva Hakobyan,Մռութիկ (Mrutik),"Morning in the room still appeared darkly from the sun too early
A bright and bright glare to me awake
Scored a ball with a ball and stopped innocent
I understood the day as you always started with you
 In your puke's head so much questions and answers
How should I get out of the middle?
 
The snout with your shabbal eyes your shine
Even the evil wolf smacks you sweetie with your heck
The snout with your shabbal eyes your shine
Warm and good with your smile you do your first step
 Irika will look at a multiculous love that sleeps immediately
But you're crazy rotating wheel very active
Until you don't know for sure we can breathe freely
One person with five people noise sweet crazy
 In your puke's head so much questions and answers
How should I get out of the middle?
 
The snout with your shabbal eyes your shine
Even the evil wolf smacks you sweetie with your heck
The snout with your shabbal eyes your shine
Warm and good with your smile you do your first step
 In your puke's head so much questions and answers
How should I get out of the middle?
 
The snout with your shabbal eyes your shine
Even the evil wolf smacks you sweetie with your heck
The snout with your shabbal eyes your shine
Warm and good with your smile you do your first step"
Silva Hakobyan,Տնից Պախել Եմ (Tnits Paxhel Em),"I wore the green clothes
I have literal to Honoraboccham
I have been hidden from secret home
I came to stand in front of your house
 Bring a day and day with a gallery
Take a hello from me to Yaris
Say to go out from the lodge
He promised let him come to the bride to take me
 I have tied my long chews
I also painted my eyes by Surtain
I have believed in your words
I came to stand in front of your house
 Bring a day and day with a gallery
Take a hello from me to Yaris
Say to go out from the lodge
He promised let him come to the bride to take me
 I wore a high heeled shoes
I have tied the pattern of the pattern
Barely barely escaped from home
I came to stand in front of your house
 Bring a day and day with a gallery
Take a hello from me to Yaris
Say to go out from the lodge
He promised let him come to the bride to take me"
Silva Hakobyan,Քարե Դարդ (Kari Dard),"Day seconds
Months and century
Tangle
Mixed
Century months of minute and day
When they came to an end
Who is to blame?
 The Stone Age has developed
Forgot his past
Perfect past
Game is seemingly
Absent present
Bright future
 
 Hayhie Heehi
Huha Kala Kaley
This is what traps
What stone dare?
 Hayhie Heehi
Huha Kala Kaley
The condition is complicated
This is a stone dow
 Dark past the bright present
Were crucified and taken
The century is century
When it came when it passed
YOU ARE THE ARMENIAN LAW
 The Stone Age has developed
The whole world was surprised
Perfect past
Game is seemingly
Absent present
Bright future
 
 Hayhie Heehi
Huha Kala Kaley
This is what traps
What stone dare?
 Hayhie Heehi
Huha Kala Kaley
The condition is complicated
This is a stone dow"
Silva Hakobyan,Գիշեր (Gisher),"It's night
My soul is empty and hard
I want to dream
I want to love you
I want to forgive you
But it's too late
My soul is fog and sad
You have left me
Leaving me on a half way
You forgot about me
Was your soul coached
 I don't want to forget you
To leave my past silently
This deception of this torture
It is impossible to endure
I can't forget you
 I have loved
I have not noticed a drunk from your love
That someone else is captivated you
That someone else has ruled you
To Another You Love
I'm silent
I wait with faith that you will come
Your mistake you will feel
And again will you give me love
I will give my life a new shot
Will you give me life with your soul?
 I don't want to forget you
To leave my past silently
This deception of this torture
It is impossible to endure
I can't forget you
 I don't want to forget you
To leave my past silently
This deception of this torture
It is impossible to endure
I can't forget you
 I don't want to forget you
To leave my past silently
This deception of this torture
It is impossible to endure
I can't forget you"
Silva Hakobyan,Իմն Ես (Imn Es),"I saw you and my soul shone at once
I realized that my life was filled with love
Mad my soul fell silently in love
I felt I know I love you
 Don't even pretend
Don't even delay my love
Give me give me the love of you
You will be mine
 Every day I miss you every hour
In your good eyes I look for love
I'll wait for me to wait
And I know one day my side of your side
I will live life new
 Don't even pretend
Don't even delay my love
Give me give me the love of you
You will be mine"
Silva Hakobyan,Նորահարսիկ (Noraharsik),"With a white cloth with a bride cloth
With God's blessing
You have kidded and got married
 Carefree love with heart tram
You reached your dream finally
The wedding is your big
 De Arari and Paripar
Our broves
Mezik Nazik
Sweet flower
Nairyan Bride
I want you to be happy
De Arari and Paripar
Our broves
Mezik Nazik
Sweet flower
Nairyan Bride
I want you to be happy
 Your father's fellow believer
From home you left
Your lovely
Hope with bride and fathers
Live long and be inseparable
Come back or hours
De Arari and Paripar
Our broves
Mezik Nazik
Sweet flower
Nairyan Bride
I want you to be happy
De Arari and Paripar
Our broves
Mezik Nazik
Sweet flower
Nairyan Bride
I want you to be happy
De Arari and Paripar
Our broves
Mezik Nazik
Sweet flower
Nairyan Bride
I want you to be happy
De Arari and Paripar
Our broves
Mezik Nazik
Sweet flower
Nairyan Bride
I want you to be happy"
Silva Hakobyan,Силва Акобян (Silva Akobyan),"One day my heart was offended by you
Left away left unreasonable
The lying of a close person became right
My life became unfounded

See a holiday in the heart of us now
Let me say that he has become half of life for you

I'm late I already
How to smooth my mistake
Would you only love you love you only?

I love I will love

Every time you see each other
We are always confused
Whether speaking or talking out of your love
We consider it past

My pride hurt me that I would be forgiven
And now I can't bring you back to you"
Silva Hakobyan,Իմ հերոս (Im heros),"You were my goodness
The essence of my life was
Why did you become past the present
You were my warmth
You were my happiness
Why did they contain?
For the sake of land and your nation
For the will and your honor
Went fearless to
Eternity caller
 
I have to live now
Me and you
That the half-left is your
I will do at all costs
In heavenly life
In your favorite monastery
I will pray endlessly
Talking to you my hero
 My soul has been emptied
 My heart has been broken
I'm drowning in the sea of tears
Misss and love
It's so increased
Ahkh I would have been to you now
Give God God to endure
I will stay in the land
And my soldier with my soldier in the battlefield"
Silva Hakobyan,Կիսատ եմ (Kisat em),"I was warm with you and your captive
I forgot to all in your arms
Were closed my eyes
Haven't felt losing you
Did you leave at the moment
My love had just gave me life
 
I found me half
But I'm half-hearted
You sunshine in the ice
After all of you
I am single
Am looking for you in another
 Cold wind I have a cold
I'm hugging me with memories
Your soul is by my side
DON'T DON'T SEE ONE FIRST
Or would I choose again I would choose you
My only last I love you"
Silva Hakobyan,Փոշմանել եմ (Poshmanel em),"Black were the day that I saw you
Hello gave you the appearance of your
Ohou would not be the day that I saw you
Did you masculate your son?
Say to go to the hungness
How many you like you I want to make a crown
Or not at home told me to wait
Until my big sister is to die
 Oh was extinguished the sun
Won't your warm salute on that day
Oh was extinguished the sun
Ernek didn't you give your greeting
 What truits did you make from you?
I was buried in Benzara
You walk all day round
You work to work to be avascular
Tamam Come to your side and look
Say a little I live in my nose
But come and see from your turbid
I don't see a person out of shame
 Oh was extinguished the sun
Won't your warm salute on that day
Oh was extinguished the sun
Ernek didn't you give your greeting"
Silva Hakobyan,Ինձ ներիր ներիր (Indz nerir nerir),"I lived by loving
And now with lung memories
I don't want to bring back you
The heart is my tip
Dream I don't want
I would live by loving
With nonsense in vanity
Time is a waste of van
I don't find it next to you
I don't want to love you
 Me forgive me my dear
Cant love again
Forget me you are me
Believe is lost love
There is nothing between us
Faded the love of my
 Forget me my dear
Don't try to go over again
It's way to me and you
Divided
Will never cross again
Believe me my dear
I don't regret crying
Don't worry about me no questions
Don't try to find out suddenly
Remove irrevocably
 Me forgive me my dear
Cant love again
Forget me you are me
Believe is lost love
There is nothing between us
Faded the love of my"
Silva Hakobyan,Տնից փախել եմ (Tynits pakhel em),"I wore the green clothes
I have literal to Honoraboccham
I have been hidden from secret home
I came to stand in front of your house
 Bring a day and day with a gallery
Take a hello from me to Yaris
Say to go out from the lodge
He promised let him come to the bride to take me
 I have tied my long chews
I also painted my eyes by Surtain
I have believed in your words
I came to stand in front of your house
 Bring a day and day with a gallery
Take a hello from me to Yaris
Say to go out from the lodge
He promised let him come to the bride to take me
 I wore a high heeled shoes
I have tied the pattern of the pattern
Barely barely escaped from home
I came to stand in front of your house
 Bring a day and day with a gallery
Take a hello from me to Yaris
Say to go out from the lodge
He promised let him come to the bride to take me"
Silva Hakobyan,Դե գնա (De gyna),"Whether you are tired of me
Get away with a cry
Or are you tired of your fortune
Forget. Don't shower
False and perpetrators
And sleepless nights
Which my heart is
Warm and ovate kisses
Incomplete promises
I don't want to hear you too
 Well, go, go well go well to go from my life
That I will call you again
Don't Stay Don't Stay Don't Stay Next to Me
That I will miss a love
 Or have you loved me a little
Get away with a torture
Or do you feel sorry for me a little?
Forget. Don't shower
Sweet false reasons
Silent and Lima Views
And eyes that say nothing
It's time to come
I don't want to hesitate
Leave you don't have to wait
 Well, go, go well go well to go from my life
That I will call you again
Don't Stay Don't Stay Don't Stay Next to Me
That I will miss a love
 Well go from my life
That I will call you again
Don't Stay Don't Stay Don't Stay Next to Me
That I will miss a love
 Whether you are tired of me
Get away
Or are you tired of your fortune
Forget"
Silva Hakobyan,Քեզանից հետո (Qezanitz heto),"Crazy one day
Crazy news
And and no longer hit
That the heart which one was life
Crazy one day
Crazy step
And and no longer calls me the sound of your
Which in my souls
Why Why Why?
Grief and pain turned me silently for powerless
 Tears after you turned me a friend
That my soul and my heart petrified
Life after you became my pointless
I live in Loking to live
 Crazy emotion crazy excitement
I don't believe in my eyes that
You don't like you live with us
Crazy longing crazy loss
Us fell in this life
To me and you to be called the unleavy
Why Why Why?
And for what you don't get now
 Tears after you turned me a friend
That my soul and my heart petrified
Life after you became my pointless
I live in Loking to live"
Silva Hakobyan,Ամպել է (Ampela),"Longing my heart does not stand
It's a silent look on your arrival
A letter what you don't write me
Don't you remember
Day by day I love you
Tear shed from your love dare
Musty Wildness doesn't worry me
I want to see you
 Clouded my soul is clouded
Ticket
The rain has extinguished hope
Cloud is clouded again
My yar is missing
 Clouded my soul is clouded
Ticket
The rain has extinguished hope
Cloud is clouded again
My yar is missing
 I'm alone in this world without you
Or maybe that's how it looks like that
I am writing to sing about your love
Endless waiting you
My days go unnoticed
I count the hours of meeting
De Come condition remains a condition
I'm looking for a look at
 Clouded my soul is clouded
Ticket
The rain has extinguished hope
Cloud is clouded again
My yar is missing
 Clouded my soul is clouded
Ticket
The rain has extinguished hope
Cloud is clouded again
My yar is missing
 Clouded my soul is clouded
Ticket
The rain has extinguished hope
Cloud is clouded again
My yar is missing
 Clouded my soul is clouded
Ticket
The rain has extinguished hope
Cloud is clouded again
My yar is missing"
Silva Hakobyan,Վերջ (Verj),"End ended a story
And became a memory
In the insatiable sea of memories
You don't know why suddenly
Love for me
Do you consider completed
Tell me that all this is all
Game is just nothing else
Believe that love is my eternal
It's Loking For You
Return
 Did you leave Hori Hourne Hourney Hori?
And the sunshine and good
For you who I am
I am a great sea of our love
On a shore, you passed the other
 End your decision took place
Left and left
Don't think I forgot you
I don't want to go to you guest
I'll call every time
That I will feel at least voice
 Tell me that all this is all
Game is just nothing else
Believe that love is my eternal
It's Loking For You
Return
 Did you leave Hori Hourne Hourney Hori?
And the sunshine and good
For you who I am
I am a great sea of our love
On a shore, you passed the other"
Silva Hakobyan,Ղարաբաղը մերն է (Gharabaghy mern e),"Crawling
Trembling
In the land of the sun
The Moon Who Shaghs
Armenian tells us the Armenian country
Don't you have a denial against us
Armenian tells us Armenians and wow
That the nation that would like to share in us
 
Karabakh is ours and ours
Will again be hey can't take away
Karabakh is ours and the end
Open a new page in history
We will win and put the end
 May God bless
Armenian
Has the limit
Fearless brave soldier
Glory and honor to you my Armenian country
Your hug to the Artsakh world
We are our Lord Armenian and wow
That's the tribe that you want from us"
Silva Hakobyan,Չեմ սիրում (Chem sirum),"You now come again
Kissing me uneasy
Infect me with your love
And have you made me crazy?
But I don't want your love
Cant forgive you again
And I convinced me in vain
That you will give me love more
I have learned to live without you
And I don't want to get drunk from your love
 I don't like you too
I will not become a captive lip
I don't want to believe in your lie and Pjg's words
Did you deceive you?
Forget you leave me right now
 I have now understood
You don't deserve my tears
Your love words too
I don't have any price for me
Trembling. Yours
Do not burn from your shoan
And I already don't know
What is the meaning of my life?
Heart to help me with this pain
That we will forgive my love forever my
 I don't like you too
I will not become a captive lip
I don't want to believe in your lie and Pjg's words
Did you deceive you?
Forget you leave me right now"
