Artist,Song,Translated_Lyrics
ԱՐԹՈՒՐ ՄԵՍՉՅԱՆ,ԱՀԱ ԵՎ ՎԵՐՋ,"Here is an end

End of paragraphs and lasting

As a last closed page

And no return already

Oh native bugs

You my last Last Prayer

Suburbs of prison psyche

Chain and solo

Here. And the end

In the heart of a powerless cry

Oh unfinished my song

You my last capital

Now we believe

Where is the Spirit's Church?

We won the war

But it turns out that we lost

Here. And the end

Tell me a voice from the depth

Is the mask of the mask now speaks

Which puppet is the crowd?

The song is the arrow of freedom

And the spear of myth

Bel Joschin Hayk won

Or the opposite of probably

And the pages close the myth tired

Stone Statue History Forgotten

There is no start and finish for this eternal struggle

Your Type of Elimination is delivered to Bell

Here. And the end

Hayk lost to Bell

Here. And the end

I lost in a terrible battle

The song was hit by my unfinished

But why not end

Oh native bugs

You my last Last Prayer

Printed Hoku suburbs

Chain and solo

Here. And the end

In the heart of a powerless cry

Oh unfinished my song

You my last capital

Now we believe

Where is the Spirit's Church?

We won the war

But it turns out that we lost

And the pages close the myth tired

Stone Statue History Forgotten

There is no start and finish for this eternal struggle

The abolished type is losing Bell

Here. And the end

Hayk lost to Bell"
ԱՐԹՈՒՐ ՄԵՍՉՅԱՆ,ԱՄԵՆԸ ՁԵԶ,"Large-scale and wonderful temples

And the prayer of golden tabernacles

All you and the silver flashlight of the monasteries

Khocks woven in diamond



You take you and glorious receivers

And the magician calls of holiday

All of you to leave me only

Father for Hell



And leave me only the chapel in my faith

Take part in the treasures of this world

All you and leave me memories

And the pages of my life woven from nerves



And leave me the fairy tales

And the ways woven from scams

And if I don't suddenly with the light

Weren't all prayers in vain



All will give you the advice counsel priceless

Clasp the glory of your life

And leave me my friends' hearts honest

And the crazy days given in the element



Thus torn branch like a tree of life

We were lost in this world

And on the shoulders only the burden of faith

And the sins of the ungodly century



And leave me the fairy tales

And the ways woven from scams

And if I don't suddenly with the light

Weren't all prayers in vain"
ԱՐԹՈՒՐ ՄԵՍՉՅԱՆ,ԱՆԱՌԱԿ ՈՐԴՈՒ ՎԵՐԱԴԱՐՁԸ,"When like a prodigal son

Become your own city

And seek out the door to them

Whose long have you lost



Seated

They have found

There are no words we drink silently

It's too late to late



When like a prodigal son

Back to your home

Smoothing depending on a window

Swing Shadows in the corner



When your father put your shoulder

His trembling hands

Will only be willing to slowly

It's too late to late



In a thousand foreign eyes

Find his gaze

Whoever he loved you

Waiting for your return



When like a prodigal son

Returns love

You hear a short answer

Hey is late



And to whom in which life is

Everything has its own return

I always find it late

Whatever you have lost a long ago



When like a prodigal son

Returns the conscience

You hear a short answer

It's too late to late"
ԱՐԹՈՒՐ ՄԵՍՉՅԱՆ,ԱՇԽԱՐՀԻ ՑԱՎՈՎ,"My heart with Kariy's world pain

How much suffering God my four disc

Every sea blowing from the fields of life

He will take sighing and grief



Innocent victims of blood boilers

The land will always be wet under my feet

And new judgments around me and far away

People are born with blood drunk



Will become a spoil and famine

Bright babies like light

And the foot of the foot is countless

Worker's sweat anointed



I'm how I sit on a picnic table

And drink happy enjoyment wine

Whenever people will be a haven

The raft of the mouth of the mouth of the bread



God Me How Unjust Dedicated

How can I put a stone in my conscience?

Lives:

My soul is sick with the pain of the world"
ԱՐԹՈՒՐ ՄԵՍՉՅԱՆ,ԱՌԱՋ ԳԻՏԵԻ,"I was known before

What people would be a world

Sun Why would he pour out gold?

Flower on the shores of the tree Dally

Why would the song sound?

Ago I knew now I don't know



I was known before

What did the stars say bright

Depending on the arch of the sky

Where the carshawn run is a feverish

Everage of our planet

Ago I knew now I don't know



I was known before

Why People Laugh Powder

Was mixed with crying blood and tear

And why on the ancient way of life?

Vihi would look at every tall

Ago I knew now I don't know



I was known before

What was there from life from death?

What treasures did the future have secretly

And in which unusual newfruited light

Would have opened every grave suddenly

Ago I knew now I don't know"
ԱՐԹՈՒՐ ՄԵՍՉՅԱՆ,ԱՍՏՂԵՐ,"Countless stars in the sky swimming

But people never look up to top

The views hangs always on the ground

Stornly heart What a miracle sky



The blue sun swims in the sky

The clouds but closes the sky

Shinks last drowning here

But no hearts are upset even



Pity the stars torn from the sky

The sky is paved to the ground flattened

The stars tore the torn pity

Pity sinked dreams of his"
ԱՐԹՈՒՐ ՄԵՍՉՅԱՆ,ԱՍՈՒՄ ԵՆ,"They say short of life

Makes the heart of the heart soon

But in the sun apricot

Young and old man

Here is a standing series.

Trim



They say sweet life

And the glory of the infinite country

But in the slaughter of the burlast

Beautiful against flowers

People here are a thread thread

Trim



Say deep is life

The mine of the country is light

But against the call of the rainbow

Or of stars' council

People here are a thread thread

Trim



They say new life

The call of love will always ring

But an anger without a poet

Table with salt and bread

People here are a thread thread

Trim"
ԱՐԹՈՒՐ ՄԵՍՉՅԱՆ,ԲԱՐՈՎ ՄՆԱՔ,"Doors one by one closure

Like pages past my life

Pages keep light in the heart

The rest gives the wind

And the removal of

Stay with bar



Good with good my childhood

That you still live burning in my heart

Little Violin Stone Yard

Deaf alert of exile

Fight and game

Stay with bar



Do you keep my friends?

That would share me the days old

I will remember every second

Those who already have no

Blessed be

Stay with bar



Good staying in my city

And the streets of my own

I measured you a thousand times

Faces familiar with good and gray

Irony smile and curse

I will still come

Stay with bar



I leave myself away

And bridges back I don't burn

I'm leaving that I will become

A thousand closed doors

Now I'll go

Stay with bar



Good with the last my love

The moment of loss is silent and petrified lips

Night Night Hands Pressed

And the doors of the loss open

I closed

Stay with bar



Stay barefeated days

Sleepless thousand my nights

Stay with good words worn

Faces tired

The doors of the new deceitful doors open

I do not believe

Stay with bar



Last loss with good

The last my hope is

Dream Last:

I leave the most

Of all kinds of false games

I don't play

Stay with bar"
ԱՐԹՈՒՐ ՄԵՍՉՅԱՆ,ԴԱՏԱՐԱՆ,"Tied up for a long time with your eyes with palasses

Rustled the scales of your hand for centuries

Stole the weights of your conscience

You are the righteousness you are hey



I mourned I idols my old and new

I won't stand in front of you

I'm imprisoned for life this life

And already punishment is that with the highest article



I burned all the doors open and closed

Locks Take You Hay Memory

I sewed the white wings in black thread

I'm telling me you won't fly to break jump"
ԱՐԹՈՒՐ ՄԵՍՉՅԱՆ,ԴԻՄԱԿԱՀԱՆԴԵՍ,"That I rely on the words

That hopes to Parur

And to make my soul again

And to whatever call

That I will be guided by a lighthouse

Who will steel the dagger my back



Which voices will I get

Which pains will I know

That in the dark I will I will crumble again

And which ly I will believe

What will I get up again?

And what sacram will I leave life?



Trees of indefinite trees

In the streets of our lives

Hide our votes

In leaf veins

And yellow parchments

On the sidewalks browse

And the land is inherited



That I will bless the light of the eyes

That I rely on the psalm

And who will kick my violin with cold

And whom hate hate hate

Whose magical love worship

Which losses will I centage?



In which city to disappear?

That I have been in the cell cell

And whose mask do I pour out of his face?

Which lights will I be blind?

Which pain are you?

Whose bullet will I leave with life?



Trees of indefinite trees

In the streets of our lives

Hide our votes

In leaf veins

And yellow parchments

On the sidewalks browse

And I inherit the Mormok of the land



That I will bless the light of the eyes

That I rely on the psalm

And who will kick my violin with cold

And whom hate hate hate

Whose magical love worship

Which losses will I centage?"
ԱՐԹՈՒՐ ՄԵՍՉՅԱՆ,ԵՍ ՁԵԶ ԱՍՈՒՄ ԵՄ...,"I tell you the famine of the spirit

And you will give a luxury table

You will fall with a murry

Nostalgiating the sublime word of speech



Inspent to the mockery

A bright discase of the spirit Thought and dream

You danced drunk in the temple of the material

Forgot the immortal fear of immortal



You have ironicized the power of creative

The famine of the spirit will enter your material

And like a beggar for crumbs

Thirsty and note to sea sea"
ԱՐԹՈՒՐ ՄԵՍՉՅԱՆ,ԵՍ ՉԳԻՏԵՄ,"I have two houses close

Do you have two hearts?

Do you have a contact with two wings?

Don't have two Lords



Play a game with my soul

Dance with my heart of my heart

Call to my Monastery call

THEY SAYATNOV ARE



Plowed with a duducle breath

I will endure my spirit pain

The world's lies will go blind

I will leave the jealous poison



Ordered Gusa with mockery

My songs hostage

The throat's voice has been snatched

The conscience of these people has disappeared



Play a game with my soul

Dance with my heart of my heart

Call to my Monastery call

THEY SAYATNOV ARE






Word of Sayat Nova Arthur Meschyan

Music Sayat Nova


"
ԱՐԹՈՒՐ ՄԵՍՉՅԱՆ,ԵՍ ՓՈԽՈՒՄ ԵՄ ՍԼԱՔՆԵՐԸ,"I am changing the arrows

The last time in Yerevan

I don't know my way is my open

Or will I get to the red light?



Hey what do I know?



The snow white velvet tablecloth

I will cover the tracks I leave

In this silence in this silence

Maybe one melody will be heard







Is a multifaceted choir

Freelable

The wires on stage are silent

Where are you next to my dreamy



The gold trap ordered

He didn't go to you in his miracles

I convey my violin to you

Be my friend Blessed



I am changing the arrows

I'm leaving yet

The last stop is ahead

Where are you next to my dreamy



The snow white velvet tablecloth

I will cover the tracks I leave

In this silence in this silence

Maybe one melody will be heard







I am changing the arrows

Perhaps the last time

I don't know my way is my open

Or will I get to the red light?



Hey what do I know?



The snow white velvet tablecloth

My past traces will cover

In this silence in this silence

It may be heard per melody"
ԱՐԹՈՒՐ ՄԵՍՉՅԱՆ,ԵՐԲ ԻՄԱՍՏԱԶՈՒՐԿ Է ԼԻՆՈՒՄ,"When the days are nailed like a fly

To the yellow pages of your calendar

Months to month are pointless

Like the leaves of your life tree



When the strained clock spring

The ax is swing on your neck

The past is slowly meaningless

The present is also a numb of your foot



Life is meaningless meaningless

When it turns into an endless struggle

The struggle is also deviled

When it turns into a life meaning



The empty pedestal lost meaning

Waiting for the next idol sculpture

When a standing statue is failing

Time is always abling again



Street and garden are meaningless

To the back of the meaningless city

Homes are also meaningless

When it turns into a shelter



It has been meant to be meaningless

Born in Herastor Tours

Meaning has even been meaningless

It doesn't have a runner



Hands are idle meaningless

Became a sad Sunday every day

In the brain, they nail day by day

Reasons for the Probability without reason



My shipwrecking my boat

It's been a break on the shores of salvation again

When my children sleeping with the underground

Meanly waking up and look at me



Their eyes shimmering lights

The flesh of the ice is crushed

Inability to snatch bands

And my life is again meaningful"
ԱՐԹՈՒՐ ՄԵՍՉՅԱՆ,ԵՐԳԸ ԽՂՃԻ,"Fear When Your Heart Karuy

The wound has no conscience of cure

Day and nights to do

Before the path of the lifetime

You can't be sad too

Conscience for painful pain

Every drop of conscience

Kiyna hidden and impertle

Fear When your conscience spare

Military

And it will become a Lord and scribe

Life Bloody Each Pain

Having your eyes against your eyes

Should the sin of sin?

The troop should step hard

The overshadowed in the world

Fear when your face is always smiling

But the conscience of the Kariun's conscience

When will you share the bread of a person?

But blood will come to the bread"
ԱՐԹՈՒՐ ՄԵՍՉՅԱՆ,ԵՐԵԿ ԵՎ...,"Yesterday sad today happy

I applause like a channel

Yesterday to Unknown

I'm coming to the coast today



I smile silently small and big

Or laughing like crazy

I'm dedicated to the sands

Like the desert river



I'm devoted to unwavering

Me where the smiles take

Every passerby in my laughter

The tired soul is washing



Whenever a fog is tomorrow

And tears will be born of pain

Maybe one of the little sparkle

Back from my laughter



Yesterday sad today happy

I applause like a channel

Yesterday to Unknown

I'm coming to the coast today"
ԱՐԹՈՒՐ ՄԵՍՉՅԱՆ,ԵՐԿԻՐ ՀՆԱՄՅԱ,"Country ancient country native

No star bright and no moon

Your eternal charm don't have

Beyond the clouds beyond the mountains



No matter how much you are Suram from

No matter how many foreign lands

Vacant to the means of disordination

I slayed my native home



You first love and last longing

Memories boat happy and painful

I will always be on my lip

Maternal Kiss My Missing Sad



Country of Ancient Earth Papen

Your spirit of the spirit native language

Fear and longing for your spirit

What am I without you only homeless



Cloudy winter or bright spring

Tear Valley or Paradise

I will call you. I will call you

I will live in my house with you"
ԱՐԹՈՒՐ ՄԵՍՉՅԱՆ,ԶԱՐՄԱՆՈՒՄ ԵՄ ԵՍ,"I will be able to get pure water from the source

And then one moment clinging to the present I will be surprised

How it was all suddenly all of us changed

They say every dream and hope again



I wonder about a thousand doors in front of us

I wonder if we divide us

Wonder me and again I don't understand

And my head hangs all over my life I'm looking for my nation



I'm not surprised again the Burret of Tools

I wonder again from my people who endure

I wonder and I'm not afraid of a foreign enemy

The tabernacle was destroyed and long ago



During the plague, one is widespread

The output took the mask of their face ashamed

WILL BE CONSIDERED BY A BROUND WITHOUT BROUND

Condemning the remains of a luxurious burial



I wonder if the head lost from the re-

We are already in the past already watered

I wonder if nothing changes in this world

The wheel broke the wheel again in his favorite pit



I wonder if I am empty and idle something hopes

I wonder if I'm not surprised anything

Deaf and obedient evil from this great world

And from the roads leading to the abyss of the people"
ԱՐԹՈՒՐ ՄԵՍՉՅԱՆ,ԷԼ ՈՉ ՄԻ ՎԻՇՏ,"No mourning no mourning

No sorrow or in the blanks

No empty hope or prayer

Or crystal dream carefree

There were ages



Binds and sobs

Our old pain is enough to mourn

Full foolish consolation

I'm tired of



How many traces of emigration?

How many houses without smoke?

As a witness

Still outstanding our debts



How much prayer to unarmed vessel

And feats of individuals

Idle skulls

Without a body and an



There was only a mask of trust

Only shadow courage

And allegedly ended

The slap is strong in our history



This is the prayer of our century

This is the message of our tree

This gray crush

History and our soil



And the world has not changed

And they haven't changed to the sun

Look at your faces today

Look at your eyes today

I'm tired of



What was yesterday the same today

The same both is almighty

And split crumbs

A nation



Look at each other look into your

What is the powerful winner forever?

And what is the cross of faith?

Who is our father?



We are already enough to cheat each other

As long as you will not be late we are still

As long as the sword is adopted

On the way is still



No mourning no mourning

No sorrow or in the blanks

No empty hope or prayer

Or crystal dream carefree

There were ages"
ԱՐԹՈՒՐ ՄԵՍՉՅԱՆ,ԹՌԻՉՔ,"Tied with a tight pallas with your eyes

Hanging your hand to scales rusty

Like that your weights were stolen

Justice you are blind and scary

You are a statue that you judge my fortune

You are my heart hands the woles

Licking and dusty volumes

Where all my sins have written

And the caliber is a bullet



I mourned the old and new idols my

You won't see me scare kneeling

My life has already imprisoned me life

You won't be afraid of the highest article

You are a statue that you judge my fortune

You are my heart hands the woles

Licking and dusty volumes

Where all my sins have written

And the caliber is a bullet



Semi-flying in my dream

And silent troper of lights

What I didn't understand today

What a star I don't

And what a fairy tale that I didn't live

At all without alarms

I handed over to the next life



Wings I sewed my body to my body

I approached I edged into your fortress enclosure

And I looked at the sky with a silent smile

Screaming stop you'll go on a bird leap"
ԱՐԹՈՒՐ ՄԵՍՉՅԱՆ,ԻՄ ՏԱՐԻՆԵՐԸ,"My years of dry crutch

Blank sounds on the streets

How can I get to you?

My hot vein my childhood

When the years delete me



Close or old or new

Clean was love my first

A passioned passion for a new longing

That approached with his lips

That unclean only cross



I tasted and wean and mourning

And blinded with his glitter

Crowd of people

And losses both old or new

And begging for my homeland



Here is standing in front of me

I have seen it or hear that

Out of Death Mask

Oh approaching cries

And new shades of old lie



White Dream White Eyes

Grumbling

White dry white ship

Thirst for unrealistic life

And time stopped



White mountain against my eyes

And our way to white vision

And our glance

And unaware hearts of free

Like stone pour down



Melodic language cut

Oh vision is dead and alive

Found me in that darkness

I took me out of the night

Broaded throat my friend



He touched like a blind

His song is silent and life short

He was just a word to me whispered to me

So half and heart hang

I turned around but he wasn't"
ԱՐԹՈՒՐ ՄԵՍՉՅԱՆ,ԽԱՉՄԵՐՈՒԿ,"Lost goes away from each of our violins

You need a band where drums possess

Where every melody blows only the brass

When there are no wire voices they are soloists



You will not forgive you that you didn't decide never your will

Didn't you have left and left anticipation of the end of the game

Will not for you when you get back when the stupid passions marry

Once the builders will be required after demolition



You will not forgive you that you have not lost the temple of the Spirit

That you judged the incident that spelled yourself

That you don't make a drunken in the pubs of life

And don't lose numbesting in a foolish role of the suffering



Have you seen a chick

Where only the blacks are played

Thrown out of life stage

The whites leave silently"
ԱՐԹՈՒՐ ՄԵՍՉՅԱՆ,ԽՈՒԼ ՀԱՌԱՉԱՆՔԻ,"Deaf groaning pain from the Mormol

You are not always defined by the same night

A lucky game is a cruel second

Pass open front-back



Mysterious in this life stage

Today in uncompromising silence

Tomorrow you will happen to light

If you don't lose in steppes and become homeless



Dead hopeful faith

You were not the guard in a sake of the grave

This is just a temptation sleep that will pass

Only not the light of the stage



Four sided waves threatening wild

While pushing under your steps of your

You know smiling nerves

That you don't skate before the herd



This is your way to load patience

You are not you from a half-dry root

Let them hit you and rejoice for a moment

You keep your pulse on the coming battles and look away



And one thing be careful to listen to your breast

Holidays of Heads secretly

That will call you to your big dream

Flower to eruptive nerves



When freedom doors associated with

The dog will launch guards you

And at least one day at least one second

Become the particle of mankind carefree



You will still stick to a silent and a lounge of a foreign

And like a beast survived

Through the barrier of gray views

Nothing in the foot of the sky Networks and fuzzy hopes



And at least one day at least one second

Throw away from your shoulder to the Memory

Hourly flooded while looking at heaven

And don't call where you were God"
ԱՐԹՈՒՐ ՄԵՍՉՅԱՆ,ՀԱՂՈՐԴՈՒԹՅՈՒՆ (ԱՇԽԱՐՀԸ ԱՅՍ ԲԱԺՆՎԵԼ Է),"The world has been divided

A thousand and a different pieces

They say a long time ago

Every Late piece is a country

Captive to his patching laws

And a man sharing a human

Proached to those rags



Every half is an empire

Either a state or colony of someone

Boundary barbed

Body on the blue planet



One of those half is our country

Related to stone anchors with reef

Half-bound stake pressed

Grumbling half of the lights

And half a piece of bread



And when it is shared at the face of the face of the world

Shared fights and meat grinder abandoned incomplete detachments

Shared the last bullet and coat

From the previous war

And you're closing with your body

The corridor of new losses

I hate old and new half-fits

In the middle which shared my soul

I'm already bored with half a mob

From a quarter pastors of half thieves

And the train fading on halfway we push



I hate half-faded nationals

From Ramik gentlemen I'm in Zarzand

Else something I won't remember



The body of the tree again will give sprouts on the threshold of spring

Again your window in the light of the dark life

Only to stand your heart to a thousand shots shared

Don't kill the wings on the road shared in your flight

Listen to the Time Sharitable Zars Listen

A tune not distributed yet

Close the opened doors of losses

And don't be mixed with the crowd



Hey Blessed be the unity of our crazy

I hate you captive to half

I am with you who are dancing from pain

I am with you who will the will of his strain

Mocking the fate of fate"
ԱՐԹՈՒՐ ՄԵՍՉՅԱՆ,ՀԱՂՈՐԴՈՒԹՅՈՒՆ (ՊԱՐ),"Father Our Miracle Falling

Source Luso You are two

Holy Name Your

Lord Our Higher You Creator

And come to the kingdom

Will be will be your extremely

As heaven and heavier

You are only silent in the ruler of the universe



We are mercy on thee

When which fields are our abandoned

And we pray forgiveness

For our sins, because we are dependent

It is said to forgive them

Whoever is defiled by my country's temple

Maybe else and forgers

But we never remember the past



And don't take a test

But life is our only test

And the Lord of the Lord is saved

But why are you what are we free

For it is yours and the kingdom and power

And glory you are the ruler

Now and always and forever

We will lose while you are immortal"
