Artist,Song,Lyrics
Harout Pamboukjian,Լեռան Լանջին (Leran Lanjin),"Լեռան լանջին խոր նիրհում են ֆիդայիներ հավիտյան,
Ազատ քնել միշտ սիրում են զավակները հայության,
Եկեք գնանք հայ աղջիկներ հասնինք ենտեղ Սիմ լեռան,
Ազգի պաշտպան ֆիդայիններ մեզի համար զոհ դառան:
 Հասնինք քաջանց սուրբ գերեզման, թափինք արցունք աչքերից,
Մեր հայրենյաց հողին պաշտպան զրկվեցանք քաջերից,
Ահա հասանք հայ օրիորդներ երգինք մեղմիկ միասին,
Թափենք արցունք, դնենք ծաղիկ նահատակած սուրբ շիրիմին:
 Հյուսենք պսակ իրենց գլխին վարդ, մանուշակ, մեխակից,
Երդվենք նրանց հիշատակին չվախենանք տանջիկից,
Մեզի համար զոհ գնացին Թաթուլի պես վեհ քաջեր,
Որ ննջում են լեռան լանջին ազատության մարտիկներ:
 Մեզի համար զոհ գնացին Սիմոնի պես պես վեհ քաջեր,
Որ ննջում են լեռան լանջին ազատության մարտիկներ:
 Մեզի համար զոհ գնացին Վիգենի պես պես վեհ քաջեր,
Որ ննջում են լեռան լանջին ազատության մարտիկներ:
 Մեզի համար զոհ գնացին Հայոց ազգի վեհ քաջեր,
Որ ննջում են լեռան լանջին ազատության մարտիկներ:
 "
Harout Pamboukjian,Հասնենք Սասուն (Hasnenq Sasun),"Msho dashter shoghne patel [bad word] djerer varar,
Ernenk [bad word] het gan
Lav lur beren mer hamar.
 Sasna tsarer, mtank dzorer
Kriv kenink anveher.
Kach Droi zenker kotrel
Pstik Vahan lats kener.
 Hasnenk Sasun mtnenk Van,
Moush, Alashgerd, Ardahan,
Azgi heros ktrichner
Hayreniki prkutian.
 Yelek tgherk el zham chka
Shun turk patele chors koghm,
Gevorge el chverchatsuts,
Turker tsrvan hazar koghm.
 Hanets tapets sur pampushtner,
Koghkin engav akh kashtets,
Sarer, dzorer kdghrden,
Gevorg chaush kborer.
 Hasnenk Sasun mtnenk Van,
Moush, Alashgerd, Ardahan,
Azgi heros ktrichner
Hayreniki prkutian.
 Zarkets kaytsak, mtnets yerking,
Shun turkerin patets lats,
Veri saren prtsek khmbov
Prtsek, ichek depi tsats.
 Demits Andranikne giker,
Yur ersunyot kadjerov,
Zerkek tgherk, mernim dzezi,
Turkin verch kga mi or.
 Hasnenk Sasun mtnenk Van,
Moush, Alashgerd, Ardahan,
Azgi heros ktrichner
Hayreniki prkutian.
 "
Harout Pamboukjian,Մշո Աղջիկ (Msho Aghchik),"Էս ի՜նչ սիրուն պատկեր ունես...
Էս ի՜նչ սիրուն պատկեր ունես,
Հայ ոսկեծամ Անահիտն ես,
Մշո աղջիկ, էդ ինչ լավն ես...
Հայ ոսկեծամ Անահիտն ես,
Մշո աղջիկ...
Մշո աղջիկ...
Մշո աղջիկ, էդ ինչ լավն ես...
 Հեռացե՜լ եմ ես քո մոտեն...
Հեռացե՜լ եմ ես քո մոտեն,
Արբեցել եմ համ ու հոտեն,
Մշո աղջիկ, էդ ինչ լավն ես...
Արբեցել եմ համ ու հոտեն,
Մշո աղջիկ...
Մշո աղջիկ...
Մշո աղջիկ, էդ ինչ լավն ես...
 "
Harout Pamboukjian,Սառը ջուր (Sary jur),"Առավոտից իրիկուն ջուր եմ ծախում
Սառը ջուր
Ջուր գնեցեք, սառը ջուր
Պուլպուլակից այս պուճուր
 Ջուր եմ ծախում, սառը ջուր
Պուլպուլակից այս պուճուր
 Մայրս տանը մեն-մենակ
Ինձ կսպասե աչքը ջուր
Ջուր եմ ծախում, սառը ջուր
Որ հաց տանեմ մի պուճուր
 Ջուր եմ ծախում, սառը ջուր
Պուլպուլակից այս պուճուր
 Քույրս տանը իմ պուճուր
Ինձ կսպասե աչքը ջուր
Քույրս տանը իմ պուճուր
Լաց կլինե աչքը ջուր
 Ջուր եմ ծախում, սառը ջուր
Պուլպուլակից այս պուճուր
 Ջուր եմ ծախում, սառը ջուր
Որ հաց տանեմ մի պուճուր
 "
Harout Pamboukjian,Ալ այլուղս( Ay Ayloughs) (Al ayluġs),"Ալ Այլուղդ
 Աղջիկ.
Այլուղս կորավ ձեր դուռը,
Սրտես դուրս չի գա մրմուռը,
Բախտը ինձ գցեց քո դուռը, յարո ջա՜ն,
Սիրուն տղա, տուր այլուղս:
 Տղա.
Ալ այլուղդ ինձ մոտ չկա,
Երդվում եմ քեզ, հոգիս վկա,
Ով գտել է՝ թող բերի տա, յարո ջա՜ն,
Սիրուն աղջիկ, քո այլուղը:
 Աղջիկ.
Այլուղս յարիս բաշխածն էր,
Ալ աբրեշումով նախշած էր,
Պատկերս վրեն քաշած էր, յարո ջա՜ն,
Սիրուն տղա, տուր այլուղս:
 Տղա.
Սևուկ աղջիկ, սպիտակ հագիր,
Առ այլուղդ, վերքս կապիր,
Սիրուդ գերի, ինձ մի տանջիր, յարո ջա՜ն,
Էրված աղջիկ, առ այլուղդ:
 "
Harout Pamboukjian,"Օ, քամի, քամի (O, qami, qami)","Լուսնի աղոտ արտացոլում, աչքերիդ մեջ, աչքերիդ մեջ,
Դեմքիդ ժպիտը հուսահատ, հուսահատ վերջ, հուսահատ վերջ,
 Ես այսօր թողնում եմ քեզ իմ սեր ու հեռանում,
Իմ սրտին այսօր մի նոր վերք է ավելանում,
Ու իմ սերը պոկված ճյուղի, պոկված ճյուղի, ճյուղի նման
Օրորվում է աշնան քամուց, աշնան քամուց, աշնան քամուց:
Օ, քամի, քամի պոկիր իմ սերն առանց ցավի,
Հետո համբուրիր պլոկված կեղևը ծառի,
Թող վերքը ցավ չպատճառի, ծառին թող ցավ չպատճառի:
 Ախ գոնե լաց եղիր, մե թեկուզ ձայն ասիր,
Բայց այդպես մի նայիր, բայց այդպես մի նայիր:
Ախ գոնե լաց եղիր, մե թեկուզ ձայն ասիր,
Բայց այդպես մի նայիր, բայց այդպես մի նայիր:
 Աստղերը չռել են աչքերը ու նայում են ապշած մեզ վրա,
Մի սպանեք, մի սպանեք ձեր սերը, դուք երկրորդը էլ չեք ունենա:
 Ես այսօր թողնում եմ քեզ իմ սեր ու հեռանում,
Իմ սրտին այսօր մի նոր վերք է ավելանում,
Ու իմ սերը պոկված ճյուղի, պոկված ճյուղի, ճյուղի նման
Օրորվում է աշնան քամուց, աշնան քամուց, աշնան քամուց:
Օ, քամի, քամի պոկիր իմ սերն առանց ցավի,
Հետո համբուրիր պլոկված կեղևը ծառի,
Թող վերքը ցավ չպատճառի, ծառին թող ցավ չպատճառի:
 Ախ գոնե լաց եղիր, մե թեկուզ ձայն ասիր,
Բայց այդպես մի նայիր, բայց այդպես մի նայիր:
Ախ գոնե լաց եղիր, մե թեկուզ ձայն ասիր,
Բայց այդպես մի նայիր, բայց այդպես մի նայիր:
 Օ քամի քամի պոկիր իմ սերն առանց ցավի,
Հետո համբուրիր պլոկված կեղևը ծառի,
Օ քամի քամի պոկիր իմ սերն առանց ցավի,
Օ քամի քամի պոկիր իմ սերն առանց ցավի:
 "
Harout Pamboukjian,Կյանքի կարուսել (Kyanqi karusel),"(Տուն 1).
Ա՜խ, ինչ դժվար էր բաժանման պահին,
Վերջին խոսքերն էի ասում իմ յարին,
Թողեց, հեռացավ արցունքն աչքերին
Ու պատճառ դարձավ սրտիս վերքերի...
Անկեղծ սիրելը շատ դժվար բան է`
Սիրող տղայի հոգին կհանե,
Երդվում եմ, երբեք չեմ սիրի կյանքում,
Որպեսզի բուժեմ ցավերն իմ հոգու։
 (Կրկներգ).
Պտտվի՛ր կյանքի կարուսել,
Սիրո կարոտից այս երգն եմ հյուսել,
Դե՛ ժպտա բախտ իմ խռոված,
Թող, որ հանդարտվի հոգիս մոլորված։ (x2)
 (Տուն 2).
Ու առանց սիրո տառապում եմ ես,
Սիրած յարիս եմ տենչում խենթի պես,
Նույնիսկ ուզում եմ տեսնել երազում,
Բայց նրա մասին երազ չեմ տեսնում...
Ա՜խ, ինչո՞ւ սերս հուշ-երազ դարձավ,
Կարծես չի տեսել կյանքում վիշտ ու ցավ,
Երդվում եմ, երբեք չեմ սիրի կյանքում,
Որպեսզի բուժեմ ցավերն իմ հոգու։
 (Կրկներգ)։
 (Տուն 2)։
 (Կրկներգ)։
 "
Harout Pamboukjian,Քսան տարեկան (Kʻsan tarekan),"Մենք չենք լինի քսան տարեկան,
Մեր կյանքում երջանկություն, որ խշշում էր առանց առիթ,
Անհատուն գանձ, սիրո բարիք,
Որով լցված էր իմ հոգին:
 Ու ես հիշում եմ իմ մանկության անհատուն գանձը,
Բարության առաջին սեր, որ երբեք չի կրկնվի,
Կարապի մի երգ, որ երգվում էր
Մի անգամ, վերջին անգամ:
 Մենք չենք լինի էլ քսան տարեկան,
Ախ, դեռ երեկ, տարիներն ո՞ւր անցան:
Փնտրում եմ ձեզ հիմա, իմ առաջին սիրո քնքշանք,
Մենք չենք լինի էլ քսան տարեկան:
 Ո՞վ կտա ինձ երազները իմ մանկության:
Այն օրերը, երջանկություն կփնտրեմ ձեզ մինչ վերջ,
Անցած գարուն երազների,
Անցաք սակայն իմ մեքընդմիշտ:
 Ով շուտ անցած քսան տարի,
Անցած իմ սեր երկնի բարի ,
Համբույn անգին, որ երբեք չի կրկնվի,
Տարավ իր հետ անկրկնելի, դու միշտ եղիր, միշտ եղիր:
 Մենք չենք լինի էլ քսան տարեկան,
Ախ, դեռ երեկ տարիներն ո՞ւր անցան:
Փնտրում եմ ձեզ հիմա, իմ առաջին սիրո քնքշանք,
Մենք չենք լինի էլ քսան տարեկան:
 "
Harout Pamboukjian,"Հ՛եյ ջան, ղափամա (H՛ey ǰan, ġapʻama)","[Կրկներգ 2x]
Հ՛եյ ջան, ղափամա:
Համով, հոտով ղափամա:
Հ՛եյ ջան, ղափամա:
Համով, հոտով ղափամա:
 Բախչեն հասած դդումը,
Կտրինք, բերինք մեր տւնը,
Վրա շաքար լցրեցինք,
Թոնրի մեջ կախեցինք:
Եկան էլ հեր ու հորկուր,
Եկան էլ մեր ու մորկուր,
Եկան քեռի, քեռեկին,
Խնամի ու տեկերիկին,
Եկան սանիկ, սանահեր,
Հարսնաքուր ու հարսնախպեր,
Եկան մոտիկ հեռավոր
Զոքանչ, կեսրար ու քավոր:
Ջաաաн:
Հ՛եյ ջան: Հ՛եյ ջան: Հ՛եյ ջան: Հ՛եյ ջան:
Ջաաաн:
Հ՛եյ ջան: Հ՛եյ ջան: Հ՛եյ ջան: Հ՛եյ ջան:
 [Կրկներգ 4x]
Հ՛եյ ջան, ղափամա:
Համով, հոտով ղափամա:
Հ՛եյ ջան, ղափամա:
Համով, հոտով ղափամա:
 Գդալ առած եկան տուն
Հարյուր հոգի անկշտում,
Ես ի՞նչ անեմ, ի՞նչ անեմ,
Հարյուր հոգուն մեկ դդում:
Եկան էլ հեր ու հորկուր,
Եկան էլ մեր ու մորկուր,
Եկան քեռի, քեռեկին,
Խնամի ու տեկերիկին,
Եկան սանիկ, սանահեր,
Հարսնաքուր ու հարսնախպեր,
Եկան մոտիկ հեռավոր
Զոքանչ, կեսրար ու քավոր:
Ջաաաн:
Հ՛եյ ջան: Հ՛եյ ջան: Հ՛եյ ջան: Հ՛եյ ջան:
Ջաաաн:
Հ՛եյ ջան: Հ՛եյ ջան: Հ՛եյ ջան: Հ՛եյ ջան:
 [Կրկներգ 2x]
Հ՛եյ ջան, ղափամա:
Համով, հոտով ղափամա:
Հ՛եյ ջան, ղափամա:
Համով, հոտով ղափամա:
 Հ՛եյ ջան, ղափամա:
Համով, հոտով ղափամա:
Հ՛եյ:
 "
Harout Pamboukjian,Գարուն չկա (Garun čʻga),"Մշո դաշտեր իմ սիրուն
Նոր էր բացվել վառ գարուն
Գարուն չկա մեզ համար
Պիտի կռվինք անդադար
Չունինք հանգիստ ու դադար:
 Սիփան սարին մանրիկ ուռ
Սասնո կռիվն էր մռմուռ
Հարս ու աղջիկ բռնեցին,
Մանուկներ կոտորեցին
Հեյ վախ, հեյ վախ Սասուն։
 Մարութա բարձրիկ սարին
Ֆիդայիներ երդվեցին
Ազատության մեր արդար
Պիտի կռվինք անդադար
Պիտի կռվինք անդադար:
 Աղբյուր Սերոբին հասան
Հայ քաջերը դիրք մտան
Անդրանիկին օգնեցին
Թշնամուն կոտորեցին
Ազատեցին Մուշ Սասուն:
 Թող թշնամիք իմանան
Ֆիդայի ենք իսկական
Կկոտորենք աջ ու ձախ
Կամավոր ենք, չունինք մահ:
 Գևորգ Չավուշը մեր քաջ
Գոռում էր՝ առա՜ջ, առա՜ջ
Աստված մեզի օգնական
Կռվով մտնենք Տաճկաստան
Փրկենք երկիր Հայաստան:
 Խմբերով քառսուն-քառսուն
Հասնինք Տարոն ու Սասուն
Մտնենք Տարոն ու Սասուն:
 Աստված մեզի օգնական
Կռվով մտնենք Տաճկաստան
Փրկենք երկիր Հայաստան:
 Խմբերով քառսուն-քառսուն
Մտնենք Տարոն ու Սասուն
Քաջերին տո՛ւր Սասուն:
 "
Harout Pamboukjian,Երեքնուկ (Yereqnuk),"Ա՜խ, ես գիտե՛մ, չէի՜ր սիրում,
Հիմա գիտեմ ես անկասկած...
Վազվզում ենք մենք սեզերում, (x2)
Խոտերի մեջ խոնավ ու թաց:
 Հետո նստում ուրախ ու գոհ,
Երեքնուկի թուփ ենք քաղում
Եվ այդ ծանոթ երեքնուկով (x2)
«Սիրեմ-սիրեմ» անվերջ խաղում:
 [Կրկներգ]
Չէի՛ր, չէի՛ր ինձ սիրում...
Թե չէ – ի՞նչ է, բա՞րդ էր այդքան
Գտնել երեք անուններում
Իմ անունը գեթ մեկ անգամ: (3x)
 Անուններում երեք հոգու
Եվ դո՛ւ կաս միշտ, և ե՛ս միշտ կամ:
Քո անունն եմ ես միշտ պոկում, (x2)
Բայց դու իմը` ո՜չ մի անգամ:
 Որքա՜ն անգամ եմ ես վանել
Տխուր մտքերն ինձնից հեռու
Եվ վախեցել եմ միտք անել, (x2)
Որ դու երբեք ինձ չես սիրեմ:
 [Կրկներգ]
Չէի՛ր, չէի՛ր ինձ սիրում...
Թե չէ – ի՞նչ է, բա՞րդ էր այդքան
Գտնել երեք անուններում
Իմ անունը գեթ մեկ անգամ:
 Չէի՛ր, չէի՛ր ինձ սիրում...
Թե չէ – ի՞նչ է, բա՞րդ էր այդքան
Գտնել երեք անուններում
Իմ անունը գեթ մեկ անգամ: (x3)
 "
Harout Pamboukjian,Մոգական լապտերիկ (Mogakan lapterik),"Մոգական լապտերիկը գլանակ է դատարկ,
Հայելիներ կան նրա մեջ` բյուրեղներ գունազարդ,
Միայն մի շարժում` կփոխվեն և նրանք,
Նայելիս կտեսնես նոր պատկեր մի հրաշք,
Մոգական լապտերիկ` գույների սիրուն խաղ,
Պատկերներ, որ ստեղծվում ու կորչում են անդարձ:
Մոգական լապտերիկ` գույների սիրուն խաղ,
Պատկերներ, որ ստեղծվում ու կորչում են անդարձ:
 Ինչքան ուզում ես ցնցիր ու շարժիր
Պատկերները հին էլ ետ չեն գա նորից:
Գունավոր բյուրեղները չեն գա նախկին դիրքին`
Անկիրք ու սառն է սորուն ապակին,
Գունավոր բյուրեղներ` լույսի տակ խնդուն,
Կույր կույր հանդիպում եք, կույր կույր բաժանվում:
Գունավոր բյուրեղներ` լույսի տակ խնդուն,
Կույր կույր հանդիպում եք, կույր կույր բաժանվում:
 Ամեն մարդ փնտրում է իր երկրորդ կեսին,
Որի հետ նոր գույն տա ու փարվի լույսին,
Բայց աշխարհը մեծ է ու մարդիկ շատ քիչ,
Դժվար է գտնել հարազատ կեսին,
Բայց աշխարհը մեծ է, մարդիկ` փոքրաթիվ,
Դժվար է գտնել հարազատ կեսին:
Բայց աշխարհը մեծ է, մարդիկ` փոքրաթիվ,
Դժվար է գտնել հարազատ կեսին:
 Կյանքը, ընկերներ, լապտերիկ է կախարդ,
Շուռումուռ է տալիս մարդկանց անշտապ,
Հրճվում է ստեղծած իր պատկերներից,
Երբ որ ձանձրանում է ջնջում է նորից,
Մոգական լապտերիկ է մեր կյանքը կախարդ,
Իսկ մենք ստեղծված մի կարճ ակնթարթ:
Մոգական լապտերիկ է մեր կյանքը կախարդ,
Իսկ մենք ստեղծված մի կարճ ակնթարթ:
 Բայց մարդիկ ենք մենք, ոչ թե ապակի,
Անկյանք էլ չենք մենք, այլ մահկանացու
Ու երբ հանդիպում ենք` եկ չբաժանվենք,
Դրանով հաղթենք դաժան մահին մենք,
Ապրենք միասին, մեռնենք միասին,
Մոգական լապտերիկը մանկան խաղ է սին։
Ապրենք միասին, մեռնենք միասին,
Մոգական լապտերիկը մանկան խաղ է սին։
 "
Harout Pamboukjian,Ազատ ոգին Հայաստանի (Azat vogin Hayastani),"Ազատ ոգին Հայաստանի բռնեց կոկորդը ոսոխի,
Սարսափահար փախավ գնաց լկտի ոհմակը գայլերի,
Արդար ուժերը հայրենի խենթ պայքարով մտան Շուշի
Զարկեցին թուրքին վայրենի, հարցն էր Հայոց, արդարացի:
 Զավակներն ենք Հայաստանի մեր աննման,
Թուրք շներից կազատենք մեր Նախիջևանն,
Աչքս ճամփին Մուշ, Ալաշկերտ, Կարս , Անի, Վան,
Սեգ Մասիսներ` կանգնած հպարտ ու անսասան,
Հիշեք` ծովից ծով է եղել հին Հայաստանն,
Վերջը կտանք շուն թշնամու խարդախության:
 Ուժն է եռում երակներում մեր լեռնական, մեր Արցախյան,
Կամքն է մեխվել հայոց հողում ու դաշտերում Ղարաբաղյան,
Թող ուժ առնեն ջոկատները մեր հայկական, ֆիդայական,
Որ ետ բերեն սուրբ հողերը մեր հայրական, պապենական:
 Զավակներն ենք Հայաստանի մեր աննման,
Թուրք շներից կազատենք մեր Նախիջևանն,
Աչքս ճամփին Մուշ, Ալաշկերտ, Կարս , Անի, Վան
Սեգ Մասիսներ` կանգնած հպարտ ու անսասան,
Հիշեք` ծովից ծով է եղել հին Հայաստանն,
Վերջը կտանք շուն թշնամու խարդախության:
 "
Harout Pamboukjian,"Հիշիր, սիրելիս (Hišir, sirelis)","Անցել ենք արդեն մեր սիրո ճամփով,
Մոռացումների տխուր ու մոլոր արահետը մութ,
Չենք սիրում իրար խելագարի պես,
Ժպտում ենք թեթև, մեծահոգորեն, լուռ սիրողների:
 [Կրկներգ]
Հիշիր, սիրելիս, մեր սերը անցած,
Որքան երազներ ու ոսկե հուշեր
Ցնդեցին անդարձ:
 Հիմա, երբ չկաս, որ գրկես ինձ, սեր,
Ցուրտ է ու պարապ առանց քեզ, իմ սեր,
Աշխարհը արար:
 Ու այն ամպի պես` անձրևի կարոտ,
Իմ սրտով անցավ` մեղմիկ ու մոլոր,
Անցավ ու գնաց, գնաց:
 Դողաց սրտիս մեջ իր հետքը խոնարհ,
Ու ստիպեց նորից կարոտելու քեզ
Ու անցավ, գնաց:
 [Կրկներգ]
Հիշիր, սիրելիս, մեր սերը անցած,
Որքան երազներ ու ոսկե հուշեր
Ցնդեցին անդարձ:
 Հիմա, երբ չկաս, որ գրկես ինձ, սեր,
Ցուրտ է ու պարապ առանց քեզ, իմ սեր,
Աշխարհը արար:
 [Կրկներգ]
Հիշիր, սիրելիս, մեր սերը անցած,
Որքան երազներ ու ոսկե հուշեր
Ցնդեցին անդարձ:
 Հիմա, երբ չկաս, որ գրկես ինձ, սեր,
Ցուրտ է ու պարապ առանց քեզ, իմ սեր,
Աշխարհը արար:
 "
Harout Pamboukjian,Նրանք ընկան (Nranq ynkan),"Նրանք ընկան, տառապյալ ու անզոր
Որբացած, անտունի, տարագիր պանդուխտներ
Ավաղ, ընկան, անարգված ու վիրավոր
Անշիրիմ արյունով, խոշտանգված էակներ:
 Նրանք ընկան, մոռացված ամենքից,
Թշվառներ, լքված, անկարեկից ու անօգ
Ավաղ, ընկան, մոռացված աշխարհից,
Ու մահվամբ շղթայված, մեռնում են անողոք:
 Երբ գարուն էր սիրավառ, զարդանքի վարդաբույր,
Մինչ հայրենի հողից հեռացված դառնագին:
Մարդկության հեգվացված էակներ ամենուր
Անշիրիմ ու խոշտանգված, ատելի ամենքին:
 Նրանք ընկան, անզոր, անվերադարձ,
Եվ չկար մարդկություն, չկար խիղճ ու աստված,
Ամտարբեր ու անզգա, մնացին թշվառ,
Մորմոքներ կրծքիս ներս, լուռ մարեցին:
 Նռանք ընկան, տենչերով անավարտ,
Երգերով, վերքերով, երբ գարուն էր բուրավետ:
Երբ նրանք ունեին սիրո երգ ու հավատ
Բայց, ավաղ, թաղվեցին, լուռ ու մունջ առհավետ:
 Նրանք ընկան, որբացած, վիրավոր,
Մի անմեղ ժողովուրդ, երբ ուներ հող հայրենի,
Մինչ մորմոքում է դեռ սիրտս հեգ, մենավոր,
Նրանց բյուր ցավերից, նրբանցին հայ գերին:
 Սակայն մենք ինչպես Փյունիկ հառնեցինք,
Հավատով սրբազան, տենչերով սիրասուն,
Երբ Հայկի և Արայի, ազգն ենք հայանուն
Եվ ունենք հայրենիք, Արարատ և Սփյուռք:
 Նրանք ընկան, բայց ոչ լուռ, մոռացված,
Ապրում են հավերժում, սուրբ հավատով լեցուն
Եվ իմ այս հայկական խոսքերով մեր Մաշտոցյան
 "
Harout Pamboukjian,Թող վերջին անգամ (Togh verjin angam),"(Տուն 1).
Հուշ դարձան արդեն
Մեր օրերը երջանիկ բախտի,
Թող սիրով անքեն
Քեզ իմ սիրտը խնդություն մախթի:
Թող վերջին անգամ
Արցունքներս քո դեմքով հոսեն,
Հոսեն քո դեմքով, հոսեն քո դեմքով
Ու լեզուս կարկան
Շշնջա սիրո խոսքեր:
 (Կրկներգ).
Գնաս բարով, իմ սեր
Էլ իզուր ես ինձ նայում տրտում
Գուցե գտնես նոր սեր,
Եվ այդ նորը պարգևի խնդում
Ազատ ճախրիր հեռու,
Թող օհրնանքս միշտ քեզ հետ լինի,
Ժպտում եմ ու ներում, քեզ, իմ սեր:
 (Կրկներգ).
Թո'ղ այդպես լինի,
Երբ մարել է սրտիդ հուրն անհետ.
Ող ինչպես գինի
Սիրո հուրը միշտ մնա ինձ հետ:
Երբ մրսի հոգիս իմ
Կխմեմ այն թրթիրով մի ջերմ,
Մի ջերմ թրթիրով
Ու նրա խորքից
Կլսեմ սիրո խոսքեր:
 (Կրկներգ):
 "
Harout Pamboukjian,Գնդակ որոտաց (Gndak orotacʻ),"Գնդակ որոտաց նոյեմբեր ամսուն,
Պաշարված ենք մենք, սիրուն իմ Սոսե, (x2)
Զենքեր վեր առնենք, քաջություն հոսե,
Քո սիրած Սերոբի ուխտյալ օրն այս է: (x2)
 Ձայն տվավ Սոսեն. - Սերոբ ջան հոս եմ,
Զինված պատրաստված, ձայնիդ կսպասեմ, (x2)
Ամեն օր, ամեն ժամ, քո կողքին մեռնելու,
Քեզի հետ մեռնելու, պատրաստ է Սոսեն: (x2)
 Ձայն տուր, Անդրանիկ, կենսատու ընկեր,
Արդյոք այս ժամին որտե՞ղ ես պառկել, (2x)
Գանգրահեր մազերդ թիկունքիդ ես թափել,
Հաղթական բազուկով մոսինդ ես գրկել: (2x)
 Հարձակենք հրացան հեռուեն մոտեն,
Թող սարսի սուլթան ելդիզ պալատեն, (2x)
Պարզենք դրոշակ վեհ Դաշնակցության,
Կեցցէ՜ Քրիստափոր, Ռոստոմ, Զավարյան: (2x)
 Դե հասե՛ք, շուտ հասե՛ք օգնության,
Սերոբ կզոհվի ի սեր ազգության: (2x)
 "
