Artist,Song,Lyrics
Silva Hakobyan,Գիշեր (Gisher),"Գիշեր է
Իմ հոգին դատարկ է ու անսեր
Ես ուզում եմ երազել
Ես ուզում եմ քեզ սիրել
Ես ուզում եմ քեզ ներել
Բայց ուշ է
Իմ հոգում մշուշ է ու թախիծ
Հեռացել ես ինձանից
Թողնելով ինձ կես ճամփին
Մոռացել ես իմ մասին
Կոուրացել էր քո հոգին
 Ես չեմ ուզում քեզ մոռանալ
Իմ անցյալից լուռ հեռանալ
Այս խաբկանքին այս տանջանքին
Անհնար է դիմանալ
Ես չեմ կարող քեզ մոռանալ
 Սիրել եմ
Քո սիրուց արբած չեմ նկատել
Որ ուրիշն է քեզ գերել
Որ ուրիշն է քեզ տիրել
Ուրիշին ես դու սիրել
Լռել եմ
Հավատով սպասել եմ որ կգաս
Քո սխալը դու կզգաս
Եվ նորից ինձ սեր կտաս
Իմ կյանքին նոր շոունչ կտաս
Քո հոգով ինձ կյանք կտաս
 Ես չեմ ուզում քեզ մոռանալ
Իմ անցյալից լուռ հեռանալ
Այս խաբկանքին այս տանջանքին
Անհնար է դիմանալ
Ես չեմ կարող քեզ մոռանալ
 Ես չեմ ուզում քեզ մոռանալ
Իմ անցյալից լուռ հեռանալ
Այս խաբկանքին այս տանջանքին
Անհնար է դիմանալ
Ես չեմ կարող քեզ մոռանալ
 Ես չեմ ուզում քեզ մոռանալ
Իմ անցյալից լուռ հեռանալ
Այս խաբկանքին այս տանջանքին
Անհնար է դիմանալ
Ես չեմ կարող քեզ մոռանալ
 "
Silva Hakobyan,Իմն Ես (Imn Es),"Քեզ տեսա, ու հոգիս միանգամից փայլեց,
Հասկացա, որ իմ կյանքը սիրով լցվեց,
Խելագար իմ հոգին լուռ սիրահարվեց
Ես զգացի՝ ես գիտեմ, որ սիրում եմ քեզ:
 Էլ մի, էլ մի ձևացրու
Էլ մի ուշացրու սերն իմ,
Տուր ինձ, տուր ինձ սերը քո
Դու իմն ես լինելու:
 Ամեն օր, ամեն ժամ կարոտում եմ քեզ
Քո բարի աչքերում ես որոնում եմ սերը
Կաղոթեմ, կսպասեմ
Ու գիտեմ մի օր քո կողքին,սիրելիս
ես կապրեմ կյանքը նոր:
 Էլ մի, էլ մի ձևացրու
Էլ մի ուշացրու սերն իմ
Տուր ինձ, տուր ինձ սերը քո
Դու իմն ես լինելու:
 "
Silva Hakobyan,Նորահարսիկ (Noraharsik),"Հարսի շորով, ճերմակ քողով
Աստծու օրհնությամբ
Դու հարսիկ դարձար ու ամուսնացար
 Անհոգ սիրով, սրտի դողով
Երազանքիդ հասար դու վերջապես
Հարսանիքն է քո մեծ
 Դե արի-արի ու պարի-պարի
Մեր նորահարսիկ
Հեզիկ նազիկ
Անուշ ծաղիկ
Նաիրյան հարսիկ
Ուզում եմ որ դու լինես երջանիկ
Դե արի-արի ու պարի-պարի
Մեր նորահարսիկ
Հեզիկ նազիկ
Անուշ ծաղիկ
Նաիրյան հարսիկ
Ուզում եմ որ դու լինես երջանիկ
 Ճերմակ հագած, հերի դարձած քո հայրական
Տանից դու հեռացար
Քո սիրուն հասար
Հարս ու փեսով, սիրու հույսով
Ապրեք երկար ու լինեք անբաժան
Հետ արի և թե ժամ
Դե արի-արի ու պարի-պարի
Մեր նորահարսիկ
Հեզիկ նազիկ
Անուշ ծաղիկ
Նաիրյան հարսիկ
Ուզում եմ որ դու լինես երջանիկ
Դե արի-արի ու պարի-պարի
Մեր նորահարսիկ
Հեզիկ նազիկ
Անուշ ծաղիկ
Նաիրյան հարսիկ
Ուզում եմ որ դու լինես երջանիկ
Դե արի-արի ու պարի-պարի
Մեր նորահարսիկ
Հեզիկ նազիկ
Անուշ ծաղիկ
Նաիրյան հարսիկ
Ուզում եմ որ դու լինես երջանիկ
Դե արի-արի ու պարի-պարի
Մեր նորահարսիկ
Հեզիկ նազիկ
Անուշ ծաղիկ
Նաիրյան հարսիկ
Ուզում եմ որ դու լինես երջանիկ
 "
Silva Hakobyan,Силва Акобян (Silva Akobyan),"Մի օր սիրտս քեզնից նեղացավ
Թողեց հեռացավ, անհիմն
Մոտիկ մարդու սուտը ճիշտ դարձավ
Կյանքս դառնացավ, անհիմն
😔😔😔😔😔😔😔😔😔😔😔😔😔😔😔😔😔
Մեզ բաժանողի սրտում հիմա մի տոն է տես
Ավելին ասեմ նա քեզ համար դարձել է կյանքի կես
😔😔😔😔😔😔😔😔😔😔😔😔😔😔😔😔😔
Ուշացել եմ ես արդեն
Իմ սխալը ոնց հարթեմ
Թե կուզես երդվեմ, որ սիրում եմ միայն քեզ
😔😔😔😔😔😔😔😔😔😔😔😔😔😔😔😔😔
Սիրել եմ, կսիրեմ
😔😔😔😔😔😔😔😔😔😔😔😔😔😔😔😔😔
Ամեն անգամ իրար տեսնելիս
Շփոթվում ենք միշտ անձայն
Թե իմ, թե քո սիրուց խոսելիս
Համարում ենք այն անցյալ
😔😔😔😔😔😔😔😔😔😔😔😔😔😔😔😔😔
Իմ հպարտությունն ինձ խանգարեց, որ քեզ ներեմ
Իսկ հիմա շատ ուշ է, չեմ կարող քեզ հետ բերել
 "
Silva Hakobyan,(Orer) Որեր (Orer),"Moranal kez anhogut eh, meke chem porci
Anehncat spasume hort eh, meke chem pohvi
Hogis kez mot eh, guce annkat guce ahot eh
Gone, gone, gone, gone hervic sirem
 Anund shurteris anverch pahum em
Keznov aprum em
Orer,orer,orer
Kang arek
Ancyals nerkayum amur pahum em
Hushov aprum em
Orer, orer, orer
Mi lrek
 Miguce ev mekhavor em,vor du heracar
Menutyane ansovor em, ur anhetacar
Spasums zure, guce avelin, guce andure
Gone, gone, gone
Gone asa kgam
 Anund shurteris anverch pahum em
Keznov aprum em
Orer,orer,orer
Kang arek
Ancyals nerkayum amur pahum em
Hushov aprum em
Orer, orer, orer
Mi lrek
 Mi lrek
 "
Silva Hakobyan,Գիտես (Gites),"гитес кез сирумем
гитес ерб асумем
вор ду линес
кохкис апрес индз hет hаверж
байц ду индз хапумес
у лур hет кангнумес
амен ангам ми нор патчарэс hоринус
ду индз чес сирум
 индз ми гэта индз ми хэхча
ай сирирь,сирирь ду индз
петк чен ко кехц
хоскерн анверц
вор шоен датарк hокис
 Гитес ворь нерумем
гитес вор спасумем
кэгас ми ор ,кэгас байц уше линелу
арден hаскацелем вор ес кез кoрцрелем
гэна hеру
гэна кез hет тар сере ко
hушери нерко
 индз ми гэта индз ми хэхча
ай сирирь,сирирь ду индз
петк чен ко кехц
хоскерн анверц
вор шоен датарк hокис
 индз ми гэта индз ми хэхча
ай сирирь,сирирь ду индз
петк чен ко кехц
хоскерн анверц
вор шоен датарк hокис
 "
Silva Hakobyan,Իմ հերոս (Im heros),"Դու իմ բարությունն էիր,
Կյանքիս էությունն էիր,
Ինչու՞ ներկայից անցյալ դարձար:
Դու իմ ջերմությունն էիր,
Իմ երջանկությունն էիր,
Արև,իմ ԱՐԵՎՆ ինչու՞ տարար:
Հանուն հողի ու քո ազգի,
Հանուն կամքի ու քո պատվի ,
Գնացիր անվախ դեպի
Հավերժությունը կանչող...
 (Կրկներգ).
Ես հիմա պիտի ապրեմ
Իմ ու քո փոխարեն,
Որ կիսատ թողածը քո
Ամեն գնով կատարեմ,
Երկնային կյանքում,
Քո սիրած վանքում
Կաղոթեմ անվերջ`
Խոսելով քեզ հետ, իմ Հերոս...
 Հոգիս դատարկվել է,
 Սիրտս կոտրվել է,
Արցունքի ծովում խեղդվում եմ ես:
Կարոտս ու սերս
Այնքան շատացել է
Ա՜խ, ոնց կգրկեի հիմա ես քեզ:
Ուժ տու՛ր Աստված, որ դիմանամ,
Մարմին դարձած հողում մնամ,
Ու մարտի դաշտում ընկած իմ Զինվորով զորանամ:
 (Կրկներգ):
 "
Silva Hakobyan,Կիսատ եմ (Kisat em),"Տաք էի քո կողքին և քո գերին
Քո գրկում մոռանում էի ամենքին
Փակ էին իմ աչքերը
Չեմ զգացել քեզ կորցնելը
Հեռացար այն պահին, երբ
Սերդ ինձ նոր էր կյանք տվել
 (Կրկներգ).
Ես գտա ինձ կես
Բայց կիսատ եմ ես
Դու արև ես՝ սառույցի մեջ
Ախր առանց քեզ
Միայնակ եմ ես
Ուրիշի մեջ ես փնտրում եմ քեզ
 Ցուրտ քամի, ես մրսում եմ
Հուշերով ինձ գրկում եմ
Քո հոգին իմ կողքին է
Չի շոյում, մեկ է զգում եմ քեզ
Թե նորից ընտրեի ես կընտրեի քեզ
Իմ միակ, վերջինն ես, ես սիրում եմ քեզ
 (Կրկներգ):
 "
Silva Hakobyan,Ինձ ներիր ներիր (Indz nerir nerir),"Ես ապրում էի սիրելով
Իսկ հիմա լոք հուշերով
Ետ բերել քեզ չեմ ուզում
Սիրտն է իմ այդպես հուշում
Երազել ես չեմ ուզում
Ես ապրումեի սիրելով
Անիմաստ զուր հույսերով
Ժամանակն իզուր վատնում
Քո կողքին ես չեմ գտնում
Քեզ սիրել ես չեմ ուզում
 Ինձ ներիր ներիր ինձ սիրելիս
Չեմ կարող սիրել նորից
Մոռանանք ես քեզ դու ինձ
Հավատա կորել է սերը ջինջ
Մեր միջև չկա ոչինչ
Մարել է սերը իմ
 Մոռացիր ինձ սիրելիս
Մի փորձիր անցնել նորից
Այն ճամփան որ ինձ ու քեզ
Բաժանել է իրարից
Չի հատվի երբեք նորից
Հավատա ինձ սիրելիս
Չեմ զղջում չեմ լալիս
Չի հուզում ինձ ոչ մի հարց
Չփորձես պարզել հանկարծ
Հեռացիր անվերադարձ
 Ինձ ներիր ներիր ինձ սիրելիս
Չեմ կարող սիրել նորից
Մոռանանք ես քեզ դու ինձ
Հավատա կորել է սերը ջինջ
Մեր միջև չկա ոչինչ
Մարել է սերը իմ
 "
Silva Hakobyan,Փոշմանել եմ (Poshmanel em),"Սև լիներ օրե էն որ քեզ տեսա
Բարև տվիր տեսքովդ հիացա
Ախ չլներ օրե էն որ քեզ տեսա
Թակ տղա էիր տեսքովդ հիացա
Ասի գնամ խոնջես-բողջես հավաքեմ
Քանի քեզ պես ուզող ունեմ փսակվեմ
Թե չէ տանը ինձ ասում էին որ սպասեմ
Մինչև որ իմ մեծ քրոջը փսակեն
 Ախ մարել են արևը արևը
Չլներ էդ օրվա քո ջերմ բարևը
Ախ մարել են արևը արևը
Էռնեկ չառնեի քո տված բարևը
 Քեզնից ինչ խերվեցի որ առա
Հոգսերի մեջ թաղվեցի բեզարա
Ողջ օրը քայլում ես շիվարած
Աշխատում ես աշխատես ավարած
Թամամ արի ունեցվացքիդ ու տեսքիդ
Ասի մի քիչ ես էլ ապրեմ քիթս ցից
Բայց արի տես աննպատակ քո դարդից
Դուրս չեմ գալիս մարդ չեմ տեսնում ամոթից
 Ախ մարել են արևը արևը
Չլներ էդ օրվա քո ջերմ բարևը
Ախ մարել են արևը արևը
Էռնեկ չառնեի քո տված բարևը
 "
Silva Hakobyan,Տնից փախել եմ (Tynits pakhel em),"Կանաչ-կարմիր շորերս հագել եմ
Խոնջա-բոխչաս դրել եմ կապել եմ
Թաքուն թաքուն տնից պախել եմ
Եկել եմ ձեր տան դիմաց կանգնել եմ
 Գիշեր ու ցերեկ մի խաբար բերեք
Ինձանից յարիս մի բարև տարեք
Ասեք դուրս գա դուրս գա էն դրնից
Խոսք է տվել թող գա հարս տանի ինձ
 Երկար ծամերս հյուսել կապել եմ
Աչքերս էլ սուրնայով ներկել եմ
Քո խոսքերին հավատացել եմ
Եկել եմ ձեր տան դիմաց կանգնել եմ
 Գիշեր ու ցերեկ մի խաբար բերեք
Ինձանից յարիս մի բարև տարեք
Ասեք դուրս գա դուրս գա էն դրնից
Խոսք է տվել թող գա հարս տանի ինձ
 Բարձրակրունկ կոշիկս հագել եմ
Նախշուն ակերով գոտիս կապել եմ
Հազիվ հազիվ տնից փախել եմ
Եկել եմ ձեր տան դիմաց կանգնել եմ
 Գիշեր ու ցերեկ մի խաբար բերեք
Ինձանից յարիս մի բարև տարեք
Ասեք դուրս գա դուրս գա էն դրնից
Խոսք է տվել թող գա հարս տանի ինձ
 "
Silva Hakobyan,Դե գնա (De gyna),"Թե հոգնել ես ինձանից
Հեռացիր մի լացիր
Թե հոգնել ես քո բախտից
Մոռացիր մի տախծիր
Սուտ ու փուչ պատճառներ
ՈՒ անքուն գիշերներ
Որն իմ սիրտն է փոթորկել
Ջերմ ու պաղ համբույրներ
Անավարտ խոստումներ
Չեմ ուզում էլ քեզ լսել
 Դե գնա դե գնա դե գնա դե գնա իմ կյանքից
Որ նորից քեզ կանչեմ
Մի մնա մի մնա մի մնա մի մնա իմ կողքին
Որ սիրուդ կարոտեմ
 Թե սիրել ես ինձ մի քիչ
Հեռացիր մի տանջիր
Թե խղճում ես ինձ մի քիչ
Մոռացիր մի տախծիր
Քաղցր սուտ պատճառներ
Լուռ ու մունջ հայացքներ
ՈՒ ոչինչ չասող աչքեր
Ժամանակն է եկել
Չեմ ուզում երկմտել
Հեռացիր պետք չէ սպասել
 Դե գնա դե գնա դե գնա դե գնա իմ կյանքից
Որ նորից քեզ կանչեմ
Մի մնա մի մնա մի մնա մի մնա իմ կողքին
Որ սիրուդ կարոտեմ
 Դե գնա իմ կյանքից
Որ նորից քեզ կանչեմ
Մի մնա մի մնա մի մնա մի մնա իմ կողքին
Որ սիրուդ կարոտեմ
 Թե հոգնել ես ինձանից
Հեռացիր
Թե հոգնել ես քո բախտից
Մոռացիր
 "
Silva Hakobyan,Քեզանից հետո (Qezanitz heto),"Խենթ մի օր
Խենթ մի լուր
Եվ և այլևս չի զարկում
Այն սիրտը որ որը կյանքն էր իմ
Խենթ մի օր
Խենթ մի քայլ
Եվ և այլևս չի կանչում ինձ ձայնը քո
Որը իմ հոգում եր
Ինչու ինչու ինչու
Վիշտն ու ցավը լուռ ինձ դարձրին անզոր
 Քեզանից հետո արցունքն ինձ ընկեր դարձավ
Որ բուժի հոգիս ու իմ սիրտը քարացած
Քեզանից հետո կյանքն իմ անիմաստ դարձավ
Ես ապրում եմ լոք ապրելու համար
 Խենթ զգացմունք խենթ հուզմունք
Ես աչքերիս չեմ հավատում որ
Դու չկաս չես ապրում մեզ հետ
Խենթ կարոտ խենթ կորուստ
Մեզ այս կյանքում բաժին ընկավ
Հենց ինձ ու քեզ որ կոչվենք անբախտ
Ինչու ինչու ինչու
Եվ ինչի համար դու չկաս հիմա
 Քեզանից հետո արցունքն ինձ ընկեր դարձավ
Որ բուժի հոգիս ու իմ սիրտը քարացած
Քեզանից հետո կյանքն իմ անիմաստ դարձավ
Ես ապրում եմ լոք ապրելու համար
 "
Silva Hakobyan,Ամպել է (Ampela),"Կարոտ իմ սրտիկս էլ չի դիմանում
Քո գալու ճամփին է լուռ նայում
Մի նամակն ինչ է, որ դու ինձ չես գրում
Միթե չես հիշո՞ւմ
Օրեցօր ես ավելի եմ քեզ սիրում
Քո սիրո դարդից արցունք թափում
Մնաս բարով, մրոտելն ինձ չի հուզում
Քեզ տեսնել եմ ուզում
 Ամպել է, հոգիս ամպել է
Տիկ-տակ-տակ
Անձրևը հույսս մարել է
Ամպել է, նորից ամպել է
Իմ յարը անհետ կորել է
 Ամպել է, հոգիս ամպել է
Տիկ-տակ-տակ
Անձրևը հույսս մարել է
Ամպել է, նորից ամպել է
Իմ յարը անհետ կորել է
 Առանց քեզ մենակ եմ ես այս աշխարհում
Կամ գուցե այդպես է ինձ թվում
Քո սիրո մասին երգեմ եմ ես գրում
Քեզ անվերջ սպասում
Իմ օրերն են աննկատ անցնում, գնում
Հանդիպման ժամերն եմ ես հաշվում
Դե արի, պայմանը պայման է մնում
Ես քեց եմ որոնում
 Ամպել է, հոգիս ամպել է
Տիկ-տակ-տակ
Անձրևը հույսս մարել է
Ամպել է, նորից ամպել է
Իմ յարը անհետ կորել է
 Ամպել է, հոգիս ամպել է
Տիկ-տակ-տակ
Անձրևը հույսս մարել է
Ամպել է, նորից ամպել է
Իմ յարը անհետ կորել է
 Ամպել է, հոգիս ամպել է
Տիկ-տակ-տակ
Անձրևը հույսս մարել է
Ամպել է, նորից ամպել է
Իմ յարը անհետ կորել է
 Ամպել է, հոգիս ամպել է
Տիկ-տակ-տակ
Անձրևը հույսս մարել է
Ամպել է, նորից ամպել է
Իմ յարը անհետ կորել է
 "
Silva Hakobyan,Сердце на ладонях (Serdtse na ladonyakh),"(1ый куплет):
Я забыла как звучат
Твои тёплые слова
Те которые шептал
Ты меня любимой звал
И кружилась голова
 (2ой куплет):
А когда ты уходил
О любви молчала ночь
Поделив любовь на два
Будто замерли слова
И не в силах нам помочь
 (Припев):
Я тебе в ладонях протяну
Своё сердце и мечты - ведь они теперь твои
Забери! Мне больше ни к чему
Сердце без твоей весны и без твоей любви
 (3ий куплет):
Я не знала что любовь
Будет болью от разлук
И разбитые мечты
Словно крик из пустоты
В поисках любимых рук!
 (4 куплет):
Но я верю что любовь
Приведёт тебя назад
Словно птица в небесах
Принесёт в твоих глазах
Лишь о нас поющий взгляд.
 (Припев):
Я тебе в ладонях протяну
Своё сердце и мечты - ведь они теперь твои
Забери! Мне больше ни к чему
Сердце без твоей весны и без твоей любви
 "
Silva Hakobyan,Say It Too,"(Chorus/Припев):
Не поняла, что это за любовь себе лгала - не думала, не знала, не ждала
Откуда ты свалился на меня, твои слова, звучат как ла-ла-ла ла
Just tell me why, one look at you and i am feeling high
Without you by my side i want to cry, the two of us can can make it to our flight
Right here tonight, i wanna hear you say it
 (Verse/Куплет 1):
You know, it's hard to be lonely, without
Without anyone by my side
I ride in this jurney - and nothing could stop me until i looked straight in your eyes
The way that you look is divine
I feel all the shivers down my spine
I wont ever stop till your mine
Believe in this moment and say it to me
 (Chorus/Припев):
Не поняла, что это за любовь себе лгала - не думала, не знала, не ждала
Откуда ты свалился на меня, твои слова, звучат как ла-ла-ла ла
Just tell me why, one look at you and i am feeling high
Without you by my side i want to cry, the two of us can can make it to our flight
Right here tonight, i wanna hear you say it
 (Verse/Куплет 2):
You know, I fell for you right from the start
I knew that you'll stay in my heart
Your bright as the sun and i want you to come and ignite our beautiful life
And don't understand, it's alright
As long as you never stop the fight
We feel this emotion tonight
So stay in this moment
 (Chorus/Припев):
Не поняла, что это за любовь себе лгала - не думала, не знала, не ждала
Откуда ты свалился на меня, твои слова, звучат как ла-ла-ла ла
 "
Silva Hakobyan,Վերջ (Verj),"Վերջ ավարտվեց մի պատմություն
ՈՒ դարձավ հիշողություն
Հուշերի անհագ ծովում
Դու չգիտեմ ինչու հանկարծ
Սերը իմ հանդեպ տածած
Համարում ես ավարտված
Ինձ ասա որ սուտ է այս ամենը
Խաղ է ընդամենը ուրիշ ոչինչ
Հավատա որ սերը իմ անմար է
Այն լոք քեզ համար է
Վերադարձիր
 Հոռու հոռու հոռու հոռու հեռացար
Եվ արևս և բարևս մոռացար
Քեզ համար ես ով եմ
Մեր սիրո մեծ ծով եմ
Մի ափին ես մյուսին էլ դու անցար
 Վերջ որոշումդ կայացավ
Թողեցիր ու հեռացար
Չկարծես թե մոռացա քեզ
Վերջ չեմ ուզում քեզ հյուր կգամ
Կզանգեմ ամեն անգամ
Որ գոնե ձայնով քեզ զգամ
 Ինձ ասա որ սուտ է այս ամենը
Խաղ է ընդամենը ուրիշ ոչինչ
Հավատա որ սերը իմ անմար է
Այն լոք քեզ համար է
Վերադարձիր
 Հոռու հոռու հոռու հոռու հեռացար
Եվ արևս և բարևս մոռացար
Քեզ համար ես ով եմ
Մեր սիրո մեծ ծով եմ
Մի ափին ես մյուսին էլ դու անցար
 "
Silva Hakobyan,Ղարաբաղը մերն է (Gharabaghy mern e),"Սողալով եկար,
Դողալով գնա,
Արևի երկրում
Լուսինն ու՞մ շուննա,
Հայ են ասում մեզ, հայի երկիր
Մեր դեմ անզոր ես մի՛ հերքիր
Հայ են ասում մեզ, հայ ենք ու վայ
Էն ազգին, որ կուզի մեզնից փայ...
 (Կրկներգ).
Ղարաբաղը մերն է ու մերն է եղել,
Էլի կլինի ՀԵ՛Յ, չեք կարող խլել,
Ղարաբաղը մերն է, մերն է ու վերջ՛
Պատմության մեջ բացե՛ք նոր էջ
Հաղթելու ենք մենք ու դնենք վերջ:
 Թող Աստված օրհնի
Հայաստանիս,որ
Սահմանին ունի
Անվախ, քաջ զինվոր,
Փառք ու պատիվ քեզ իմ հայ երկիր
Արցախ աշխարհին քո գրկիր,
Մենք ենք մեր տերը, հայ ենք ու վա՛յ
Էն ցեղին, որ կուզի մեզնից փայ
 (Կրկներգ):
 "
Silva Hakobyan,Չեմ սիրում (Chem sirum),"Դու հիմա նորից եկել
Համբուրում ես ինձ անդադար
Քո սիրով ինձ վարակել
ՈՒ դարձրել ես ինձ խելագառ
Բայց քո սերը չեմ ուզում
Չեմ կարող ներել քեզ էլի
ՈՒ իզուր ես համոզում
Որ կտաս ինձ սեր ավելի
Ես առանց քեզ սովորել եմ ապրել
ՈՒ չեմ ուզում քո սիրուց էլ հարբել
 Չեմ սիրում էլ քեզ
Չեմ դառնա էլ գերի շուրթերիդ
Չեմ ուզում էլ ես հավատալ սուտ ու փուջ խոսքերիդ
Խաբեցիր դու ինձ անխնա սերը իմ վարեցիր
Մոռացիր դու ինձ հենց հիմա ինձանից հեռացիր
 Ես հիմա եմ հասկացել
Արժանի չես իմ արցունքին
Քո սիրո խոսքերը էլ
Ինձ համար չունեն ոչ մի գին
Դողացող ձերքերը իմ
Չեն այրվում էլ քո շոյանքից
ՈՒ արդեն ես չգիտեմ
Որն է իմաստը կյանքիս
Սիրտ ինձ օգնիր դիմանամ այս ցավին
Որ մենք ընդմիշտ մոռանանք սերը իմ
 Չեմ սիրում էլ քեզ
Չեմ դառնա էլ գերի շուրթերիդ
Չեմ ուզում էլ ես հավատալ սուտ ու փուջ խոսքերիդ
Խաբեցիր դու ինձ անխնա սերը իմ վարեցիր
Մոռացիր դու ինձ հենց հիմա ինձանից հեռացիր
 "
